ticker,name,price,marketcap,volume,volumeavg,priceopen,low,high,close,change,changepct,closeyest,date,high52,low52,beta,shares,pe,eps,sector,industry,description,exchange,ceo,country,ipodate,isetf,isfund,isactive,web_url,image,currency,employees,city,state,phone,address,dividend_yield,fetched_at,profile_fetched_at,asset_class,returnOnEquity,returnOnAssets,grossMargin,operatingMargin,profitMargin,revenueGrowth,earningsGrowth,revenue,ebitda,freeCashFlow,netIncome,stockBasedComp,priceToBook,evToEbitda,evToRevenue,totalDebt,totalEquity,totalAssets,cash,expenseRatio,currentRatio,quickRatio,debtToEquity,payoutRatio,pegRatio,heldPctInsiders,heldPctInstitutions,shortPctFloat
RILY,"BRC Group Holdings, Inc.",8.255,354115296,279954,1003072,8.865,8.15,8.87,8.255,-0.555,-6.299663,8.81,2026-07-02,,,1.174,40194696,0.605498,14.55,Financial Services,Financial Conglomerates,"BRC Group Holdings, Inc., through its subsidiaries, provides financial services in North America, Australia, Europe, the Middle East, Africa, Asia, and Latin America. The Capital Markets segment offers investment banking and institutional brokerage services; direct lending services to middle market companies; and equity research. This segment is also involved in trading equity securities; institutional sales and trading; securities lending; proprietary trading; direct lending; and loan origination and underwriting. The Wealth Management segment provides retail brokerage, investment management, insurance, accounting and tax preparation services to individuals and families, small businesses, nonprofits, trusts, foundations, and endowments; and investment management, retirement planning, education planning, wealth transfer and trust coordination, and lending and liquidity solutions. The Lingo segment resells plain old telephone services (POTS), broadband data services, and managed security services, as well as cloud voice, POTS alternative, and business collaboration communication services. The magicJack segment offers non-interconnected voice-over-IP cloud-based communications services; and related devices and subscription services. The Marconi Wireless segment provides mobile phone voice, text, and data services and devices under the Credo Mobile brand. The UOL segment dial-up and digital subscriber line services under the NetZero and Juno brands; and paid and free e-mail subscription services. The Consumer Products segment designs, manufactures, and sells consumer and enterprise productivity products comprising laptops and tablet cases, backpacks, universal docking stations, and computer accessories. The company was formerly known as B. Riley Financial, Inc. and changed its name to BRC Group Holdings, Inc. in January 2026. BRC Group Holdings, Inc. was founded in 1973 and is headquartered in Los Angeles, California.",NGM,Mr. Bryant Richard Riley,United States,,false,false,true,https://www.brcgh.com,,USD,1380,Los Angeles,CA,310 966 1444,11100 Santa Monica Blvd.,,2026-07-02T15:12:56+00:00,2026-07-02T12:26:33+00:00,Equity,,0.2862,0.22699,0.40155,0.5077,1.134,,1045238016,,,455156992,13974000,4.004546,,0.855,1456264960,-171533000,1706592000,948929024,,4.178,3.901,1068.175,0,,0.30286,0.25819,0.1143
RIO,Rio Tinto Group,94.779999,151810637824,693050,2564283,93.790001,93.730003,95.309303,94.779999,1.43,1.53187,93.349998,2026-07-02,,,0.646,1254501913,15.328406,6.09,Basic Materials,Other Industrial Metals & Mining,"Rio Tinto Group engages in exploring, mining, and processing mineral resources worldwide. The company operates through Iron Ore; Aluminium and lithium; and  Copper segments. The Iron Ore segment engages in the iron ore mining, and salt and gypsum production in Western Australia. The Aluminum and lithium segment is involved in bauxite mining; alumina refining; and aluminium smelting, and recycling, as well as mining and processing of lithium. The Copper segment engages in mining and refining of copper, gold, silver, molybdenum, and other by-products and exploration activities. It also owns and operates open pit and underground mines; and refineries, smelters, processing plants and power, and shipping facilities. The company was founded in 1873 and is headquartered in London, the United Kingdom.",NYQ,"Mr. Simon Callas Trott BSc(Hon), GAICD, GradDipFin",United Kingdom,,false,false,true,https://www.riotinto.com,,USD,56890,London,,44 20 7781 2000,6 St James’s Square,4.31,2026-07-02T15:12:57+00:00,2026-07-02T12:26:34+00:00,Equity,0.164,0.07861,0.28124,0.25318,0.17291,0.146,-0.056,57637998592,20284999680,3495749888,9966000128,,2.438547,8.422,2.964,23747999744,62203000000,128102000000,9420000256,,1.445,0.917,35.432,0.6131,5.69,0.00003,0.10391,0.011
RMS.PA,Hermès International Société en commandite par actions,1649.5,169364275200,28061,105132,1595,1591.5,1650,1649.5,54.5,3.416928,1595,2026-07-02,,,0.99,104739811,37.543533,43.07,Consumer Cyclical,Luxury Goods,"Hermès International Société en commandite par actions engages in the production, wholesale, and retail of various goods. The company offers leather goods and saddlery, such as bags for men and women, travel articles, small leather goods and accessories, saddles, bridles, and various equestrian products and clothing; ready-to-wear garments for men and women; and accessories, including jewelry, belts, hats, gloves, internet of things products, and shoes. It also provides silk and textiles for men and women; art of living and tableware products; beauty and perfume products; and watches. In addition, the company is involved in weaving, engraving, printing, dyeing, finishing, and producing textiles; purchasing, tanning, dyeing, finishing, and selling tanneries and precious leathers; and creating and producing of metal parts. It sells its products through a network of stores in France, rest of Europe, Japan, the Asia Pacific, the Americas, and the Middle East, as well as sells watches, perfumes, and tableware through a network of specialized stores. The company was founded in 1837 and is headquartered in Paris, France. Hermès International Société en commandite par actions is a subsidiary of H51 SAS. Hermès International Société en commandite par actions is a subsidiary of H51 SAS.",PAR,Mr. Axel Olivier Dumas,France,,false,false,true,https://finance.hermes.com,,EUR,25414,Paris,,800 441 4488,"13-15, rue de la Ville l’Évêque",1.13,2026-07-02T15:12:58+00:00,2026-07-02T12:26:36+00:00,Equity,0.25207,0.17656,0.7111,0.41403,0.28271,0.039,0.018,16001999872,7040999936,4039624960,4524000256,132000000,8.99788,22.339,9.83,2312000000,18842000000,24322000000,12238999552,,4.994,3.987,12.268,0.3715,3.6827,0.66982,0.10868,
RUM,RUM Group Inc.,6.26,1731671936,1199542,3632291,6.28,6.21,6.6,6.26,-0.02,-0.318471,6.28,2026-07-02,,,1.083,275743936,,-0.43,Communication Services,Internet Content & Information,"RUM Group Inc. provides video sharing and cloud services platform in the United States, Canada, and internationally. The company offers Rumble Video, a free and subscription-based video sharing platform; Rumble Studio, a multi-platform livestreaming and monetization service for creators; Rumble Advertising Center, an in-house advertising marketplace; and Rumble Wallet, a non-custodial crypto wallet integrated directly into the Rumble platform enabling audiences to tip creators natively in crypto. It also provides Rumble Cloud, an infrastructure as a service that offers a portfolio of compute, storage, security, and networking offerings. In addition, the company offers banner/display advertising, video pre-roll/mid-roll advertising, and creator sponsorships, as well as subscriptions, pay-per-view, tipping services, and develops and operates high-performance computing (HPC) and artificial intelligence (AI) solutions. RUM Group Inc. was formerly known as Rumble Inc. and changed its name to RUM Group Inc. in June 2026. RUM Group Inc. was founded in 2013 and is headquartered in Longboat Key, Florida.",NGM,Mr. Christopher  Pavlovski,United States,,false,false,true,https://rumble.com,,USD,156,Longboat Key,FL,941 210 0196,444 Gulf of Mexico Drive,,2026-07-02T15:12:59+00:00,2026-07-02T12:26:37+00:00,Equity,-0.3713,-0.19257,-0.01924,-1.18556,-1.06911,0.074,,102375328,-92951096,-29101660,-109450536,23836781,8.532609,-20.638,18.738,1576789,274842192,336846798,219042496,,4.704,4.477,0.631,0,,0.51649,0.18938,0.2329
RYAAY,Ryanair Holdings plc,65.649002,33017169920,656408,1352336,64.860001,64.349998,65.874298,65.649002,2.169003,3.416828,63.48,2026-07-02,,,0.986,520119255,13.651612,4.65,Industrials,Airlines,"Ryanair Holdings plc, together with its subsidiaries, engages in the provision of scheduled-passenger airline services in Ireland, Italy, Spain, the United Kingdom, and internationally. It offers various ancillary services; engages in other activities connected with its air passenger service, including non-flight scheduled and Internet-related services, as well as in-flight sale of beverages, food, duty-free, and merchandise; and markets car hire, travel insurance, and accommodation services through its website and mobile app. The company also provides passenger and aircraft handling, ticketing, and maintenance and repair services; and markets car parking, fast-track, airport transfers, attractions, and activities on its website and mobile app, as well as sells gift vouchers. Ryanair Holdings plc was incorporated in 1996 and is headquartered in Swords, Ireland.",NMS,Mr. Michael  O'Leary,Ireland,,false,false,true,https://www.ryanair.com,,USD,27081,Swords,,353 1 945 1212,Dublin Office,1.56,2026-07-02T15:13:00+00:00,2026-07-02T12:26:38+00:00,Equity,0.25367,0.07966,0.29825,-0.23462,0.13984,0.094,,15544299520,3685700096,-1129049984,2173700096,15000000,2.889199,8.433,1.999,1491500032,10101400000,19747700000,3545799936,,0.903,0.419,14.765,0.2055,0.831,0,0.42821,0.0055
SAM,"The Boston Beer Company, Inc.",182.994995,1849739776,50202,294804,179.990005,180.039993,183.440002,182.994995,5.36499,3.020318,177.630005,2026-07-02,,,0.789,8345442,,-6.15,Consumer Defensive,Beverages - Brewers,"The Boston Beer Company, Inc. produces and sells alcohol beverages primarily in the United States. Its flagship beer is Samuel Adams Boston Lager. The company offers various beers, hard ciders, spirits based ready to drink beverages, distilled spirits, flavored malt beverages, and hard seltzers under the Samuel Adams, Twisted Tea, Truly, Angry Orchard, Dogfish Head, and Sun Cruiser brand names. It markets and sells its products to a network wholesaler in the United States, as well as wholesalers, importers, or other agencies that in turn sell to retailers, such as grocery stores, club stores, convenience stores, liquor stores, bars, restaurants, stadiums, and other traditional and e-commerce retail outlets. It sells its products in Canada, Mexico, and internationally. The Boston Beer Company, Inc. was founded in 1984 and is based in Boston, Massachusetts.",NYQ,Mr. C. James Koch J.D.,United States,,false,false,true,https://www.bostonbeer.com,,USD,2736,Boston,MA,617 368 5000,One Design Center Place,,2026-07-02T15:13:00+00:00,2026-07-02T12:26:39+00:00,Equity,-0.07749,0.07239,0.48702,0.04974,-0.03147,-0.044,,1945057024,228850000,370609888,-61442000,21754000,2.652461,7.348,0.865,34743000,846280000,1193595000,164124000,,0.93,0.596,5.09,0,0.7747,0.09199,0.95486,0.2429
SANA,"Sana Biotechnology, Inc.",3.84,990718016,1144348,3930347,3.605,3.605,3.865,3.84,0.28,7.865168,3.56,2026-07-02,,,2.159,278291590,,-0.92,Healthcare,Biotechnology,"Sana Biotechnology, Inc., a biotechnology company, focuses on utilizing engineered cells as medicines in the United States. It develops ex vivo and in vivo cell engineering platforms for various therapeutic areas with unmet treatment needs, including type 1 diabetes, B cell mediated autoimmune diseases, and oncology. The company's product pipeline includes UP421, a HIP-modified allogeneic primary islet cell product, which is in phase 1 clinical trial to treat type 1 diabetes; SC451, a HIP-modified, stem cell derived pancreatic islet cell therapy, which is in preclinical trial for the treatment of type 1 diabetes; SG293 and SG299, a CD8-targeted fusosome for the treatment of B cell hematologic malignancies and B cell mediated autoimmune diseases. The company has an option and license agreement with Beam Therapeutics Inc. for use of Beam's proprietary CRISPR Cas12b nuclease editing technology to research, develop, and commercialize engineered cell therapy products; and a license agreement with Harvard College to access certain intellectual property for the development of hypoimmune-modified cells. The company has a strategic collaboration with Mayo Clinic for the development of SC451, a hypoimmune-modified pancreatic islet cell therapy for type 1 diabetes. The company was formerly known as FD Therapeutics, Inc. and changed its name to Sana Biotechnology, Inc. in September 2018. Sana Biotechnology, Inc. was incorporated in 2018 and is headquartered in Seattle, Washington.",NMS,Dr. Steven D. Harr M.D.,United States,2021-02-04,false,false,true,https://www.sana.com,,USD,142,Seattle,WA,206 701 7914,188 East Blaine Street,,2026-07-02T15:13:01+00:00,2026-07-02T12:26:40+00:00,Equity,-1.4741,-0.2748,0,0,0,,,,-168568992,-29722124,-241987008,25464000,8.054298,-5.767,,82628000,160884000,416890000,101136000,,1.295,1.172,69.296,0,,0.06507,0.82825,0.2603
SB,"Safe Bulkers, Inc.",6.44,642525696,119184,647698,6.43,6.415,6.525,6.44,0.13,2.060224,6.31,2026-07-02,,,0.848,101826580,14.022222,0.45,Industrials,Marine Shipping,"Safe Bulkers, Inc., together with its subsidiaries, provides marine drybulk transportation services internationally. The company owns and operates a fleet of dry bulk vessels for transporting bulk cargoes comprising coal, grain, and iron ore. Its fleet consists of 45 vessels, including 8 Panamax class vessels, 12 Kamsarmax class vessels, 17 post-Panamax class vessels, and 8 Capesize class vessels with an aggregate carrying capacity of 4,559,000 deadweight tons. Safe Bulkers, Inc. was incorporated in 2007 and is based in Monaco.",NYQ,Mr. Polys  Hajioannou,Monaco,,false,false,true,https://www.safebulkers.com,,USD,10,Monaco,,30 2 111 888 400,Les Acanthes,3.8,2026-07-02T15:13:02+00:00,2026-07-02T12:26:43+00:00,Equity,0.0641,0.03432,0.59998,0.35587,0.18729,0.156,2.962,285779008,136506000,1579875,45524000,150000,0.761985,7.434,3.551,543998016,830707000,1403182000,171775008,,1.375,0.947,64.517,0.4444,3.33,0.47514,0.37918,0.0507
SBLK,Star Bulk Carriers Corp.,25.450001,2767082240,491553,1194124,25.370001,25.370001,25.950001,25.450001,0.640001,2.57961,24.809999,2026-07-02,,,0.722,111530926,19.848,1.25,Industrials,Marine Shipping,"Star Bulk Carriers Corp., a shipping company, engages in the ocean transportation of dry bulk cargoes through the ownership and operation of dry bulk carrier vessels worldwide. Its vessels transport a range of bulk commodities, including iron ores, minerals and grains, bauxite, fertilizers, and steel products. As of December 31, 2025, the company owned a fleet of 136 dry bulk vessels consisting of Newcastlemax, Capesize, Post Panamax, Kamsarmax, Panamax, Ultramax, and Supramax vessels with carrying capacities between 55,569 deadweight tonnage and 209,537 deadweight tonnage. Star Bulk Carriers Corp. was incorporated in 2006 and is based in Marousi, Greece.",NMS,Mr. Petros Alexandros Pappas,Greece,,false,false,true,https://www.starbulk.com,,USD,294,Marousi,,30 210 61 78 400,40 Agiou Konstantinou Street,4.15,2026-07-02T15:13:03+00:00,2026-07-02T12:26:44+00:00,Equity,0.05826,0.03474,0.41268,0.25668,0.13014,0.219,131.181,1093000960,378492000,230644624,142244000,17798000,1.138648,9.158,3.171,1096167040,2449263000,3805385000,397041984,,1.728,1.381,45.107,0.464,,0.25168,0.36089,0.0202
SCCO,Southern Copper Corporation,174.955002,140834652160,249321,1398198,171,171.029999,175.889999,174.955002,6.154999,3.646326,168.800003,2026-07-02,,,1.108,834328506,28.561762,5.91,Basic Materials,Copper,"Southern Copper Corporation engages in mining, exploring, smelting, and refining copper and other minerals in Mexico, the United States, Peru, Brazil, Chile, and Other American countries. The company is involved in the mining, milling, and flotation of copper ore to produce copper and molybdenum concentrates; smelting of copper concentrates to produce blister and anode copper; refining of anode copper to produce copper cathodes; production of copper-molybdenum concentrates and sulfuric acid; production of refined silver, gold, and other materials; and mining and processing of copper, molybdenum, zinc, silver, gold and lead. It operates the Toquepala and Cuajone open-pit mines, smelter, and refinery in Peru; La Caridad, an open-pit copper mine, as well as copper ore concentrator; and SX-EW plant, a smelter, refinery, and rod plant in Mexico. The company also operates Buenavista, an open-pit copper mine, as well as copper concentrators and operating SX-EW plants in Mexico. In addition, it operates underground mines that produce zinc, lead, copper, silver, and gold; coal mine; and zinc refinery. The company has interests in 164,805 hectares and 505,788 hectares of concessions in Peru and Mexico; and 98,634 hectares and 28,453 hectares of exploration concessions in Argentina and Chile. Southern Copper Corporation was formerly known as Southern Peru Copper Corp. and changed its name to Southern Copper Corporation in July 1996. The company was incorporated in 1952 and is based in Phoenix, Arizona. Southern Copper Corporation operates as a subsidiary of Americas Mining Corporation.",NYQ,Engineer Leonardo  Contreras Lerdo de Tejada,United States,,false,false,true,https://www.southerncoppercorp.com,,USD,16617,Phoenix,AZ,602 264 1375,7310 North 16th St,2.37,2026-07-02T15:13:04+00:00,2026-07-02T12:26:45+00:00,Equity,0.46343,0.23809,0.62709,0.58341,0.34131,0.362,0.667,14549499904,8849899520,4255225088,4965899776,,11.947905,16.154,9.826,7401699840,11038100000,21381400000,5349499904,,4.375,3.729,62.412,0.5633,5.41,0.88986,0.09796,0.1162
SFM,"Sprouts Farmers Market, Inc.",90.055,8153640960,605845,2193159,87.110001,86.839996,90.445,90.055,3.355003,3.86967,86.699997,2026-07-02,,,0.673,94044301,16.641073,5.21,Consumer Defensive,Grocery Stores,"Sprouts Farmers Market, Inc., together with its subsidiaries, engages in the retailing of fresh, natural, and organic food products in the United States. The company offers healthy grocery stores; and lifestyle-friendly ingredients such as organic, plant-based, keto, paleo, non-GMO, and gluten-free. The company also offers perishable product categories, including produce, meat and meat alternatives, seafood, deli, bakery, floral, and dairy alternatives; and non-perishable product categories, such as grocery, vitamins and supplements, bulk items, frozen foods, beer and wine, and natural health and body care. It sells its products under the Sprouts brand. The company was founded in 1943 and is headquartered in Phoenix, Arizona.",NMS,Mr. Jack L. Sinclair,United States,,false,false,true,https://www.sprouts.com,,USD,36000,Phoenix,AZ,480 814 8016,5455 East High Street,,2026-07-02T15:13:04+00:00,2026-07-02T12:26:47+00:00,Equity,0.37276,0.10539,0.38972,0.09244,0.05701,0.041,-0.055,8898902016,840310976,439800736,507368000,31103000,5.71598,11.856,1.12,2060856960,1403074000,4158649000,252160992,,0.922,0.377,143.69,0,1.1909,0.00576,1.06201,0.1627
SIG,Signet Jewelers Limited,81.580002,3289022976,147446,875211,84.620003,81.292503,85.019997,81.580002,-3.080002,-3.638084,84.660004,2026-07-02,,,1.145,38849783,11.957627,7.08,Consumer Cyclical,Luxury Goods,"Signet Jewelers Limited operates as a diamond jewelry retailer in the United States, Canada, the United Kingdom, and Republic of Irland. It operates through three segments: North America, International, and other. The North America segment operates jewelry stores in malls, mall-based kiosks, and off-mall locations in the United States and Canada primarily under the Kay, Zales, Jared Jewelers, Diamonds Direct, Banter by Piercing Pagoda, Peoples Jewellers, and Rocksbox brands, as well as operates online through its digital brands, James Allen and Blue Nile. The International segment operates stores in shopping malls, off-mall locations, and online primarily under the H.Samuel and Ernest Jones brands in the United Kingdom and the Republic of Ireland. The Other segment engages in the purchase and conversion of rough diamonds to polished stones, as well as offers diamond polishing services. Signet Jewelers Limited was founded in 1862 and is based in Hamilton, Bermuda.",NYQ,Mr. James Kevin Symancyk,Bermuda,,false,false,true,https://www.signetjewelers.com,,USD,27097,Hamilton,,441 296 5872,Clarendon House,1.65,2026-07-02T15:13:05+00:00,2026-07-02T12:26:48+00:00,Equity,0.15933,0.06094,0.39337,0.05059,0.04287,0.008,0,6825600000,621800000,451787488,292600000,26900000,1.771575,6.353,0.579,1223600000,1966200000,5952100000,602800000,,1.615,0.367,64.495,0.185,2.4,0.01256,1.16235,0.1829
SIRI,Sirius XM Holdings Inc.,30.32,10081767424,1671669,5709081,30.09,30.08,30.610001,30.32,0.369999,1.235389,29.950001,2026-07-02,,,0.963,336619936,12.690679,2.36,Communication Services,Entertainment,"Sirius XM Holdings Inc. operates as an audio entertainment company in North America. It operates through two segments, Sirius XM, and Pandora and Off-platform. The Sirius XM segment provides music, sports, entertainment, comedy, and talk and news channels, as well as podcast and infotainment services on subscription fee basis; and live, curated, and exclusive and on demand programming services through satellite radio systems and streamed through applications for mobile and home devices, and other consumer electronic equipment. This segment also distributes satellite radios through automakers and retailers, as well as its website; offers advertising other ancillary services; sells radios and accessories; and offers location-based services through two-way wireless connectivity, including safety, security, convenience, maintenance and data, remote vehicles diagnostic, and stolen or parked vehicle locator services, as well as data services related to graphical weather and fuel prices. In addition, this segment provides music channels on the DISH Network satellite television service as a programming package; Travel Link, a suite of data services that include graphical weather, fuel prices, sports schedule and scores, and movie listings; graphic information related to road closings, traffic flow, and incident data for consumers with in-vehicle navigation systems; real-time weather services in vehicles, boats, and planes; music programming and commercial-free music services for office, restaurants, and other business; and wireless communications service. The Pandora and Off-platform segment operates music, comedy, and podcast streaming platform, which offers personalized experience for listener through mobile devices, vehicle speakers, and connected devices; and provides advertising services. The company was incorporated in 2013 and is headquartered in New York.",NMS,Ms. Jennifer C. Witz,United States,,false,false,true,https://www.siriusxm.com,,USD,5119,New York,NY,212 584 5100,1221 Avenue of the Americas,3.61,2026-07-02T15:13:06+00:00,2026-07-02T12:26:49+00:00,Equity,0.07375,0.04407,0.47209,0.21999,0.09859,0.011,0.218,8581000192,2478000128,1000750016,846000000,179000000,0.857822,8.056,2.327,9957000192,11563000000,27237000000,75000000,,0.439,0.31,84.878,0.4576,1.2753,0.46419,0.443,0.1819
SIVR,abrdn Physical Silver Shares ETF,58.110001,,448519,1711614,57.93,57.799999,58.990002,58.110001,1.790001,3.178269,56.32,2026-07-02,,,,,,,,,"The shares are intended to constitute a simple and cost-effective means of making an investment similar to an investment in silver. An investment in physical silver requires expensive and sometimes complicated arrangements in connection with the assay, transportation, warehousing and insurance of the metal. Although the shares are not the exact equivalent of an investment in silver, they provide investors with an alternative that allows a level of participation in the silver market through the securities market.",PCX,,,,true,false,true,,,USD,,,,(212) 918-4954,,0,2026-07-02T15:13:07+00:00,2026-07-02T12:26:50+00:00,Equity,,,,,,,,,,,,,,,,,,5223186944,,0.3,,,,,,,,
SLM,SLM Corporation,25.18,4841182208,332422,2946078,25.9,25.09,26.049999,25.18,-0.49,-1.908842,25.67,2026-07-02,,,0.987,188592995,7.130556,3.6,Financial Services,Credit Services,"SLM Corporation, through its subsidiaries, originates and services private education loans to students and their families to finance the cost of their education in the United States. It provides retail deposit accounts, including high-yield savings accounts, money market accounts, and certificates of deposit; and interest-bearing omnibus accounts. The company was formerly known as New BLC Corporation and changed its name to SLM Corporation in December 2013. SLM Corporation was founded in 1972 and is headquartered in Newark, Delaware.",NMS,Mr. Jonathan W. Witter,United States,,false,false,true,https://www.salliemae.com,,USD,1788,Newark,DE,302 451 4911,300 Continental Drive,2.03,2026-07-02T15:13:08+00:00,2026-07-02T12:26:51+00:00,Equity,0.3093,0.02567,1,0.70059,0.44929,0.025,0.1,1665432064,,,732937024,40559000,2.213885,,3.637,6169181184,2451358000,29746295000,5203270144,,1.301,1.279,253.081,0.1444,0.51,0.01298,1.13096,0.1312
