ticker,name,price,marketcap,volume,volumeavg,priceopen,low,high,close,change,changepct,closeyest,date,high52,low52,beta,shares,pe,eps,sector,industry,description,exchange,ceo,country,ipodate,isetf,isfund,isactive,web_url,image,currency,employees,city,state,phone,address,dividend_yield,fetched_at,profile_fetched_at,asset_class,returnOnEquity,returnOnAssets,grossMargin,operatingMargin,profitMargin,revenueGrowth,earningsGrowth,revenue,ebitda,freeCashFlow,netIncome,stockBasedComp,priceToBook,evToEbitda,evToRevenue,totalDebt,totalEquity,totalAssets,cash,expenseRatio,currentRatio,quickRatio,debtToEquity,payoutRatio,pegRatio,heldPctInsiders,heldPctInstitutions,shortPctFloat
MAGN,Magnera Corporation,12.39,425064000,44735,381404,12.02,12.18,12.485,12.39,0.450001,3.768851,11.94,2026-07-02,,,,35600000,,-4.47,Consumer Defensive,Household & Personal Products,"Magnera Corporation manufactures and sells non-woven and related products worldwide. It sells its products primarily into consumer-oriented end markets, such as healthcare, and personal care. The company offers personal care and consumer solution products and components of products including medical garments, wipes, dryer sheets, filtration, baby diapers and adult incontinence. The company also offers tea bags, coffee filters, wipes, cable wrap, filtration, baby diapers and adult incontinence. The company is headquartered in Charlotte, North Carolina.",NYQ,Mr. Curtis L. Begle,United States,,false,false,true,https://magnera.com,,USD,8000,Charlotte,NC,866 744 7380,9335 Harris Corners Pkwy,,2026-07-02T15:12:16+00:00,2026-07-02T12:25:28+00:00,Equity,-0.10319,0.01979,0.11329,0.04146,-0.03368,-0.034,,3265999872,321000000,201000000,-110000000,2797000,0.411412,6.491,0.638,1959000064,256854000,1563796000,303000000,,2.326,1.387,188.547,0,4.23,0.01152,1.0465,0.0804
MAPS,"WM Technology, Inc.",0.39,67482736,35441,2471309,0.3846,0.3801,0.3999,0.39,0,0,0.39,2026-07-02,,,0.855,111376293,39,0.01,Technology,Software - Application,"WM Technology, Inc., an online cannabis marketplace, provides ecommerce and compliance software solutions to retailers and brands in cannabis market in the United States and internationally. The company offers Weedmaps marketplace that allows cannabis users to search for and browse cannabis products from retailers and brands, and reserve products from local retailers; and education and learning information to help newer consumers learn about the types of products to purchase. It also provides monthly subscription-based business software solutions, including WM Listings, WM Orders, WM Store, WM Connectors, and WM Insights as well as other add-on products, such as WM Ads and WM Dispatch. The company was founded in 2008 and is headquartered in Irvine, California.",OQX,Mr. Douglas  Francis,United States,,false,false,true,https://weedmaps.com,,USD,416,Irvine,CA,844 933 3627,41 Discovery,,2026-07-02T15:12:17+00:00,2026-07-02T12:25:30+00:00,Equity,0.01905,0.04435,0.94935,0.01382,0.00856,-0.024,-0.368,173650000,26269000,12699000,1486000,7776000,0.726257,3.32,0.502,25631000,57175000,190667000,57002000,,2.683,2.461,19.009,0,,0.08842,0.38805,0.0352
MAR,"Marriott International, Inc.",370.209991,97121796096,278527,1489154,369.880005,366.964996,371.899994,370.209991,1.889984,0.513136,368.320007,2026-07-02,,,1.105,263688623,38.607967,9.54,Consumer Cyclical,Lodging,"Marriott International, Inc. engages in the operation, franchising, and licensing of hotel, residential, timeshare, and other lodging properties in the United States, Canada, Europe, the Middle East, Africa, Greater China, the Asia-Pacific, and internationally. The company operates properties under the JW Marriott, The Ritz-Carlton, The Luxury Collection, W Hotels, St. Regis, EDITION, Bvlgari, Marriott Hotels, Sheraton, Westin, Autograph Collection, Renaissance Hotels, Le Méridien, Delta Hotels by Marriott, MGM Collection with Marriott Bonvoy, Tribute Portfolio, Gaylord Hotels, Design Hotels, Marriott Executive Apartments, Apartments by Marriott Bonvoy, Courtyard by Marriott, Fairfield by Marriott, Residence Inn by Marriott, SpringHill Suites by Marriott, Four Points by Sheraton, TownePlace Suites by Marriott, Aloft Hotels, AC Hotels by Marriott, Moxy Hotels, Element Hotels, Protea Hotels by Marriott, citizenM, City Express by Marriott, and Four Points Flex by Sheraton brands. It also operates residences, timeshares, and yachts. The company was formerly known as New Marriott MI, Inc. and changed its name to Marriott International, Inc. in May 1998. Marriott International, Inc. was founded in 1927 and is headquartered in Bethesda, Maryland.",NMS,Mr. Anthony G. Capuano Jr.,United States,,false,false,true,https://www.marriott.com,,USD,414000,Bethesda,MD,301 380 3000,7750 Wisconsin Avenue,0.79,2026-07-02T15:12:18+00:00,2026-07-02T12:25:31+00:00,Equity,,0.09765,0.79037,0.59006,0.35969,0.126,0.017,7184000000,4735000064,1796875008,2584000000,236000000,-23.825603,24.092,15.879,17405999104,-3771000000,27540000000,454000000,,0.46,0.416,,0.2806,2.188,0.17882,0.64254,0.0269
MGM,MGM Resorts International,46.869999,12158050304,629402,4886216,47.599998,46.744999,47.869999,46.869999,-0.650002,-1.367848,47.52,2026-07-02,,,1.311,255851235,65.09589,0.73,Consumer Cyclical,Resorts & Casinos,"MGM Resorts International, through its subsidiaries, operates as a gaming and entertainment company in the United States, China, and internationally. It operates through four segments: Las Vegas Strip Resorts, Regional Operations, MGM China, and MGM Digital. The company operates casino resorts that offer gaming, hotel, convention, dining, entertainment, retail, and other resort amenities, as well as online/digital games through its online platforms. Its casino operations include slots and table games, as well as live dealer, online sports betting, and iGaming through BetMGM. The company's customers include premium gaming customers; leisure and wholesale travel customers; business travelers; and group customers, including conventions, trade associations, and small meetings. The company was formerly known as MGM MIRAGE and changed its name to MGM Resorts International in June 2010. MGM Resorts International was incorporated in 1986 and is based in Las Vegas, Nevada.",NYQ,Mr. William Joseph Hornbuckle IV,United States,,false,false,true,https://www.mgmresorts.com,,USD,60000,Las Vegas,NV,702 693 7120,3600 Las Vegas Boulevard South,,2026-07-02T15:12:19+00:00,2026-07-02T12:25:32+00:00,Equity,0.13488,0.01844,0.4416,0.06856,0.0103,0.042,-0.059,17715318784,2273850880,528360256,187731008,90471000,4.99632,18.579,2.385,31693570048,2429917000,41373786000,2504945920,,1.335,1.1,951.186,0,1.2706,0.2741,0.67934,0.1678
MGPI,"MGP Ingredients, Inc.",17.51,371004672,44677,210526,17.48,17.48,17.98,17.51,0.15,0.864053,17.360001,2026-07-02,,,0.459,21371237,,-11.15,Consumer Defensive,Beverages - Wineries & Distilleries,"MGP Ingredients, Inc. produces and supplies distilled spirits, branded spirits, and food ingredients worldwide. It operates in three segments: Distillery Solutions, Branded Spirits, and Ingredient Solutions. The Distillery Solutions segment processes corn and other grains, including rye, barley, wheat, barley malt, and milo into food grade alcohol and distillery co-products, such as dried distillers' grain; and offers food-grade alcohol for beverage applications, that include bourbon, rye, and other whiskeys, as well as grain neutral spirits, including vodka and gin. This segment also offers warehouse services, including barrel put away, barrel storage, and barrel retrieval services; and blending services. The Branded Spirits segment provides Tequila under the premium plus, ultra-premium, super premium, premium price tiers under the Penelope Bourbon, Yellowstone Bourbon, Rebel Bourbon, Remus Bourbon, Blood Oath Bourbon, Ezra Brooks Bourbon, Minor Case Straight Rye Whiskey, Rossville Union Straight Rye Whiskey, The Quiet Man Irish Whiskey, Green Hat Gin, Everclear grain alcohol, El Mayor Tequila, and Dos Primos names; mid branded spirits under the Brady's Irish Cream, Saint Brendan's Irish Cream Liqueur, Pearl Vodka, Lord Calvert Canadian Whisky, and Exotico Tequila names; and value branded spirits under the Arrow Cordials, Canada House Canadian Whisky, Lady Bligh Rum, and Juarez Tequila names, as well as private label products. The Ingredient Solutions segment provides specialty wheat starches for food applications, such as Fibersym, a resistant wheat starch; specialty wheat proteins for food applications under the Arise and Proterra names; gluten-free textured pea and soy proteins; commodity wheat starch for food and non-food applications; and commodity wheat proteins. It sells its products directly or through distributors to manufacturers and processors of finished packaged goods or to bakeries. The company was founded in 1941 and is based in Atchison, Kansas.",NMS,Ms. Julie M. Francis,United States,,false,false,true,https://www.mgpingredients.com,,USD,617,Atchison,KS,913 367 1480,Cray Business Plaza,2.76,2026-07-02T15:12:19+00:00,2026-07-02T12:25:34+00:00,Equity,-0.34072,0.03936,0.36393,0.05943,-0.45973,-0.125,,521148992,100422000,44757500,-238359008,4704000,0.638188,6.104,1.176,253964992,718436000,1235864000,10357000,,2.736,0.525,43.814,0.96,1.14,0.32567,0.73268,0.0631
MSTR,Strategy Inc,100.290001,33412001792,15564859,20932368,99.889999,97.57,104.110001,100.290001,6.900002,7.388373,93.389999,2026-07-02,,,3.471,338128276,,-36.99,Technology,Software - Application,"Strategy Inc, together with its subsidiaries, operates as a bitcoin treasury company in the United States, Europe, the Middle East, Africa, and internationally. It offers investors varying degrees of economic exposure to Bitcoin by offering a range of securities, including equity and fixed income instruments. The company also provides AI-powered enterprise analytics software, including Strategy One, which provides non-technical users with the ability to directly access novel and actionable insights for decision-making. In addition, the company provides Strategy Mosaic, a universal intelligence layer that offers enterprises with consistent definitions and governance across data sources, regardless of where that data resides or which tools access it. The company was formerly known as MicroStrategy Incorporated and changed its name to Strategy Inc in August 2025. The company was incorporated in 1989 and is headquartered in Tysons Corner, Virginia.",NMS,Mr. Michael J. Saylor,United States,,false,false,true,https://www.strategy.com,,USD,1511,Tysons Corner,VA,703 848 8600,1850 Towers Crescent Plaza,,2026-07-02T15:12:21+00:00,2026-07-02T12:25:36+00:00,Equity,-0.30756,-0.17814,0.68114,-116.41528,0,0.119,,490467008,-13990264832,-8699502592,-12773697536,53369000,0.881445,-3.414,97.384,8257384960,51042972000,61641082000,2207218944,,6.053,5.926,18.094,0,2.85,0.00248,0.63998,0.122
MSTU,T-Rex 2X Long MSTR Daily Target ETF,2.125,,65155620,45811429,2.11,2.02,2.28,2.125,0.275,14.864863,1.85,2026-07-02,,,,,2.339634,,,,"The fund, under normal circumstances, invests at least 80% of its net assets (plus any borrowings for investment purposes) in financial instruments that are designed to provide, in the aggregate, 200% exposure to the price performance of MSTR on a daily basis. The fund is non-diversified.",BTS,,,2024-09-18,true,false,true,,,USD,,,,,,0,2026-07-02T15:12:22+00:00,2026-07-02T12:25:37+00:00,Equity,,,,,,,,,,,,,,,,,,530182496,,1.05,,,,,,,,
MT,ArcelorMittal S.A.,63.189999,44832518144,1086780,1908154,62.169998,62.18,63.310001,63.189999,3.93,6.631793,59.259998,2026-07-02,,,1.734,756539353,15.513089,3.82,Basic Materials,Steel,"ArcelorMittal S.A., together with its subsidiaries, operates as integrated steel and mining companies in the Americas, Europe, Asia, and Africa. It offers semi-finished flat products, including slabs; finished flat products comprising plates, hot- and cold-rolled coils and sheets, hot-dipped and electro-galvanized coils and sheets, tinplate, and color coated coils and sheets; semi-finished long products, such as blooms and billets; finished long products consisting of bars, wire-rods, structural sections, rails, sheet piles, and wire-products; and seamless and welded pipes and tubes. The company also provides mining products, such as iron ore lumps, fines, concentrate, pellets, and sinter feeds; and coking coal. It sells its products to various customers in the automotive, appliance, engineering, construction, energy, and machinery industries through a centralized marketing organization, and distributors. The company operates iron ore mining activities in Brazil, Bosnia, Liberia, Mexico, South Africa, and Ukraine, as well as in India and in Canada. ArcelorMittal S.A. was founded in 1976 and is headquartered in Luxembourg, Luxembourg.",NYQ,Mr. Lakshmi Nivas Mittal B.Com.,Luxembourg,,false,false,true,https://corporate.arcelormittal.com,,USD,125554,Luxembourg,,352 47 921,"24-26, Boulevard d’Avranches",1.01,2026-07-02T15:12:23+00:00,2026-07-02T12:25:38+00:00,Equity,0.05433,0.01051,0.0742,0.04872,0.04712,0.045,-0.279,62010998784,4392999936,-2022875008,2921999872,,1.63415,23.113,1.637,13683000320,54466000000,97703000000,4359000064,,1.386,0.386,23.917,0.1832,0.42,0,0.04386,0.0087
MTH,Meritage Homes Corporation,81,5447594496,132211,939842,82.029999,80.18,82.779999,81,-0.550003,-0.674437,81.550003,2026-07-02,,,1.41,66702433,14.881388,5.48,Consumer Cyclical,Residential Construction,"Meritage Homes Corporation, together with its subsidiaries, designs and builds single-family attached and detached homes in the United States. The company operates through two segments: Homebuilding and Financial Services. It acquires and develops land; and constructs, markets, and sells homes for entry-level and first move-up buyers in Arizona, California, Colorado, Utah, Texas, Alabama, Florida, Georgia, Mississippi, North Carolina, South Carolina, and Tennessee. The company also provides title and escrow, mortgage, insurance, title insurance, and closing/settlement services to its homebuyers. Meritage Homes Corporation was founded in 1985 and is based in Scottsdale, Arizona.",NYQ,Mr. Steven J. Hilton,United States,,false,false,true,https://www.meritagehomes.com,,USD,1860,Scottsdale,AZ,480 515 8100,18655 North Claret Drive,2.35,2026-07-02T15:12:24+00:00,2026-07-02T12:25:39+00:00,Equity,0.07494,0.03902,0.19078,0.05836,0.06864,-0.177,-0.515,5616498176,500892992,138710000,385516000,19683000,1.067884,13.127,1.171,1902057984,5195643000,7622287000,766632000,,14.974,2.147,37.341,0.323,0.54,0.02536,1.02451,0.0776
NAAS,NaaS Technology Inc.,2.97,36165604,14276,11990,3.0617,2.87,3.0617,2.97,-0.03,-0.999999,3,2026-07-02,,,1.585,11641592,,-18.83,Consumer Cyclical,Specialty Retail,"NaaS Technology Inc. provides electric vehicle (EV) charging services in China. It offers online EV charging solutions to charging stations, including mobility connectivity services through Kuaidian; SaaS products, such as traffic support and management, marketing, payment, chargers management, order management, load management, and membership management; and operates full station. The company also provides energy solutions comprising site selection; hardware procurement; engineering, procurement, and construction for charging stations. In addition, it integrates smart photovoltaics energy storage and power charging for station upgrade, as well as offline operational and management services. Further, the company is involved in providing electricity procurement services to charging stations; cloud-based virtual power plant platform to facilitate the establishment of a modern energy system for charging stations. Additionally, it offers other amenities and ancillary services, such as vending machines, massage chairs, and car wash tunnels, as well as design and decoration, furniture, ands fixture procurement. The company is headquartered in Beijing, China.",NCM,Ms. Yang  Wang,China,,false,false,true,https://www.enaas.com/en/,,USD,181,Beijing,,86 10 8551 1066,"Newlink Center, Area G, Building 7",,2026-07-02T15:12:24+00:00,2026-07-02T12:25:41+00:00,Equity,,-0.23909,0.8592,-2.22736,0,-0.353,,125139000,-180304000,81032128,-414097984,-17505000,-0.229386,-3.219,4.638,585313984,-933983000,312572000,82445000,,0.191,0.093,,0,,0.00935,0.00238,0.0061
NAVI,Navient Corporation,8.575,820527552,128598,1152139,8.82,8.575,8.91,8.575,-0.155,-1.775484,8.73,2026-07-02,,,1.216,93989417,,-0.62,Financial Services,Credit Services,"Navient Corporation provides technology-enabled education finance  for education in the United States. It operates through two segments: Federal Education Loans and Consumer Lending. The company owns and manages portfolio of private education loans; and offers education lending and digital financial services, in-school student loans, and refinancing products under Earnest brand. It also owns Federal Family Education Loan Program (FFELP) loans that are insured or guaranteed by state or not-for-profit agencies; and performs servicing on its portfolios, as well as federal education loans held by other institutions. Navient Corporation was founded in 1973 and is headquartered in Herndon, Virginia.",NMS,Mr. Edward John Bramson,United States,,false,false,true,https://www.navient.com,,USD,670,Herndon,VA,302 283 8000,13865 Sunrise Valley Drive,7.33,2026-07-02T15:12:25+00:00,2026-07-02T12:25:43+00:00,Equity,-0.02456,-0.00123,1,0.256,-0.18541,-0.008,,329000000,,,-61000000,21000000,0.344868,,137.886,45200998400,2399000000,48681000000,657000000,,7.863,7.601,1900,2,0.13,0.02286,1.04084,0.2419
NEU,NewMarket Corporation,783.512512,7225963520,23631,110603,784,778.070007,787.164978,783.512512,-2.087463,-0.265716,785.599976,2026-07-02,,,0.578,9198019,17.919708,43.84,Basic Materials,Specialty Chemicals,"NewMarket Corporation, through its subsidiaries, primarily engages in the manufacture and sale of petroleum additives. It offers lubricant additives for use in various vehicle and industrial applications, including engine oils, transmission fluids, off-road powertrain and hydraulic systems, gear oils, hydraulic oils, turbine oils, and other applications where metal-to-metal moving parts are utilized; engine oil additives designed for passenger cars, motorcycles, on and off-road heavy duty commercial equipment, locomotives, and engines in ocean-going vessels; driveline additives designed for products, such as transmission fluids, axle fluids, and off-road powertrain fluids; and industrial additives designed for products for industrial applications consisting of hydraulic fluids, greases, industrial gear fluids, and industrial specialty applications comprising turbine oils. The company also provides fuel additives that are used to enhance the oil refining process and the performance of gasoline, diesel, biofuels, and other fuels to industry, government, original equipment manufacturers, and individual customers. In addition, it engages in the marketing of antiknock compounds, as well as contracted manufacturing and related services; and owns and manages a real property in Virginia. The company operates in North America, Latin America, the Asia Pacific, Europe, the Middle East, Africa, India, and internationally. NewMarket Corporation was founded in 1887 and is headquartered in Richmond, Virginia.",NYQ,Mr. Thomas E. Gottwald,United States,,false,false,true,https://www.newmarket.com,,USD,2050,Richmond,VA,804 788 5000,330 South Fourth Street,1.5,2026-07-02T15:12:27+00:00,2026-07-02T12:25:45+00:00,Equity,0.25268,0.10785,0.31265,0.23582,0.15251,-0.045,-0.049,2693939968,706574016,414076992,409272000,,4.170715,11.567,3.034,1019806976,1778243000,3492465000,73158000,,2.552,1.226,58.862,0.2626,5.64,0.19155,0.6697,0.0993
NIVF,NewGenIvf Group Limited,0.453,5553578,605427,5948154,0.455,0.4477,0.4991,0.453,-0.098,-17.785842,0.551,2026-07-02,,,-0.084,10073535,0.015112,36.48,Healthcare,Medical Care Facilities,"NewGenIvf Group Limited, an investment holding company, provides an assisted reproductive service that helps couples and individuals for fertility treatments in Thailand, Cambodia, Hong Kong, and Kyrgyzstan. The company provides a range of fertility treatment solutions, including in vitro fertilization (IVF), ICSI, embryo culture, hormonal blood tests, infectious diseases tests, chromosome screening, hysteroscopy, sperm analysis, sorting, washing, and freezing, and egg freezing. It also offers IVF treatment; surrogacy and ancillary caring services, and value-added services comprising nutrition guidance, psychological counselling, acupuncture, and translation interpreters to supplement the IVF treatment. The company provides its services through clinics. NewGenIvf Group Limited was founded in 2010 and is based in Bangkok, Thailand.",NCM,Mr. Wing Fung  Siu,Thailand,2024-04-04,false,false,true,https://www.nivf.global,,USD,87,Bangkok,,,PS Tower,,2026-07-02T15:12:28+00:00,2026-07-02T12:25:47+00:00,Equity,0.79402,-0.36936,0.20223,-3.49133,2.09025,0.119,,4726433,-10538352,-10464332,9879408,,0.004989,-0.34,0.758,4870307,26631519,32722769,958556,,3.12,0.825,18.742,0,,0.00043,0.09106,0.0322
NMR,"Nomura Holdings, Inc.",9.125,26248278016,329812,1555770,9.08,9.1,9.205,9.125,0.145,1.614705,8.98,2026-07-02,,,0.606,2922970836,12.135135,0.74,Financial Services,Capital Markets,"Nomura Holdings, Inc. engages in the provision of investment, financing, and related services to individual, institutional, and government clients worldwide. It operates through three segments: Wealth Management, Investment Management, and Wholesale. The Wealth Management segment offers asset management services. The Investment Management segment provides investment management services and investment solutions, such as establishing and managing investment trusts, discretionary investment services, investment and management for investment vehicles, funds for institutional investors, and management of silent partnerships. The Wholesale segment is involved in the sales and trading of debt and equity securities, foreign exchange; offers investment banking services, including underwriting and distribution of debt and equity securities, mergers and acquisitions, and financial advisory services. Nomura Holdings, Inc. was incorporated in 1925 and is headquartered in Tokyo, Japan.",NYQ,Mr. Kentaro  Okuda,Japan,,false,false,true,https://www.nomuraholdings.com,,USD,28677,Tokyo,,81 3 5255 1000,"13-1, Nihonbashi 1-chome",3.61,2026-07-02T15:12:29+00:00,2026-07-02T12:25:49+00:00,Equity,0.1007,0.00627,0.78305,0.19542,0.16706,0.275,0.041,2167713038336,,,362128998400,40836000000,1.12589,,0.183,37940180811776,3707868000000,62645925000000,37717341634560,,1.541,1.236,984.203,0.4188,0.81,0,0.03077,0.0006
NRDY,Nerdy Inc.,0.9429,183964288,34728,668359,0.95,0.9422,0.968,0.9429,-0.0211,-2.188795,0.964,2026-07-02,,,1.762,126378213,,-0.27,Technology,Software - Application,"Nerdy Inc. operates platform for live online learning in the United States. The company's platform uses artificial intelligence to connect students, users, parents, guardians, and purchasers of various ages to tutors, instructors, subject matter experts, educators, and other professionals. Its learning destination provides learning experiences across various subjects and multiple formats, including one-on-one instruction, small group tutoring, large format classes, tutor chat, essay review, adaptive assessment, and self-study tools. The company operates Varsity Tutors and Varsity Tutors for Schools platform for live online tutoring and classes. It provides solutions directly to learners, as well as through education systems. Nerdy Inc. was founded in 2007 and is headquartered in Saint Louis, Missouri.",NYQ,Mr. Charles  Cohn,United States,,false,false,true,https://www.nerdy.com,,USD,500,Saint Louis,MO,314 412 1227,8001 Forsyth Boulevard,,2026-07-02T15:12:30+00:00,2026-07-02T12:25:50+00:00,Equity,-1.24509,-0.34712,0.6451,-0.11897,-0.18597,0.024,,180128000,-42143000,-1699500,-33499000,27807000,6.262338,-2.568,0.601,21425000,19009000,76166000,44698000,,2.41,2.187,74.061,0,,0.51611,0.17556,0.1108
