ticker,name,price,marketcap,volume,volumeavg,priceopen,low,high,close,change,changepct,closeyest,date,high52,low52,beta,shares,pe,eps,sector,industry,description,exchange,ceo,country,ipodate,isetf,isfund,isactive,web_url,image,currency,employees,city,state,phone,address,dividend_yield,fetched_at,profile_fetched_at,asset_class,returnOnEquity,returnOnAssets,grossMargin,operatingMargin,profitMargin,revenueGrowth,earningsGrowth,revenue,ebitda,freeCashFlow,netIncome,stockBasedComp,priceToBook,evToEbitda,evToRevenue,totalDebt,totalEquity,totalAssets,cash
RIO,Rio Tinto Group,100.080002,162755313664,3000700,2683968,101.620003,100.050003,101.93,100.080002,-2.589996,-2.522642,102.669998,2026-06-19,,,0.646,1254501913,16.460527,6.08,Basic Materials,Other Industrial Metals & Mining,"Rio Tinto Group engages in exploring, mining, and processing mineral resources worldwide. The company operates through Iron Ore; Aluminium and lithium; and  Copper segments. The Iron Ore segment engages in the iron ore mining, and salt and gypsum production in Western Australia. The Aluminum and lithium segment is involved in bauxite mining; alumina refining; and aluminium smelting, and recycling, as well as mining and processing of lithium. The Copper segment engages in mining and refining of copper, gold, silver, molybdenum, and other by-products and exploration activities. It also owns and operates open pit and underground mines; and refineries, smelters, processing plants and power, and shipping facilities. The company was founded in 1873 and is headquartered in London, the United Kingdom.",NYQ,"Mr. Simon Callas Trott BSc(Hon), GAICD, GradDipFin",United Kingdom,,false,false,true,https://www.riotinto.com,,USD,56890,London,,44 20 7781 2000,6 St James’s Square,,2026-06-19T21:38:01+00:00,2026-06-19T14:27:00+00:00,Equity,0.164,0.07861,0.28124,0.25318,0.17291,0.146,-0.056,57637998592,20284999680,3495749888,9966000128,,2.614352,9.414,3.313,23747999744,62203000000,128102000000,9420000256
SCCO,Southern Copper Corporation,192.929993,160967000064,1972800,1476735,192.850006,189.389999,194.119995,192.929993,1.25,0.652129,191.679993,2026-06-19,,,1.108,834328506,32.64467,5.91,Basic Materials,Copper,"Southern Copper Corporation engages in mining, exploring, smelting, and refining copper and other minerals in Mexico, the United States, Peru, Brazil, Chile, and Other American countries. The company is involved in the mining, milling, and flotation of copper ore to produce copper and molybdenum concentrates; smelting of copper concentrates to produce blister and anode copper; refining of anode copper to produce copper cathodes; production of copper-molybdenum concentrates and sulfuric acid; production of refined silver, gold, and other materials; and mining and processing of copper, molybdenum, zinc, silver, gold and lead. It operates the Toquepala and Cuajone open-pit mines, smelter, and refinery in Peru; La Caridad, an open-pit copper mine, as well as copper ore concentrator; and SX-EW plant, a smelter, refinery, and rod plant in Mexico. The company also operates Buenavista, an open-pit copper mine, as well as copper concentrators and operating SX-EW plants in Mexico. In addition, it operates underground mines that produce zinc, lead, copper, silver, and gold; coal mine; and zinc refinery. The company has interests in 164,805 hectares and 505,788 hectares of concessions in Peru and Mexico; and 98,634 hectares and 28,453 hectares of exploration concessions in Argentina and Chile. Southern Copper Corporation was formerly known as Southern Peru Copper Corp. and changed its name to Southern Copper Corporation in July 1996. The company was incorporated in 1952 and is based in Phoenix, Arizona. Southern Copper Corporation operates as a subsidiary of Americas Mining Corporation.",NYQ,Engineer Leonardo  Contreras Lerdo de Tejada,United States,,false,false,true,https://www.southerncoppercorp.com,,USD,16617,Phoenix,AZ,602 264 1375,7310 North 16th St,2.06,2026-06-19T21:38:02+00:00,2026-06-19T14:27:01+00:00,Equity,0.46343,0.23809,0.62709,0.58341,0.34131,0.362,0.667,14549499904,8849899520,4255225088,4965899776,,13.65586,18.579,11.301,7401699840,11038100000,21381400000,5349499904
CLF,Cleveland-Cliffs Inc.,12.28,7004691968,29553100,17963455,12.71,12.13,12.74,12.28,-0.400001,-3.154579,12.68,2026-06-19,,,2.089,570414657,,-2.31,Basic Materials,Steel,"Cleveland-Cliffs Inc. operates as a steel producer in the United States and Canada. It offers hot-rolled, cold-rolled, and coated products, such as aluminized, electrogalvanized, and galvalume products, as well as galvanneal and hot-dipped galvanized products; stainless and electrical products, including GOES, NOES, and auto chrome; plate products; and slab and other steel products. The company also provides non- steelmaking products comprising stamped components, tool and die, and tubing; and scrap, iron ore, HBI, coal, and coke products. It also provides tubular components, including carbon steel, stainless steel, and electric resistance welded tubing products. In addition, the company is involved in the mining of iron ore; production of pellets and direct reduced iron; and processing of ferrous scrap through primary steelmaking and downstream finishing, stamping, tooling, and tubing. It serves direct automotive, infrastructure and manufacturing, distributors and converters, and steel producers. The company was formerly known as Cliffs Natural Resources Inc. and changed its name to Cleveland-Cliffs Inc. in August 2017. Cleveland-Cliffs Inc. was founded in 1847 and is headquartered in Cleveland, Ohio.",NYQ,Mr. C. Lourenco Goncalves,United States,,false,false,true,https://www.clevelandcliffs.com,,USD,25000,Cleveland,OH,216 694 5700,200 Public Square,,2026-06-19T21:38:03+00:00,2026-06-19T14:27:02+00:00,Equity,-0.18604,-0.02741,-0.02888,-0.02885,-0.06438,0.063,,18902999040,183000000,-60500000,-1208999936,,1.203096,84.729,0.82,7784000000,6116000000,20012000000,45000000
MT,ArcelorMittal S.A.,nan,48218730496,1527405,1995458,64.815002,63.380001,64.849998,nan,nan,nan,65.029999,2026-06-19,,,1.734,760427819,16.599476,3.82,Basic Materials,Steel,"ArcelorMittal S.A., together with its subsidiaries, operates as integrated steel and mining companies in the Americas, Europe, Asia, and Africa. It offers semi-finished flat products, including slabs; finished flat products comprising plates, hot- and cold-rolled coils and sheets, hot-dipped and electro-galvanized coils and sheets, tinplate, and color coated coils and sheets; semi-finished long products, such as blooms and billets; finished long products consisting of bars, wire-rods, structural sections, rails, sheet piles, and wire-products; and seamless and welded pipes and tubes. The company also provides mining products, such as iron ore lumps, fines, concentrate, pellets, and sinter feeds; and coking coal. It sells its products to various customers in the automotive, appliance, engineering, construction, energy, and machinery industries through a centralized marketing organization, and distributors. The company operates iron ore mining activities in Brazil, Bosnia, Liberia, Mexico, South Africa, and Ukraine, as well as in India and in Canada. ArcelorMittal S.A. was founded in 1976 and is headquartered in Luxembourg, Luxembourg.",NYQ,Mr. Lakshmi Nivas Mittal B.Com.,Luxembourg,,false,false,true,https://corporate.arcelormittal.com,,USD,125554,Luxembourg,,352 47 921,"24-26, Boulevard d’Avranches",,2026-06-19T21:38:05+00:00,2026-06-19T14:27:04+00:00,Equity,0.05433,0.01051,0.0742,0.04872,0.04712,0.045,-0.279,62010998784,4392999936,-2022875008,2921999872,,1.74859,26.273,1.861,13683000320,54466000000,97703000000,4359000064
PKX,POSCO Holdings Inc.,nan,18357698560,472524,278512,60.419998,60.34,60.974998,nan,nan,nan,62.57,2026-06-19,,,1.546,302483116,32.454544,1.87,Basic Materials,Steel,"POSCO Holdings Inc., together with its subsidiaries, operates as an integrated steel producer in Korea and internationally. It operates through six segments: Steel, Trading, Construction, Logistics and Others, Green Materials and Energy, and Others. The company engages in the production, import, sale, and export of steel products, such as hot and cold rolled steel, stainless steel, plates, wire rods, and silicon steel sheets, as well as pig iron, billets, blooms, and slabs; trading of steel and raw materials, textiles, agricultural commodities, and other goods; natural resources development and power generation activities; and planning, designing, and construction of industrial plants, civil engineering projects, and commercial and residential buildings. It is also involved in the manufacture and sale of various energy-related and other industrial materials, including anode and cathode materials for rechargeable batteries; investment business; and provision of alternative environmentally-friendly energy solutions, as well as information technology and operational technology, and integrated logistics services. POSCO Holdings Inc. was incorporated in 1968 and is based in Seoul, South Korea.",NYQ,Mr. In-Hwa  Chang,South Korea,,false,false,true,https://www.posco-inc.com,,USD,,Seoul,,82 2 3457 0114,POSCO Center,2.52,2026-06-19T21:38:06+00:00,2026-06-19T14:27:05+00:00,Equity,0.01125,0.0118,0.07661,0.0399,0.01183,0.025,0.545,69534216093696,5932450840576,-1966300200960,822564880384,,1.943473,3.954,0.337,31676696625152,55759204000000,105287678000000,14898110136320
PCAR,PACCAR Inc,nan,62601748480,5775850,2945639,118.275002,118.019997,120.919998,nan,nan,nan,117.339996,2026-06-19,,,0.992,526286229,25.308512,4.7,Industrials,Farm & Heavy Construction Machinery,"PACCAR Inc designs, manufactures, and distributes light, medium, and heavy-duty commercial trucks in the United States, Canada, Australia, Mexico, Europe, Central and South America, and internationally. It operates through three segments: Truck, Parts, and Financial Services. The Truck segment designs, manufactures, and distributes trucks for the over-the-road and off-highway hauling of commercial and consumer goods; and diesel engine products. It sells its trucks through a network of independent dealers under the Kenworth, Peterbilt, and DAF nameplates. The Parts segment distributes aftermarket parts for trucks and related commercial vehicles. The Financial Services segment conducts full-service leasing operations under the PacLease trade name, as well as provides finance and leasing products and services to customers and dealers. This segment offers equipment financing and administrative support services for its franchisees; retail loan and leasing services for small, medium, and large commercial trucking companies, as well as independent owners/operators and other businesses; and truck inventory financing services to independent dealers. In addition, this segment offers loans and leases directly to customers for the acquisition of trucks and related equipment; and operates its own full-service lease outlets. The company manufactures and markets industrial winches under the Braden, Carco, and Gearmatic nameplates. PACCAR Inc was founded in 1905 and is headquartered in Bellevue, Washington.",NMS,Mr. R. Preston Feight,United States,,false,false,true,https://www.paccar.com,,USD,25900,Bellevue,WA,425 468 7400,777 - 106th Avenue N.E.,,2026-06-19T21:38:07+00:00,2026-06-19T14:27:07+00:00,Equity,0.13108,0.04148,0.13583,0.10319,0.08913,-0.089,0.197,27779600384,3222000128,1485162496,2476000000,,3.168451,21.773,2.525,15047300096,19264000000,44336200000,8595399680
GOLD,"Gold.com, Inc.",nan,1225434752,279439,564928,42.955002,41.355,43.130001,nan,nan,nan,42.709999,2026-06-19,,,0.605,29004374,13.762216,3.07,Financial Services,Capital Markets,"Gold.com, Inc., together with its subsidiaries, operates as a precious metals company. It operates through three segments: Wholesale Sales & Ancillary Services, Direct-to-Consumer, and Secured Lending. The Wholesale Sales & Ancillary Services segment sells gold, silver, platinum, and palladium in the form of bars, plates, powders, wafers, grains, ingots, and coins. This segment also offers complementary services, such as receiving, handling, inventorying, processing, packing, and shipping of precious metals and custom coins on a secure basis; and designs and produces minted silver products. The Direct-to-Consumer segment provides access to gold, silver, copper, platinum, and palladium products primarily through its websites; rarities and numismatic collections; and numismatic and bullion products. It operates various websites targeting specific niches within the precious metals retail market. This segment also operates as a direct retailer of precious metals to the investor community and markets its precious metal products on television, radio, and the internet, as well as through customer service outreach. The Secured Lending segment originates and acquires commercial loans secured by bullion, numismatic coins, and graded sports cards. The company serves customers, including financial institutions, bullion retailers, industrial manufacturers and fabricators, sovereign mints, refiners, coin and metal dealers, investors, collectors, and e-commerce and other retail customers. It operates in the United States, Europe, Canada, Asia Pacific, Africa, Australia, and South America. The company was formerly known as A-Mark Precious Metals, Inc. and changed its name to Gold.com, Inc. in December 2025. The company was founded in 1965 and is headquartered in Costa Mesa, California.",NYQ,Mr. Gregory N. Roberts,United States,,false,false,true,https://www.gold.com,,USD,956,Costa Mesa,CA,844 455-4653,1550 Scenic Ave,1.83,2026-06-19T21:38:08+00:00,2026-06-19T14:27:08+00:00,Equity,0.10819,0.02759,0.01844,0.00865,0.0035,2.44,,23020443648,173514000,-743910528,80508000,1594000,1.419834,16.225,0.122,1654208000,649516000,2215431000,143607008
AEM,Agnico Eagle Mines Limited,166.660004,83336036352,4724200,2615698,172.770004,165.690002,176.529999,166.660004,-6.330002,-3.659172,172.990005,2026-06-19,,,0.566,500036237,15.693032,10.62,Basic Materials,Gold,"Agnico Eagle Mines Limited, a gold mining company, engages in the exploration, development, and production of precious metals. It explores for gold, silver, copper, and zinc. The company's mines are located in Canada, Australia, Finland, and Mexico; and with exploration and development activities in Canada, Australia, Europe, Latin America, and the United States. Agnico Eagle Mines Limited was incorporated in 1953 and is headquartered in Toronto, Canada.",NYQ,"Mr. Ammar  Al-Joundi M.B.A., P.Eng.",Canada,,false,false,true,https://www.agnicoeagle.com,,USD,,Toronto,ON,416 947 1212,145 King Street East,1.02,2026-06-19T21:38:09+00:00,2026-06-19T14:27:09+00:00,Equity,0.22298,0.15502,0.7387,0.62822,0.39457,0.661,1.086,13539191808,9542924288,4282917376,5342191104,97545000,3.171697,8.919,6.286,319219008,24742464000,34471291000,3122657024
FNV,Franco-Nevada Corporation,219.259995,42285502464,1399500,865569,225.429993,217.440002,231.789993,219.259995,-7.669998,-3.379896,226.929993,2026-06-19,,,0.889,192855530,30.925245,7.09,Basic Materials,Gold,"Franco-Nevada Corporation operates as a royalty and stream company focused on precious metals in South America, Central America, Mexico, the United States, Canada, Australia, Europe, and Africa. The company operates through Precious Metals, Other Mining and Energy segments. It also manages its portfolio with a focus on precious metals, such as gold, silver, and platinum group metals; and engages in the sale of crude oil, natural gas, and natural gas liquids through a third-party marketing agent. Franco-Nevada Corporation was founded in 1986 and is headquartered in Toronto, Canada.",NYQ,Mr. Paul  Brink,Canada,,false,false,true,https://www.franco-nevada.com,,USD,,Toronto,ON,416 306 6300,199 Bay Street,0.76,2026-06-19T21:38:10+00:00,2026-06-19T14:27:10+00:00,Equity,0.19041,0.13019,0.91824,0.7926,0.65666,0.777,1.231,2087699968,1920600064,-827950016,1370899968,6300000,5.216129,22.816,20.99,0,7635300000,8241400000,714700032
WPM,Wheaton Precious Metals Corp.,122.57,55662112768,3313000,2283326,125.82,121.129997,128.759995,122.57,-3.279999,-2.606276,125.849998,2026-06-19,,,1.16,454125089,30.95202,3.96,Basic Materials,Gold,"Wheaton Precious Metals Corp. operates as a precious metal streaming company. It explores for gold, silver, palladium, platinum, and cobalt deposits in Canada, the United States, Mexico, Portugal, Sweden, the United Kingdom, Argentina, Chile, Brazil, Peru, Ecuador, Colombia, Côte d'Ivoire, Ethiopia, and South Africa. The company was formerly known as Silver Wheaton Corp. and changed its name to Wheaton Precious Metals Corp. in May 2017. Wheaton Precious Metals Corp. was founded in 2004 and is headquartered in Vancouver, Canada.",NYQ,Mr. Haytham Henry Hodaly,Canada,,false,false,true,https://www.wheatonpm.com,,USD,,Vancouver,BC,604 684 9648,1021 West Hastings Street,0.61,2026-06-19T21:38:11+00:00,2026-06-19T14:27:11+00:00,Equity,0.21542,0.14041,0.85808,0.75021,0.6555,0.916,1.288,2745658112,2280745984,639690240,1799779968,32504000,6.403532,24.589,20.425,7662000,8690508000,9125781000,2164505088
KGC,Kinross Gold Corporation,26.67,31846899712,8083100,8631047,27.42,26.299999,27.93,26.67,-0.610001,-2.236073,27.280001,2026-06-19,,,1.348,1194109463,11.348937,2.35,Basic Materials,Gold,"Kinross Gold Corporation, together with its subsidiaries, engages in the acquisition, exploration, and development of gold properties principally in the United States, Brazil, Chile, Canada, and Mauritania. It is also involved in the extraction and processing of gold-containing ores; reclamation of gold mining properties; and production and sale of silver. The company was founded in 1993 and is headquartered in Toronto, Canada.",NYQ,Mr. J. Paul Rollinson,Canada,,false,false,true,https://www.kinross.com,,USD,,Toronto,ON,416 365 5123,25 York Street,0.52,2026-06-19T21:38:12+00:00,2026-06-19T14:27:12+00:00,Equity,0.35467,0.20349,0.68721,0.55086,0.35988,0.608,1.339,7961299968,4960099840,2846512384,2865100032,13100000,3.500459,6.475,4.034,756499968,8576000000,12411100000,2184999936
RGLD,"Royal Gold, Inc.",214.820007,18231044096,1630200,922390,217.699997,212.839996,223.199997,214.820007,-3.599991,-1.648197,218.419998,2026-06-19,,,0.425,84866602,26.007263,8.26,Basic Materials,Gold,"Royal Gold, Inc., together with its subsidiaries, acquires and manages precious metal streams, royalties, and related interests in North America, South and Central America, Europe, the Middle East, Africa, and the Australia Pacific. It operates through Acquisition and Management of Stream Interests and Acquisition and Management of Royalty Interests segments. The company engages in the acquisition of existing stream and royalty interests; and the financing of projects that are in production, development, or in the exploration stage in exchange for stream or royalty interests, which consists of gold, silver, copper, nickel, zinc, lead, molybdenum, diamonds, uranium, iron, platinum, palladium, rhodium, lithium, titanium, cobalt, barite, tungsten, and coal. Its properties are located in Canada, Chile, the Dominican Republic, the United States, Zambia, Australia, Ghana, Brazil, Mexico, Bolivia, Argentina, Nicaragua, Macedonia, Botswana, Spain, and internationally. Royal Gold, Inc. was incorporated in 1981 and is based in Denver, Colorado.",NMS,Mr. William H. Heissenbuttel,United States,,false,false,true,https://www.royalgold.com,,USD,39,Denver,CO,(303) 573-1660,1144 15th Street,0.86,2026-06-19T21:38:13+00:00,2026-06-19T14:27:13+00:00,Equity,0.11982,0.08096,0.87133,0.63776,0.48912,1.43,0.919,1296024960,1073617024,-409444384,633913024,11805000,2.536246,17.892,14.822,595689024,7157130000,9537524000,234142000
IAU,iShares Gold Trust,79.330002,,8405500,7545201,80.199997,79.029999,80.440002,79.330002,-0.309998,-0.389249,79.639999,2026-06-19,,,,970150016,,,,,"The Trust seeks to reflect such performance before payment of the Trust’s expenses and liabilities. It is not actively managed. The Trust does not engage in any activities designed to obtain a profit from, or to ameliorate losses caused by, changes in the price of gold. The advisor intends to constitute a simple and cost-effective means of making an investment similar to an investment in gold. An investment in physical gold requires expensive and sometimes complicated arrangements in connection with the assay, transportation, warehousing and insurance of the metal.",PCX,,,,true,false,true,,,USD,,,,,,0,2026-06-19T21:38:15+00:00,2026-06-19T14:27:14+00:00,Equity,,,,,,,,,,,,,2.291715,,,,,69916966912,
SLV,iShares Silver Trust,59.509998,,28928200,27175455,60.740002,58.849998,61.119999,59.509998,-1.100002,-1.814886,60.610001,2026-06-19,,,,341449984,,,,,"The Trust seeks to reflect such performance before payment of the Trust's expenses and liabilities. It is not actively managed. The Trust does not engage in any activities designed to obtain a profit from, or to ameliorate losses caused by, changes in the price of silver.",PCX,,,,true,false,true,,,USD,,,,,,0,2026-06-19T21:38:16+00:00,2026-06-19T14:27:15+00:00,Equity,,,,,,,,,,,,,2.787615,,,,,36822409216,
SIVR,abrdn Physical Silver Shares ETF,62.549999,,881800,1884133,63.84,61.860001,64.230003,62.549999,-1.139999,-1.789919,63.689999,2026-06-19,,,,,,,,,"The shares are intended to constitute a simple and cost-effective means of making an investment similar to an investment in silver. An investment in physical silver requires expensive and sometimes complicated arrangements in connection with the assay, transportation, warehousing and insurance of the metal. Although the shares are not the exact equivalent of an investment in silver, they provide investors with an alternative that allows a level of participation in the silver market through the securities market.",PCX,,,,true,false,true,,,USD,,,,(212) 918-4954,,0,2026-06-19T21:38:17+00:00,2026-06-19T14:27:16+00:00,Equity,,,,,,,,,,,,,,,,,,5223186944,
EQT,EQT Corporation,50.720001,31724244992,13560800,7505634,50.799999,50.27,51.450001,50.720001,-0.41,-0.801877,51.130001,2026-06-19,,,0.543,625478000,9.624289,5.27,Energy,Oil & Gas E&P,"EQT Corporation engages in the exploration, production, gathering, and transmission of hydrocarbons and natural gas. The company sells natural gas, natural gas liquids, and oil to marketers, utilities, and industrial customers located in the Appalachian Basin. It also provides marketing services and contractual pipeline capacity management services, as well as engages in risk management and hedging activities. The company was formerly known as Equitable Resources Inc. and changed its name to EQT Corporation in February 2009. EQT Corporation was founded in 1888 and is headquartered in Pittsburgh, Pennsylvania.",NYQ,Mr. Toby Z. Rice,United States,,false,false,true,https://www.eqt.com,,USD,1523,Pittsburgh,PA,412 553 5700,625 Liberty Avenue,,2026-06-19T21:38:18+00:00,2026-06-19T14:27:17+00:00,Equity,0.13402,0.07727,0.80966,0.57368,0.35074,0.499,4.9,9364126720,7665675776,2503225856,3284336896,60781000,1.26298,5.409,4.428,5992411136,23752677000,41792874000,326568000
EXE,Expand Energy Corporation,nan,20808126464,6410210,3487549,87.220001,86.370003,88.449997,nan,nan,nan,87.459999,2026-06-19,,,0.322,239228849,6.471726,13.44,Energy,Oil & Gas E&P,"Expand Energy Corporation operates as an independent natural gas production company in the United States. The company engages in acquisition, exploration, and development of properties to produce oil, natural gas, and natural gas liquids. It holds interests in the Marcellus Shale in the northern Appalachian Basin in Pennsylvania; the Marcellus and Utica Shales in Ohio and West Virginia; and the Haynesville and Bossier Shales in Louisiana and Texas. Expand Energy Corporation was formerly known as Chesapeake Energy Corporation and changed its name to Expand Energy Corporation in October 2024. The company was founded in 1989 and is based in Spring, Texas.",NMS,Mr. Michael A. Wichterich,United States,,false,false,true,https://www.expandenergy.com,,USD,1600,Spring,TX,(346) 535-0990,10000 Energy Drive,3.61,2026-06-19T21:38:19+00:00,2026-06-19T14:27:18+00:00,Equity,0.17568,0.09668,0.47955,0.3404,0.24907,0.41,,12956000256,7424000000,1687624960,3227000064,46000000,1.06838,3.23,1.851,5058999808,18578000000,28287000000,2220000000
AR,Antero Resources Corporation,33.220001,10292752384,7299400,5134296,33.610001,33.07,33.849998,33.220001,-0.68,-2.005901,33.900002,2026-06-19,,,0.323,309836000,10.75081,3.09,Energy,Oil & Gas E&P,"Antero Resources Corporation, an independent oil and natural gas company, engages in the development, production, exploration, and acquisition of natural gas, natural gas liquids (NGLs), and oil properties in the United States. It operates in three segments: Exploration and Production; Marketing; and Equity Method Investment in Antero Midstream. As of December 31, 2025, the company had approximately 537,000 net acres in the Appalachian Basin; and approximately 168,000 net acres in the Upper Devonian Shale. Its gathering and compression systems also comprise 731 miles of gas gathering pipelines in the Appalachian Basin. The company was formerly known as Antero Resources Appalachian Corporation and changed its name to Antero Resources Corporation in June 2013. Antero Resources Corporation was incorporated in 2002 and is headquartered in Denver, Colorado.",NYQ,Mr. Michael N. Kennedy,United States,,false,false,true,https://www.anteroresources.com,,USD,632,Denver,CO,303 357 7310,1615 Wynkoop Street,,2026-06-19T21:38:20+00:00,2026-06-19T14:27:19+00:00,Equity,0.12837,0.05886,0.67232,0.36524,0.17094,0.343,1.606,5625670144,2135606016,635028352,961662976,60812000,1.276465,,,4750665216,7550827000,13245407000,
