ticker,name,price,marketcap,volume,volumeavg,priceopen,low,high,close,change,changepct,closeyest,date,high52,low52,beta,shares,pe,eps,sector,industry,description,exchange,ceo,country,ipodate,isetf,isfund,isactive,web_url,image,currency,employees,city,state,phone,address,dividend_yield,fetched_at,profile_fetched_at,asset_class,returnOnEquity,returnOnAssets,grossMargin,operatingMargin,profitMargin,revenueGrowth,earningsGrowth,revenue,ebitda,freeCashFlow,netIncome,stockBasedComp,priceToBook,evToEbitda,evToRevenue,totalDebt,totalEquity,totalAssets,cash,expenseRatio,currentRatio,quickRatio,debtToEquity,payoutRatio,pegRatio,heldPctInsiders,heldPctInstitutions,shortPctFloat
RUM,RUM Group Inc.,6.15,1695825280,1843000,3431949,6.16,6.04,6.29,6.15,-0.02,-0.324149,6.17,2026-07-23,,,1.134,275743936,,-0.43,Communication Services,Internet Content & Information,"RUM Group Inc. provides video sharing and cloud services platform in the United States, Canada, and internationally. The company offers Rumble Video, a free and subscription-based video sharing platform; Rumble Studio, a multi-platform livestreaming and monetization service for creators; Rumble Advertising Center, an in-house advertising marketplace; and Rumble Wallet, a non-custodial crypto wallet integrated directly into the Rumble platform enabling audiences to tip creators natively in crypto. It also provides Rumble Cloud, an infrastructure as a service that offers a portfolio of compute, storage, security, and networking offerings. In addition, the company offers banner/display advertising, video pre-roll/mid-roll advertising, and creator sponsorships, as well as subscriptions, pay-per-view, tipping services, and develops and operates high-performance computing (HPC) and artificial intelligence (AI) solutions. RUM Group Inc. was formerly known as Rumble Inc. and changed its name to RUM Group Inc. in June 2026. RUM Group Inc. was founded in 2013 and is headquartered in Longboat Key, Florida.",NGM,Mr. Christopher  Pavlovski,United States,,false,false,true,https://rumble.com,,USD,156,Longboat Key,FL,941 210 0196,444 Gulf of Mexico Drive,,2026-07-23T13:14:51+00:00,2026-07-23T13:14:51+00:00,Equity,-0.3713,-0.19257,-0.01924,-1.18556,-1.06911,0.074,,102375328,-92951096,-29101660,-109450536,23836781,8.355978,-20.162,18.306,1576789,274842192,336846798,219042496,,4.704,4.477,0.631,0,,0.51682,0.18959,0.1622
RYAAY,Ryanair Holdings plc,58.41,30329225216,1866700,1538009,58.41,57.779999,59.049999,58.41,-0.389999,-0.663264,58.799999,2026-07-23,,,0.975,519247147,14.316176,4.08,Industrials,Airlines,"Ryanair Holdings plc, together with its subsidiaries, engages in the provision of scheduled-passenger airline services in Ireland, Italy, Spain, the United Kingdom, and internationally. It offers various ancillary services; engages in other activities connected with its air passenger service, including non-flight scheduled and Internet-related services, as well as in-flight sale of beverages, food, duty-free, and merchandise; and markets car hire, travel insurance, and accommodation services through its website and mobile app. The company also provides passenger and aircraft handling, ticketing, and maintenance and repair services; and markets car parking, fast-track, airport transfers, attractions, and activities on its website and mobile app, as well as sells gift vouchers. Ryanair Holdings plc was incorporated in 1996 and is headquartered in Swords, Ireland.",NMS,Mr. Michael  O'Leary,Ireland,,false,false,true,https://www.ryanair.com,,USD,30000,Swords,,353 1 945 1212,Dublin Office,1.69,2026-07-23T13:14:52+00:00,2026-07-23T13:14:52+00:00,Equity,0.22408,0.07024,0.27925,0.13125,0.12132,0.011,-0.331,15590800384,3421600000,-217737504,1891500032,15000000,2.651835,8.104,1.778,181900000,10101400000,19747700000,2803500032,,0.79,0.369,1.919,0.2346,5.2083,0,0.42884,0.0047
SAM,"The Boston Beer Company, Inc.",173.919998,1811105792,285800,313854,172.330002,169.820007,174.789993,173.919998,2.940002,1.719501,170.979996,2026-07-23,,,0.782,8345442,,-6.16,Consumer Defensive,Beverages - Brewers,"The Boston Beer Company, Inc. produces and sells alcohol beverages primarily in the United States. Its flagship beer is Samuel Adams Boston Lager. The company offers various beers, hard ciders, spirits based ready to drink beverages, distilled spirits, flavored malt beverages, and hard seltzers under the Samuel Adams, Twisted Tea, Truly, Angry Orchard, Dogfish Head, and Sun Cruiser brand names. It markets and sells its products to a network wholesaler in the United States, as well as wholesalers, importers, or other agencies that in turn sell to retailers, such as grocery stores, club stores, convenience stores, liquor stores, bars, restaurants, stadiums, and other traditional and e-commerce retail outlets. It sells its products in Canada, Mexico, and internationally. The Boston Beer Company, Inc. was founded in 1984 and is based in Boston, Massachusetts.",NYQ,Mr. C. James Koch J.D.,United States,,false,false,true,https://www.bostonbeer.com,,USD,2736,Boston,MA,617 368 5000,One Design Center Place,,2026-07-23T13:14:53+00:00,2026-07-23T13:14:53+00:00,Equity,-0.07749,0.07239,0.48702,0.04974,-0.03147,-0.044,,1945057024,228850000,370609888,-61442000,21754000,2.597061,7.183,0.845,34743000,846280000,1193595000,164124000,,0.93,0.596,5.09,0,0.7747,0.09199,0.95734,0.2457
SANA,"Sana Biotechnology, Inc.",3.12,868269696,1756100,3697101,3.14,3.1,3.18,3.12,-0.04,-1.265829,3.16,2026-07-23,,,2.143,278291590,,-0.92,Healthcare,Biotechnology,"Sana Biotechnology, Inc., a biotechnology company, focuses on utilizing engineered cells as medicines in the United States. It develops ex vivo and in vivo cell engineering platforms for various therapeutic areas with unmet treatment needs, including type 1 diabetes, B cell mediated autoimmune diseases, and oncology. The company's product pipeline includes UP421, a HIP-modified allogeneic primary islet cell product, which is in phase 1 clinical trial to treat type 1 diabetes; SC451, a HIP-modified, stem cell derived pancreatic islet cell therapy, which is in preclinical trial for the treatment of type 1 diabetes; SG293 and SG299, a CD8-targeted fusosome for the treatment of B cell hematologic malignancies and B cell mediated autoimmune diseases. The company has an option and license agreement with Beam Therapeutics Inc. for use of Beam's proprietary CRISPR Cas12b nuclease editing technology to research, develop, and commercialize engineered cell therapy products; and a license agreement with Harvard College to access certain intellectual property for the development of hypoimmune-modified cells. The company has a strategic collaboration with Mayo Clinic for the development of SC451, a hypoimmune-modified pancreatic islet cell therapy for type 1 diabetes. The company was formerly known as FD Therapeutics, Inc. and changed its name to Sana Biotechnology, Inc. in September 2018. Sana Biotechnology, Inc. was incorporated in 2018 and is headquartered in Seattle, Washington.",NMS,Dr. Steven D. Harr M.D.,United States,2021-02-04,false,false,true,https://www.sana.com,,USD,142,Seattle,WA,206 701 7914,188 East Blaine Street,,2026-07-23T13:14:54+00:00,2026-07-23T13:14:54+00:00,Equity,-1.4741,-0.2748,0,0,0,,,,-168568992,-29722124,-241987008,25464000,7.058823,-5.041,,82628000,160884000,416890000,101136000,,1.295,1.172,69.296,0,,0.0651,0.8285,0.2476
SB,"Safe Bulkers, Inc.",7.36,749443584,843100,780091,7.42,7.34,7.45,7.36,-0.09,-1.208049,7.45,2026-07-23,,,0.846,101826580,16.355556,0.45,Industrials,Marine Shipping,"Safe Bulkers, Inc., together with its subsidiaries, provides marine drybulk transportation services internationally. The company owns and operates a fleet of dry bulk vessels for transporting bulk cargoes comprising coal, grain, and iron ore. Its fleet consists of 45 vessels, including 8 Panamax class vessels, 12 Kamsarmax class vessels, 17 post-Panamax class vessels, and 8 Capesize class vessels with an aggregate carrying capacity of 4,559,000 deadweight tons. Safe Bulkers, Inc. was incorporated in 2007 and is based in Monaco.",NYQ,Mr. Polys  Hajioannou,Monaco,,false,false,true,https://www.safebulkers.com,,USD,10,Monaco,,30 2 111 888 400,Les Acanthes,3.26,2026-07-23T13:14:57+00:00,2026-07-23T13:14:57+00:00,Equity,0.0641,0.03432,0.59998,0.35587,0.18729,0.156,2.962,285779008,136506000,1579875,45524000,150000,0.888782,8.217,3.925,543998016,830707000,1403182000,171775008,,1.375,0.947,64.517,0.4444,3.33,0.47514,0.37892,0.0522
SBLK,Star Bulk Carriers Corp.,26.77,2985682944,698300,1263119,26.57,26.57,26.950001,26.77,0.09,0.337332,26.68,2026-07-23,,,0.735,111530926,21.416,1.25,Industrials,Marine Shipping,"Star Bulk Carriers Corp., a shipping company, engages in the ocean transportation of dry bulk cargoes through the ownership and operation of dry bulk carrier vessels worldwide. Its vessels transport a range of bulk commodities, including iron ores, minerals and grains, bauxite, fertilizers, and steel products. As of December 31, 2025, the company owned a fleet of 136 dry bulk vessels consisting of Newcastlemax, Capesize, Post Panamax, Kamsarmax, Panamax, Ultramax, and Supramax vessels with carrying capacities between 55,569 deadweight tonnage and 209,537 deadweight tonnage. Star Bulk Carriers Corp. was incorporated in 2006 and is based in Marousi, Greece.",NMS,Mr. Petros Alexandros Pappas,Greece,,false,false,true,https://www.starbulk.com,,USD,294,Marousi,,30 210 61 78 400,40 Agiou Konstantinou Street,3.85,2026-07-23T13:14:59+00:00,2026-07-23T13:14:59+00:00,Equity,0.05826,0.03474,0.41268,0.25668,0.13014,0.219,131.181,1093000960,378492000,230644624,142244000,17798000,1.228602,9.735,3.371,1096167040,2449263000,3805385000,397041984,,1.728,1.381,45.107,0.464,,0.25388,0.36282,0.0171
SCCO,Southern Copper Corporation,195.479996,153262653440,1226900,1351035,187.880005,187.880005,196.429993,195.479996,7.470001,3.973194,188.009995,2026-07-23,,,1.124,784032420,28.917158,6.76,Basic Materials,Copper,"Southern Copper Corporation engages in mining, exploring, smelting, and refining copper and other minerals in Mexico, the United States, Peru, Brazil, Chile, and Other American countries. The company is involved in the mining, milling, and flotation of copper ore to produce copper and molybdenum concentrates; smelting of copper concentrates to produce blister and anode copper; refining of anode copper to produce copper cathodes; production of copper-molybdenum concentrates and sulfuric acid; production of refined silver, gold, and other materials; and mining and processing of copper, molybdenum, zinc, silver, gold and lead. It operates the Toquepala and Cuajone open-pit mines, smelter, and refinery in Peru; La Caridad, an open-pit copper mine, as well as copper ore concentrator; and SX-EW plant, a smelter, refinery, and rod plant in Mexico. The company also operates Buenavista, an open-pit copper mine, as well as copper concentrators and operating SX-EW plants in Mexico. In addition, it operates underground mines that produce zinc, lead, copper, silver, and gold; coal mine; and zinc refinery. The company has interests in 164,805 hectares and 505,788 hectares of concessions in Peru and Mexico; and 98,634 hectares and 28,453 hectares of exploration concessions in Argentina and Chile. Southern Copper Corporation was formerly known as Southern Peru Copper Corp. and changed its name to Southern Copper Corporation in July 1996. The company was incorporated in 1952 and is based in Phoenix, Arizona. Southern Copper Corporation operates as a subsidiary of Americas Mining Corporation.",NYQ,Engineer Leonardo  Contreras Lerdo de Tejada,United States,,false,false,true,https://www.southerncoppercorp.com,,USD,16617,Phoenix,AZ,602 264 1375,7310 North 16th St,2.25,2026-07-23T13:15:00+00:00,2026-07-23T13:15:00+00:00,Equity,0.49897,0.25705,0.64504,0.61163,0.35866,0.406,0.734,15787499520,9905999872,5099400192,5662300160,,13.836352,16.592,10.411,8528799744,11038100000,21381400000,7329900032,,5.06,4.411,67.11,0.5394,5.41,0.88986,0.09768,0.1188
SFM,"Sprouts Farmers Market, Inc.",73.940002,6953635840,1829600,2264713,75.580002,71.93,75.889999,73.940002,-0.75,-1.00415,74.690002,2026-07-23,,,0.672,94044301,14.191939,5.21,Consumer Defensive,Grocery Stores,"Sprouts Farmers Market, Inc., together with its subsidiaries, engages in the retailing of fresh, natural, and organic food products in the United States. The company offers healthy grocery stores; and lifestyle-friendly ingredients such as organic, plant-based, keto, paleo, non-GMO, and gluten-free. The company also offers perishable product categories, including produce, meat and meat alternatives, seafood, deli, bakery, floral, and dairy alternatives; and non-perishable product categories, such as grocery, vitamins and supplements, bulk items, frozen foods, beer and wine, and natural health and body care. It sells its products under the Sprouts brand. The company was founded in 1943 and is headquartered in Phoenix, Arizona.",NMS,Mr. Jack L. Sinclair,United States,,false,false,true,https://www.sprouts.com,,USD,36000,Phoenix,AZ,480 814 8016,5455 East High Street,,2026-07-23T13:15:01+00:00,2026-07-23T13:15:01+00:00,Equity,0.37276,0.10539,0.38972,0.09244,0.05701,0.041,-0.055,8898902016,840310976,439800736,507368000,31103000,4.874736,10.427,0.985,2060856960,1403074000,4158649000,252160992,,0.922,0.377,143.69,0,1.0264,0.00576,1.06798,0.1443
SIG,Signet Jewelers Limited,90.620003,3520567552,549200,855649,89.269997,89.269997,92,90.620003,0.350006,0.387732,90.269997,2026-07-23,,,1.145,38849783,12.799436,7.08,Consumer Cyclical,Luxury Goods,"Signet Jewelers Limited operates as a diamond jewelry retailer in the United States, Canada, the United Kingdom, and Republic of Irland. It operates through three segments: North America, International, and other. The North America segment operates jewelry stores in malls, mall-based kiosks, and off-mall locations in the United States and Canada primarily under the Kay, Zales, Jared Jewelers, Diamonds Direct, Banter by Piercing Pagoda, Peoples Jewellers, and Rocksbox brands, as well as operates online through its digital brands, James Allen and Blue Nile. The International segment operates stores in shopping malls, off-mall locations, and online primarily under the H.Samuel and Ernest Jones brands in the United Kingdom and the Republic of Ireland. The Other segment engages in the purchase and conversion of rough diamonds to polished stones, as well as offers diamond polishing services. Signet Jewelers Limited was founded in 1862 and is based in Hamilton, Bermuda.",NYQ,Mr. James Kevin Symancyk,Bermuda,,false,false,true,https://www.signetjewelers.com,,USD,27097,Hamilton,,441 296 5872,Clarendon House,1.54,2026-07-23T13:15:02+00:00,2026-07-23T13:15:02+00:00,Equity,0.15933,0.06094,0.39337,0.05059,0.04287,0.008,0,6825600000,621800000,451787488,292600000,26900000,1.896292,6.73,0.613,1223600000,1966200000,5952100000,602800000,,1.615,0.367,64.495,0.185,,0.01282,1.16556,0.1973
SIRI,Sirius XM Holdings Inc.,29.83,10041372672,3392900,5177173,30.4,29.719999,30.58,29.83,-0.460001,-1.518656,30.290001,2026-07-23,,,0.957,336619936,12.857758,2.32,Communication Services,Entertainment,"Sirius XM Holdings Inc. operates as an audio entertainment company in North America. It operates through two segments, Sirius XM, and Pandora and Off-platform. The Sirius XM segment provides music, sports, entertainment, comedy, and talk and news channels, as well as podcast and infotainment services on subscription fee basis; and live, curated, and exclusive and on demand programming services through satellite radio systems and streamed through applications for mobile and home devices, and other consumer electronic equipment. This segment also distributes satellite radios through automakers and retailers, as well as its website; offers advertising other ancillary services; sells radios and accessories; and offers location-based services through two-way wireless connectivity, including safety, security, convenience, maintenance and data, remote vehicles diagnostic, and stolen or parked vehicle locator services, as well as data services related to graphical weather and fuel prices. In addition, this segment provides music channels on the DISH Network satellite television service as a programming package; Travel Link, a suite of data services that include graphical weather, fuel prices, sports schedule and scores, and movie listings; graphic information related to road closings, traffic flow, and incident data for consumers with in-vehicle navigation systems; real-time weather services in vehicles, boats, and planes; music programming and commercial-free music services for office, restaurants, and other business; and wireless communications service. The Pandora and Off-platform segment operates music, comedy, and podcast streaming platform, which offers personalized experience for listener through mobile devices, vehicle speakers, and connected devices; and provides advertising services. The company was incorporated in 2013 and is headquartered in New York.",NMS,Ms. Jennifer C. Witz,United States,,false,false,true,https://www.siriusxm.com,,USD,5119,New York,NY,212 584 5100,1221 Avenue of the Americas,3.62,2026-07-23T13:15:03+00:00,2026-07-23T13:15:03+00:00,Equity,0.07375,0.04407,0.47209,0.21999,0.09859,0.011,0.218,8581000192,2478000128,1000750016,846000000,179000000,0.854385,8.04,2.322,9957000192,11563000000,27237000000,75000000,,0.439,0.31,84.878,0.4576,1.2898,0.46419,0.444,0.1811
SIVR,abrdn Physical Silver Shares ETF,56.700001,,741100,1381793,56.529999,56.529999,57.880001,56.700001,0.900002,1.612906,55.799999,2026-07-23,,,,,,,,,"The shares are intended to constitute a simple and cost-effective means of making an investment similar to an investment in silver. An investment in physical silver requires expensive and sometimes complicated arrangements in connection with the assay, transportation, warehousing and insurance of the metal. Although the shares are not the exact equivalent of an investment in silver, they provide investors with an alternative that allows a level of participation in the silver market through the securities market.",PCX,,,,true,false,true,,,USD,,,,(212) 918-4954,,0,2026-07-23T13:15:05+00:00,2026-07-23T13:15:05+00:00,Equity,,,,,,,,,,,,,,,,,,3950569728,,0.3,,,,,,,,
SLM,SLM Corporation,25.219999,,1796100,2804973,25,24.93,25.35,25.219999,0.029999,0.11909,25.190001,2026-07-23,,,0.955,,7.005556,3.6,Financial Services,Credit Services,"SLM Corporation, through its subsidiaries, originates and services private education loans to students and their families to finance the cost of their education in the United States. It provides retail deposit accounts, including high-yield savings accounts, money market accounts, and certificates of deposit; and interest-bearing omnibus accounts. The company was formerly known as New BLC Corporation and changed its name to SLM Corporation in December 2013. SLM Corporation was founded in 1972 and is headquartered in Newark, Delaware.",NMS,Mr. Jonathan W. Witter,United States,,false,false,true,https://www.salliemae.com,,USD,1788,Newark,DE,302 451 4911,300 Continental Drive,2.06,2026-07-23T13:15:06+00:00,2026-07-23T13:15:06+00:00,Equity,0.3093,0.02567,1,0.70059,0.44929,0.025,0.1,1665432064,,,732937024,40559000,,,3.586,6169181184,2451358000,29746295000,5203270144,,1.301,1.279,253.081,0.1444,0.51,0.01298,1.12794,0.121
SLV,iShares Silver Trust,53.919998,,13848300,20819093,53.779999,53.779999,55.080002,53.919998,0.839996,1.58251,53.080002,2026-07-23,,,,341449984,,,,,"The Trust seeks to reflect such performance before payment of the Trust's expenses and liabilities. It is not actively managed. The Trust does not engage in any activities designed to obtain a profit from, or to ameliorate losses caused by, changes in the price of silver.",PCX,,,,true,false,true,,,USD,,,,,,0,2026-07-23T13:15:07+00:00,2026-07-23T13:15:07+00:00,Equity,,,,,,,,,,,,,2.525764,,,,,28194189312,,0.5,,,,,,,,
SLYV,State Street SPDR S&P 600 Small Cap Value ETF,109.290001,,150200,221773,109.510002,109.07,110.110001,109.290001,-0.269997,-0.246437,109.559998,2026-07-23,,,,35002100,17.346226,,,,"The fund generally invests substantially all, but at least 80%, of its total assets in the securities comprising the index. The index measures the performance of the small-capitalization value segment of the U.S. equity market. It may purchase a subset of the securities in the index in an effort to hold a portfolio of securities with generally the same risk and return characteristics of the index.",PCX,,,,true,false,true,,,USD,,,,,,1.81,2026-07-23T13:15:08+00:00,2026-07-23T13:15:08+00:00,Equity,,,,,,,,,,,,,1.650856,,,,,4830834688,,0.15,,,,,,,,
SOS,SOS Limited,1.06,19260538,51600,27716,1.01,1.01,1.07,1.06,0.045,4.433493,1.015,2026-07-23,,,,13235873,,-6.02,Financial Services,Capital Markets,"SOS Limited operates as a blockchain-based and big data-driven marketing solution provider in the People's Republic of China. The company offers marketing data, technology, and solutions for insurance companies and emergency rescue services. It also provides SOS cloud emergency rescue service software as a service platform that offers basic cloud products, such as medical rescue, automobile rescue, financial rescue, and rescue mutual aid card services. In addition, the company offers cooperative cloud systems, including information rescue center, intelligent big data, and intelligent software and hardware; information cloud systems, such as news today and e-commerce today; information security services, and marketing-related data; and technology and solutions for emergency rescue services, such as insurance, finance, medical care, health, automobile, safety and mutual aid, and builds a rescue service system. Further, it provides blockchain and cryptocurrency operations, including hosting service to cryptocurrency miners; commodities trading products, such as mineral resin, soy bean, wheat, sesame, and liquid sulfur and latex; telecommunication, insurance, and bank call services; and rescue cards. The company serves large businesses, and small and medium-sized enterprises. SOS Limited was founded in 2004 and is headquartered in Qingdao, the People's Republic of China.",NYQ,Mr. Yandai  Wang,China,,false,false,true,https://service.sosyun.com,,USD,51,Qingdao,,86 53 2866 17117,"Building 6, East Seaview Park",,2026-07-23T13:15:09+00:00,2026-07-23T13:15:09+00:00,Equity,-0.2267,-0.13009,0.01462,-1.29246,-0.63075,-0.621,,154290000,-89893000,-281035360,-97319000,7170000,0.040275,-0.129,0.075,2000,423139000,465055000,5414000,,11.05,1.19,0,0,,0.06539,0.0066,0.0419
SPCE,"Virgin Galactic Holdings, Inc.",2.67,343194528,4810500,31815824,2.74,2.66,2.815,2.67,-0.11,-3.956831,2.78,2026-07-23,,,2.74,128537275,,-3.87,Industrials,Aerospace & Defense,"Virgin Galactic Holdings, Inc., an aerospace and space travel company, focuses on the development, manufacture, and operation of spaceships and related technologies. It engages in the design and development, manufacturing, ground and flight testing, spaceflight operation, and post-flight maintenance of spaceflight systems for private individuals, researchers, and government agencies. Virgin Galactic Holdings, Inc. is headquartered in Tustin, California.",NYQ,Mr. Michael A. Colglazier,United States,,false,false,true,https://www.virgingalactic.com,,USD,694,Tustin,CA,949 774 7640,1700 Flight Way,,2026-07-23T13:15:11+00:00,2026-07-23T13:15:11+00:00,Equity,-1.04511,-0.19835,0,-288.95154,0,-0.508,,1310000,-246308992,-313179616,-259135008,18698000,0.971616,-1.696,318.823,368724992,273964000,803179000,219891008,,1.003,0.782,164.809,0,,0.00442,0.1462,0.328
SPCX,Space Exploration Technologies Corp.,115.260002,1518456799232,91939400,123834337,123.290001,115.190002,124.769997,115.260002,-8.279999,-6.702282,123.540001,2026-07-23,,,,7571396888,,-0.67,Industrials,Aerospace & Defense,"Space Exploration Technologies Corp. provides satellite-based broadband services in the United States, Ireland, Canada, and internationally. The company's Connectivity segment operates a high-speed, low-latency broadband network powered by various Starlink satellites in low-earth orbit, delivering connectivity to various consumer, enterprise, and government customers through its Starlink offering. Its Space segment designs, manufactures, and launches reusable rockets to provide access to space. It offers launch services for the deployment of payloads to intended orbits for commercial and government customers utilizing Falcon 9 and Falcon Heavy; and launch and development for the development of spacecraft and the provision of launch and mission services for government agency space programs utilizing Falcon 9, Falcon Heavy, Starship, and Dragon. The company's AI segment operates a vertically integrated AI platform spanning a frontier LLM Grok; AI solutions for consumer and enterprise customers; X, a real-time information, entertainment, and free speech platform; and AI computational infrastructure. The company was founded in 2002 and is based in Starbase, Texas.",NMS,Mr. Elon R. Musk,United States,2026-06-12,false,false,true,https://www.spacex.com,,USD,22000,Starbase,TX,310 363 6000,1 Rocket Road,,2026-07-23T13:15:12+00:00,2026-07-23T13:15:12+00:00,Equity,,,0.48826,-0.41628,-0.44998,0.154,,19300999168,3950000128,,-9356000256,1947000000,19.351915,172.715,35.347,30602999808,41325000000,92079000000,23675000832,,1.217,1.088,73.597,0,,0.18744,0.013,0.018
