ticker,name,price,marketcap,volume,volumeavg,priceopen,low,high,close,change,changepct,closeyest,date,high52,low52,beta,shares,pe,eps,sector,industry,description,exchange,ceo,country,ipodate,isetf,isfund,isactive,web_url,image,currency,employees,city,state,phone,address,dividend_yield,fetched_at,profile_fetched_at,asset_class,returnOnEquity,returnOnAssets,grossMargin,operatingMargin,profitMargin,revenueGrowth,earningsGrowth,revenue,ebitda,freeCashFlow,netIncome,stockBasedComp,priceToBook,evToEbitda,evToRevenue,totalDebt,totalEquity,totalAssets,cash
GRPN,"Groupon, Inc.",nan,614960640,1389049,1949469,16.84,15.99,16.889999,nan,nan,nan,16.559999,2026-06-19,,,0.251,37983980,,-2.57,Communication Services,Internet Content & Information,"Groupon, Inc. operates a marketplace that connects consumers to merchants by offering goods and services at a discount in North America and international. It provides deals in various categories, including beauty and wellness, food and drink, home and automotive services, and online services, as well as various types of experiences and services; and discounted and market rates for hotels, airfare, and package deals, as well as deals on various product lines, such as electronics, sporting goods, jewelry, toys, household items, and apparel. The company offers its deal offerings to customers through websites; search engines; applications and mobile websites, which enable consumers to browse, purchase, manage, and redeem deals on their mobile devices; emails and push notifications; affiliate channels; social and display advertising; and offline marketing. Groupon, Inc. was incorporated in 2008 and is headquartered in Chicago, Illinois.",NMS,Mr. Dusan  Senkypl,United States,,false,false,true,https://www.groupon.com,,USD,1734,Chicago,IL,773 945 6801,35 West Wacker Drive,,2026-06-19T21:40:05+00:00,2026-06-19T14:29:03+00:00,Equity,,0.00791,0.90742,-0.02826,-0.20776,0,,498435008,8405000,80421128,-103379000,37774000,-10.04966,88.566,1.493,314188000,-42562000,670406000,225514000
HAIN,"The Hain Celestial Group, Inc.",nan,54684584,3154160,1114265,0.5934,0.57,0.6659,nan,nan,nan,0.58,2026-06-19,,,0.691,90253483,,-5.7,Consumer Defensive,Packaged Foods,"The Hain Celestial Group, Inc. manufactures, markets, and sells organic and natural products in the United States, United Kingdom, Europe, and internationally. The company offers infant formula; infant and toddler formula, infant cereals, baby food pouches, snacks and frozen toddler and kids' foods; plant-based beverages such as soy, rice, oat, cashew and spelt; and condiments, as well as meat-free dishes and meals. It also provides cooking and culinary oils, vinegars, and condiments; nutritional oils and supplements; broth and soups; yogurts; desserts and creamers; and nut butters. In addition, the company offers hot-eating desserts, refrigerated and frozen meat alternative snacks and meals, vegetables and lentils, jams, fruit spreads, jellies, honey, natural sweeteners, syrups, dessert sauces, and marmalade products, as well as other food products. Further, it provides snack products comprising potato, root vegetable and other exotic vegetable chip, straw, tortilla chip; and personal care products that include hand, skin, hair, and sun care, oral care products, as well as deodorant, baby food, sunscreen, and other products under the Alba Botanica, Avalon Organics, Earth's Best, JASON, Live Clean, and Queen Helene brand name. Additionally, the company offers herbal, green, black, wellness, rooibos, and chai tea under the Celestial Seasonings brand. It sells pantry products under the Spectrum, Spectrum Essentials, MaraNatha, Imagine broth, Hain Pure Foods, and Health Valley brands. It sells its products through specialty and natural food distributors, supermarkets, natural food stores, mass-market and e-commerce retailers, food service channels and clubs, and drug and convenience stores. The company was incorporated in 1993 and is headquartered in Hoboken, New Jersey.",NMS,Ms. Alison E. Lewis,United States,,false,false,true,https://www.hain.com,,USD,2600,Hoboken,NJ,516-587-5000,221 River Street,,2026-06-19T21:40:05+00:00,2026-06-19T14:29:04+00:00,Equity,-1.13037,0.01385,0.20173,0.02579,-0.35467,-0.133,,1453708032,83717000,122927000,-515588992,8149000,0.255762,7.22,0.416,595798976,475005000,1603278000,46152000
HIMS,"Hims & Hers Health, Inc.",35.470001,8209804800,31903500,26210817,32.599998,32.59,35.599998,35.470001,3.580002,11.226096,31.889999,2026-06-19,,,2.398,223080072,,-0.09,Healthcare,Drug Manufacturers - Specialty & Generic,"Hims & Hers Health, Inc. operates as a consumer-first health and wellness platform that connects consumers to licensed healthcare professionals in the United States, the United Kingdom, Canada, Germany, the Republic of Ireland, France, Spain, and internationally. The company offers a range of curated prescription and non-prescription health and wellness products and services available to purchase on its websites and mobile application directly by customers. It also provides personalized health and wellness products; over-the-counter drug and device products, cosmetics, and supplement products primarily focusing on general wellness, skincare, sexual health and wellness, and hair care under the Hims & Hers brand name; and laboratory testing services to measure a set of biomarkers. Additionally, it offers medical consultation, post-consultation support services, and delivery of laboratory testing results services. Further, the company provides treatments and products for various chronic conditions related to hormone health, weight loss, dermatology, and mental health. The company offers its products through retail partnerships, in stores, and online. Hims & Hers Health, Inc. is based in San Francisco, California.",NYQ,Mr. Andrew  Dudum,United States,,false,false,true,https://www.hims.com,,USD,2442,San Francisco,CA,415 851 0195,2269 Chestnut Street,,2026-06-19T21:40:07+00:00,2026-06-19T14:29:06+00:00,Equity,-0.02659,0.00603,0.72919,-0.07897,-0.00559,0.038,,2369731072,83416000,174305120,-13235000,135244000,18.340227,91.89,3.235,1132036992,540928000,2154705000,750875008
HP,"Helmerich & Payne, Inc.",nan,3494585600,2141427,1207887,35.73,33.77,35.73,nan,nan,nan,35.779999,2026-06-19,,,0.573,99930952,,-3.79,Energy,Oil & Gas Drilling,"Helmerich & Payne, Inc., together with its subsidiaries, provides drilling solutions and technologies for oil and gas exploration and production companies. The company operates through North America Solutions, Offshore Solutions, and International Solutions segments. The North America Solutions segment conducts operations primarily in Texas. The Offshore Solutions segment has drilling operations in Louisiana and in U.S. federal waters the North Sea and Norwegian Sea off the coast of Norway, Caspian Sea and other international waters. The International Solutions segment conducts drilling operations in Saudi Arabia, Argentina, Bahrain, Oman, Germany, and Kuwait. The company focuses on developing, promoting, and commercializing technologies designed to enhance the drilling operations, as well as wellbore quality and placement. It also owns and operates commercial real estate properties. In addition, the company's real estate investments include a shopping center. Helmerich & Payne, Inc. was founded in 1920 and is headquartered in Tulsa, Oklahoma.",NYQ,Mr. J. Kevin Vann,United States,,false,false,true,https://www.hpinc.com,,USD,15700,Tulsa,OK,918 742 5531,222 North Detroit Avenue,2.75,2026-06-19T21:40:08+00:00,2026-06-19T14:29:07+00:00,Equity,-0.1297,0.01008,0.31465,-0.01196,-0.09381,-0.082,,4002060032,838147008,359362624,-376942016,31594000,1.381722,6.607,1.384,2002433024,2724790000,6705738000,199147008
HPP,"Hudson Pacific Properties, Inc.",nan,6422055936,1488974,1261798,13.82,13.82,14.66,nan,nan,nan,13.41,2026-06-19,,,1.969,54242024,,-9.93,Real Estate,REIT - Office,"Hudson Pacific Properties, Inc. is a real estate investment trust serving dynamic tech and media tenants in global epicenters for these synergistic, converging and secular growth industries. Hudson Pacific's unique and high-barrier tech and media focus leverages a full-service, end-to-end value creation platform forged through deep strategic relationships and niche expertise across identifying, acquiring, transforming and developing properties into world-class amenitized, collaborative and sustainable office and studio space. Hudson Pacific Properties, Inc. was incorporated in 1997 and is based in Los Angeles, United States.",NYQ,Mr. Victor J. Coleman,United States,,false,false,true,https://www.HudsonPacificProperties.com,,USD,607,Los Angeles,CA,310 445 5700,11601 Wilshire Boulevard,,2026-06-19T21:40:09+00:00,2026-06-19T14:29:08+00:00,Equity,-0.18035,-0.00255,0.48886,-0.07449,-0.65038,-0.08,,815248000,298827008,349211264,-550668032,30399000,0.317805,16.951,6.213,3756483072,2972157000,7267968000,139278000
HTZ,"Hertz Global Holdings, Inc.",5.05,1594610816,8064700,10469365,4.87,4.86,5.06,5.05,0.22,4.554871,4.83,2026-06-19,,,2.121,315764523,,-2.05,Industrials,Rental & Leasing Services,"Hertz Global Holdings, Inc. operates as a vehicle rental company. It operates through two segments: Americas RAC and International RAC. The company offers vehicle rental services under the Hertz, Dollar, and Thrifty brands from company-operated, licensee, and franchisee locations in the United States, Africa, Asia, Australia, Canada, the Caribbean, Europe, Latin America, the Middle East, and New Zealand. It also sells vehicles and value-added services. The company was founded in 1918 and is headquartered in Estero, Florida.",NMS,Mr. Wayne Gilbert West,United States,2021-11-09,false,false,true,https://www.hertz.com,,USD,26000,Estero,FL,239 301 7000,8501 Williams Road,,2026-06-19T21:40:10+00:00,2026-06-19T14:29:09+00:00,Equity,,0.00527,0.15722,-0.04142,-0.07326,0.105,,8695000064,304000000,-16875000,-637000000,63000000,-2.024048,70.969,2.481,20585000960,-459000000,22311000000,586000000
IBIT,iShares Bitcoin Trust ETF,35.619999,,47932100,44154474,36.419998,35.220001,36.439999,35.619999,-0.740002,-2.035208,36.360001,2026-06-19,,,,,,,,,"The shares are intended to constitute a simple means of making an investment similar to an investment in bitcoin rather than by acquiring, holding and trading bitcoin directly on a peer-to-peer or other basis or via a digital asset exchange. The fund is non-diversified.",NGM,,,2024-01-11,true,false,true,,,USD,,,,,,0,2026-06-19T21:40:12+00:00,2026-06-19T14:29:10+00:00,Equity,,,,,,,,,,,,,,,,,,58118959104,
IBRX,"ImmunityBio, Inc.",7.36,7708525568,14372400,16193571,7.15,7.03,7.455,7.36,0.37,5.293281,6.99,2026-06-19,,,0.099,1047353977,,-0.85,Healthcare,Biotechnology,"ImmunityBio, Inc., a biotechnology company, focuses on innovating, developing, and commercializing next-generation immunotherapies designed to activate the patient's immune system and deliver durable protection against cancer and infectious diseases. Its platforms for the development of biologic products and product candidates that include cytokine fusion proteins, DNA and vaccine vectors, and cell therapies. The company's platform has generated first-in-human therapeutic agents that are planned to be studied in clinical trials in liquid and solid tumors. Its lead biologic product candidate includes Anktiva, an FDA-approved immunotherapy in combination with bacillus calmette-guérin (BCG) for the treatment of adult patients with BCG unresponsive non-muscle invasive bladder cancer with carcinoma in situ, with or without papillary tumors; and 3M-052, a synthetic TLR7/8 agonist and 3M-052 formulations and related technology. The company has collaboration agreements with National Cancer Institute; Serum Institute of India Private Limited; and BeOne Medicines Ltd. It has license agreement with 3M Innovative Properties Company and Access to Advanced Health Institute. ImmunityBio, Inc. is based in San Diego, California.",NMS,"Dr. Patrick  Soon-Shiong F.A.C.S., FRCS (C), M.D., M.S., M.Sc.",United States,,false,false,true,https://immunitybio.com,,USD,684,San Diego,CA,844 696 5235,3530 John Hopkins Court,,2026-06-19T21:40:12+00:00,2026-06-19T14:29:11+00:00,Equity,,-0.34379,0.99338,-1.57877,0,1.676,,140976992,-245412992,-193704624,-854534016,36809000,-8.856799,-31.713,55.206,1124608000,-500469000,501898000,380879008
IDT,IDT Corporation,nan,1378215936,253543,153903,53.779999,53.330002,55.73,nan,nan,nan,53.830002,2026-06-19,,,0.653,23294240,17,3.26,Communication Services,Telecom Services,"IDT Corporation, together with its subsidiaries, provides communications and payment services in the United States, the United Kingdom, and internationally. It operates in four segments: National Retail Solutions, Fintech, Net2phone, and Traditional Communications. The company operates point of sale, a terminal-based platform which provides independent retailers with store management software, electronic payment processing, and other ancillary merchant services; and marketers with digital out-of-home advertising and transaction data. It also offers BOSS Money for international money remittance, and related value and payment transfer services, as well as net2phone solutions comprising unified communications as a service; contact center as a service under the uContact brand; net2phone AI, which delivers customer experiences across sales, support, and administrative tasks; and net2phone Coach, a workforce intelligence and coaching platform. In addition, the company provides IDT Digital Payments, which enables businesses, entrepreneurs, and developers to offer prepaid digital offerings, including mobile airtime top-up, mobile data bundles, digital gift cards, and eSIMs through its Zendit platform; and BOSS Revolution, which offers international long-distance voice calling to immigrant communities. Further, it provides IDT Global, a wholesale provider of international voice, SMS termination, and outsourced traffic management solutions to telecoms; and IDT Express, a mobile self-service portal paired with dedicated account managers backed by customer support. IDT Corporation was incorporated in 1978 and is headquartered in Newark, New Jersey.",NYQ,Mr. Howard S. Jonas,United States,,false,false,true,https://www.idt.net,,USD,1915,Newark,NJ,973 438 1000,520 Broad Street,0.48,2026-06-19T21:40:13+00:00,2026-06-19T14:29:12+00:00,Equity,0.25211,0.11119,0.37352,0.09413,0.06413,0.045,0.01,1275575040,123705000,34545624,81808000,3074000,3.850215,9.099,0.882,1378000,305131000,626203000,251427008
IEP,Icahn Enterprises L.P.,7.29,4899248640,998500,955947,7.3,7.25,7.32,7.29,0,0,7.29,2026-06-19,,,0.747,672050553,,-0.44,Energy,Oil & Gas Refining & Marketing,"Icahn Enterprises L.P., through its subsidiaries engages in the investment, energy, automotive, food packaging, real estate, home fashion and pharma in the United States and internationally. The Investment segment invests its proprietary capital through various private investment funds; and it provides investment advisory, administrative, and back-office services to the investment funds. The Energy segment engages in refining and marketing petroleum in the form of gasoline, diesel, jet fuel, and distillates; renewable fuels business refines renewable feedstocks, such as soybean oil, corn oil, and other related renewable feedstocks into renewable diesel and markets renewable products; and nitrogen fertilizer business produces and markets nitrogen fertilizers in the form of urea ammonium nitrate and ammonia. The Automotive segment engages in repair and maintenance of automotive; sale of installed parts or materials related to automotive services; and sale of automotive aftermarket parts and retailed merchandise. The Food Packaging segment produces and sells cellulosic, fibrous, and plastic casings used to prepare and pack processed meat products. The Real Estate segment consists of investment properties, including land, retail, office, and industrial properties; and development and sale of single-family homes; and the operations of a resort and two country clubs. The Home Fashion segment manufactures, sources, markets, distributes, and sells home fashion consumer products. The Pharma segment offers pharmaceutical products and services; and develops approved therapies and product candidates. Icahn Enterprises L.P. was incorporated in 1987 and is headquartered in Sunny Isles Beach, Florida.",NMS,Mr. Ted  Papapostolou,United States,,false,false,true,https://www.ielp.com,,USD,13562,Sunny Isles Beach,FL,305 422 4100,16690 Collins Avenue,27.25,2026-06-19T21:40:14+00:00,2026-06-19T14:29:13+00:00,Equity,-0.10149,0.00189,0.09081,-0.20197,-0.03364,0.198,,9779000320,647000000,100000000,-329000000,,2.384691,16.819,1.113,6848999936,0,14215000000,1299000064
INDO,Indonesia Energy Corporation Limited,nan,40313520,249115,937007,2.63,2.58,2.675,nan,nan,nan,2.7,2026-06-19,,,-0.686,15386840,,-0.35,Energy,Oil & Gas E&P,"Indonesia Energy Corporation Limited, together with its subsidiaries, operates as an oil and gas exploration and production company in Indonesia. Its principal assets include the Kruh Block, a producing block covering an area of 258.1 square kilometers located in the Pali, South Sumatra; and the Citarum Block, an exploration block covering approximately an area of 3,924.67 square kilometers located in the onshore of West Java. The company was incorporated in 2018 and is headquartered in Jakarta, Indonesia.",ASE,Dr. Wirawan  Jusuf,Indonesia,,false,false,true,https://indo-energy.com,,USD,39,Jakarta,,62 21 576 8888,GIESMART PLAZA,,2026-06-19T21:40:15+00:00,2026-06-19T14:29:14+00:00,Equity,-0.26948,-0.12812,-0.28071,-2.28733,-2.53401,-0.23,,2012543,-4018424,-2883233,-5099805,0,1.996951,-8.728,17.427,833985,19658520,22755376,5459309
IVV,iShares Core S&P 500 ETF,750.109985,,11639300,8306447,751.25,747.27002,751.710022,750.109985,7.5,1.009951,742.609985,2026-06-19,,,,621550016,26.987198,,,,"The index measures the performance of the large-capitalization sector of the U.S. equity market, as determined by SPDJI. The fund generally will invest at least 80% of its assets in the component securities of its index and in investments that have economic characteristics that are substantially identical to the component securities of its index and may invest up to 20% of its assets in certain futures, options and swap contracts, cash and cash equivalents.",PCX,,,,true,false,true,,,USD,,,,415-670-2000,,1.06,2026-06-19T21:40:17+00:00,2026-06-19T14:29:15+00:00,Equity,,,,,,,,,,,,,1.740867,,,,,854916988928,
JACK,Jack in the Box Inc.,nan,244142288,572243,842184,12.53,12.53,13.39,nan,nan,nan,12.4,2026-06-19,,,1.46,19073616,,-5.55,Consumer Cyclical,Restaurants,"Jack in the Box Inc., together with its subsidiaries, develops, operates, and franchises quick-service restaurants (QSR) in the United States. It operates through Jack in the Box and Del Taco segments. The company engages in the operation of a hamburger chain under the Jack in the Box brand; and a Mexican-American QSR chain under the Del Taco brand. The company was formerly known as Foodmaker, Inc and changed its name to Jack in the Box Inc. in November 1999. Jack in the Box Inc. was founded in 1951 and is headquartered in San Diego, California.",NMS,Ms. Dawn E. Hooper,United States,2026-03-25,false,false,true,https://www.jackinthebox.com,,USD,1316,San Diego,CA,858 571 2121,9357 Spectrum Center Blvd.,15.71,2026-06-19T21:40:17+00:00,2026-06-19T14:29:16+00:00,Equity,,0.04352,0.26994,0.13544,0.02486,-0.043,,1432300032,228510000,-378000,-105484000,8238000,-0.264539,12.288,1.96,2610130944,-938271000,2593421000,43035000
JBLU,JetBlue Airways Corporation,5.68,2113067136,40473900,28418239,5.29,5.29,5.69,5.68,0.55,10.721242,5.13,2026-06-19,,,1.746,372018894,,-1.93,Industrials,Airlines,"JetBlue Airways Corporation provides air transportation services. The company operates a fleet of Airbus A220, Airbus A320, Airbus A320 Restyled, Airbus A321, Airbus A321 with Mint, Airbus A321neo, Airbus A321neo with Mint, and Airbus A321neoLR with Mint aircraft. It also serves 100 destinations across the United States, the Caribbean, Latin America, Canada, and Europe. In addition, it operates airport lounges, as well as provides vacation services. JetBlue Airways Corporation was incorporated in 1998 and is based in Long Island City, New York.",NMS,Ms. Joanna L. Geraghty,United States,,false,false,true,https://www.jetblue.com,,USD,19447,Long Island City,NY,718 286 7900,27-01 Queens Plaza North,,2026-06-19T21:40:18+00:00,2026-06-19T14:29:17+00:00,Equity,-0.33514,-0.01439,0.22102,-0.1,-0.07782,0.047,,9162000384,245000000,-1098125056,-713000000,40000000,1.167523,37.171,0.994,9333999616,2120000000,16570000000,2168999936
JD,"JD.com, Inc.",27.57,37233283072,7942600,9737100,27.690001,27.450001,27.83,27.57,-0.34,-1.218202,27.91,2026-06-19,,,0.375,1350500000,20.124086,1.37,Consumer Cyclical,Internet Retail,"JD.com, Inc. operates as a supply chain-based technology and service provider in the People's Republic of China and Europe. It operates through three segments: JD Retail, JD Logistics, and New Businesses. The company provides home appliances; mobile handsets and other digital products; computers, including desktop, laptop, and other various products, as well as printers and other office equipment; furniture and household goods; apparel; cosmetics and other personal care items; and pet products. It offers women's shoes, bags, watches, jewelry, and luxury goods; men's shoes, sports gear, and fitness equipment; automobiles and accessories; maternal and childcare products; toys and musical instruments; food, beverages, and fresh produce; gifts, flowers, and plants; and pharmaceutical and healthcare products, such as OCT pharmaceutical products, nutritional supplements, healthcare services, and other healthcare equipment. In addition, the company provides books, e-books, music, movies, and other media products; virtual goods consisting of online travel agency, attraction tickets, and prepaid phone cards and game cards; industrial products; and installation and maintenance services. Further, it offers online marketplace services for third-party merchants; marketing services; and omni-channel solutions to customers and offline retailers, as well as online healthcare services. Additionally, the company develops, owns, and manages its logistics facilities and other real estate properties to support third parties; and offers asset management services and integrated service platform; leasing of storage facilities and related management services, as well as engages in online retail business; technology-driven supply chain solutions; and logistics services. The company was formerly known as 360buy Jingdong Inc. and changed its name to JD.com, Inc. in January 2014. JD.com, Inc. was incorporated in 2006 and is headquartered in Beijing, the People's Republic of China.",NMS,Mr. Qiangdong  Liu,China,,false,false,true,https://www.jd.com,,USD,900000,Beijing,,86 400 606 5500,"Building A, 20th Floor",3.52,2026-06-19T21:40:19+00:00,2026-06-19T14:29:18+00:00,Equity,0.06004,-0.00278,0.0932,0.01206,0.01046,0.049,-0.507,1323697045504,7084000256,7005875200,13843000320,4726000000,1.183697,1.278,0.007,108019998720,225040000000,695201000000,202132996096
JEF,Jefferies Financial Group Inc.,nan,12695245824,1549997,2202565,61.689999,61.5,62.926998,nan,nan,nan,61.880001,2026-06-19,,,,204432307,20.838926,2.98,Financial Services,Capital Markets,"Jefferies Financial Group Inc. operates as an investment banking and capital markets firm in the Americas, Europe, the Middle East, and the Asia-Pacific. It operates in two segments, Investment Banking and Capital Markets, and Asset Management. The company provides investment banking and advisory services for mergers or acquisitions, debt financing, restructurings, and private capital advisory transactions; underwriting and placement services related to corporate debt, municipal debt, mortgage-backed and asset-backed securities, equity and equity-linked securities, and loan syndication services; and corporate lending services. It also offers financing, securities lending, and other prime brokerage services; equities research, sales, and trading services; wealth management services; and online foreign exchange trading services. In addition, the company provides investment-grade distressed debt securities, U.S. and European government and agency securities, municipal bonds, leveraged loans, emerging markets debt, interest rates, and credit index derivative products; and manages and offers services to a diverse group of alternative asset management platforms across a spectrum of investment strategies and asset classes. It serves public companies, private companies, sponsors and owners, institutional investors, and government entities. The company was formerly known as Leucadia National Corporation and changed its name to Jefferies Financial Group Inc. in May 2018. Jefferies Financial Group Inc. was founded in 1962 and is headquartered in New York, New York.",NYQ,Mr. Joseph Saul Steinberg,United States,,false,false,true,https://www.jefferies.com,,USD,7596,New York,NY,212 284 2300,520 Madison Avenue,,2026-06-19T21:40:20+00:00,2026-06-19T14:29:19+00:00,Equity,,,0.02625,0.13408,0.23019,0.266,0.228,5402596864,,,388839520,88227000,1.196394,,-1.459,36643414016,10574696000,76012347000,57255104512
