ticker,name,price,marketcap,volume,volumeavg,priceopen,low,high,close,change,changepct,closeyest,date,high52,low52,beta,shares,pe,eps,sector,industry,description,exchange,ceo,country,ipodate,isetf,isfund,isactive,web_url,image,currency,employees,city,state,phone,address,dividend_yield,fetched_at,profile_fetched_at,asset_class,returnOnEquity,returnOnAssets,grossMargin,operatingMargin,profitMargin,revenueGrowth,earningsGrowth,revenue,ebitda,freeCashFlow,netIncome,stockBasedComp,priceToBook,evToEbitda,evToRevenue,totalDebt,totalEquity,totalAssets,cash,expenseRatio,currentRatio,quickRatio,debtToEquity,payoutRatio,pegRatio,heldPctInsiders,heldPctInstitutions,shortPctFloat
FMCC,Federal Home Loan Mortgage Corporation,5.7,3815849728,128787,2656475,5.9,5.7,5.94,5.7,-0.17,-2.896083,5.87,2026-07-02,,,1.653,650059553,Infinity,0,Financial Services,Mortgage Finance,"Federal Home Loan Mortgage Corporation operates in the secondary mortgage market in the United States. The company operates through two segments: Single-Family and Multifamily. The Single-Family segment purchases, securitizes, and guarantees single-family loans; and manages single-family mortgage credit and market risk, as well as manages mortgage-related investments portfolio, single-family securitization activities, and treasury functions. This segment also serves mortgage banking companies, commercial banks, regional banks, community banks, credit unions, HFAs, savings institutions, and non-depository institutions. The Multifamily segment engages in the purchase, securitization, and guarantee of multifamily loans; issuance of multifamily K certificates; manages multifamily mortgage credit and market risk; and invests in multifamily loans and mortgage-related securities. It also serves banks and other depository institutions, insurance companies, money managers, central banks, pension funds, state and local governments, REITs, non-depository institutions, and brokers and dealers. Federal Home Loan Mortgage Corporation was incorporated in 1970 and is headquartered in McLean, Virginia.",OQB,Mr. Kenny M. Smith,United States,,false,false,true,https://www.freddiemac.com,,USD,7334,McLean,VA,703 903 2000,8200 Jones Branch Drive,,2026-07-02T15:11:36+00:00,2026-07-02T12:24:19+00:00,Equity,0.16864,0.00332,1,0.68666,0.5028,0.158,,22862000128,,,-24000000,,-1.473394,,147.484,3410236014592,70384000000,3497598000000,144128999424,,96.523,96.218,4613.29,0,1.98,0,0.09899,
FND,"Floor & Decor Holdings, Inc.",58.16,6384040960,377483,3031449,58.200001,57.529999,60.255001,58.16,-0.900002,-1.523877,59.060001,2026-07-02,,,1.617,108094150,32.097828,1.84,Consumer Cyclical,Home Improvement Retail,"Floor & Decor Holdings, Inc., together with its subsidiaries, operates as a multi-channel specialty retailer of hard surface flooring and related accessories, and commercial surfaces seller in the United States. The company offers wood-based laminate flooring, vinyl, and engineered/composite rigid core vinyl; porcelain and ceramic tile, porcelain mosaics and tile slabs; grout, mortar, backer board, tools, adhesives, underlayments, moldings, and stair treads; and decorative tiles and mosaics, such as natural stone, porcelain, ceramic, glass, wall tile, and decorative trims. The company also provides solid prefinished and unfinished hardwood, engineered hardwood, bamboo, and wood countertops; marble, limestone, travertine, slate, ledger; and vanities, shower doors, bath accessories, faucets, sinks, custom countertops, bathroom mirrors, bathroom lighting, and kitchen cabinets. It sells products through its warehouse-format stores and five small-format design studios, as well as through Website, FloorandDecor.com. The company serves professional installers, commercial businesses, and homeowners. The company was formerly known as FDO Holdings, Inc. and changed its name to Floor & Decor Holdings, Inc. in April 2017. Floor & Decor Holdings, Inc. was founded in 2000 and is headquartered in Atlanta, Georgia.",NYQ,Mr. Thomas V. Taylor Jr.,United States,,false,false,true,https://www.flooranddecor.com,,USD,10469,Atlanta,GA,404 471 1634,2500 Windy Ridge Parkway SE,,2026-07-02T15:11:37+00:00,2026-07-02T12:24:21+00:00,Equity,0.08527,0.02945,0.4501,0.04547,0.04266,-0.007,-0.182,4675625984,500385984,78788872,199478000,29505000,2.598557,16.182,1.732,2006609024,2408836000,5469358000,293632000,,1.15,0.291,81.678,0,,0.0132,1.18294,0.1274
FNMA,Federal National Mortgage Association,6.21,7261209088,331916,4736280,6.36,6.2,6.44,6.21,-0.06,-0.956937,6.27,2026-07-02,,,1.604,1158087567,627,0.01,Financial Services,Mortgage Finance,"Federal National Mortgage Association provides financing solutions for residential mortgages in the United States. The company operates in two segments, Single-Family and Multifamily. It offers mortgage acquisitions and securitizations; and credit risk and loss management services. The company also engages in mortgage securitization transactions, including lender swap, portfolio securitization, and structured securitization transactions; and credit risk and loss management services. Federal National Mortgage Association was incorporated in 1938 and is based in Washington, District Of Columbia.",OQB,Mr. Peter Andrew Akwaboah,United States,,false,false,true,https://www.fanniemae.com,,USD,7000,Washington,DC,800 232 6643,Midtown Center,,2026-07-02T15:11:38+00:00,2026-07-02T12:24:22+00:00,Equity,0.13672,0.00333,1,0.73385,0.53004,-0.044,9.835,27210999808,,,68000000,,-0.265994,,154.95,4172801900544,109012000000,4317538000000,103680000000,,130.345,129.033,3703.659,0,,0,0.22286,
FNV,Franco-Nevada Corporation,215.054993,40208453632,247445,829381,213.985001,213.660004,217.639999,215.054993,6.564987,3.148826,208.490005,2026-07-02,,,0.889,192855530,29.323488,7.11,Basic Materials,Gold,"Franco-Nevada Corporation operates as a royalty and stream company focused on precious metals in South America, Central America, Mexico, the United States, Canada, Australia, Europe, and Africa. The company operates through Precious Metals, Other Mining and Energy segments. It also manages its portfolio with a focus on precious metals, such as gold, silver, and platinum group metals; and engages in the sale of crude oil, natural gas, and natural gas liquids through a third-party marketing agent. Franco-Nevada Corporation was founded in 1986 and is headquartered in Toronto, Canada.",NYQ,Mr. Paul  Brink,Canada,,false,false,true,https://www.franco-nevada.com,,USD,,Toronto,ON,416 306 6300,199 Bay Street,0.84,2026-07-02T15:11:38+00:00,2026-07-02T12:24:23+00:00,Equity,0.19041,0.13019,0.91824,0.7926,0.65666,0.777,1.231,2087699968,1920600064,-827950016,1370899968,6300000,4.959915,20.632,18.981,0,7635300000,8241400000,714700032,,6.155,5.431,,0.2225,,0.00618,0.85397,
FOSL,"Fossil Group, Inc.",4.17,249999776,68904,876436,4.24,4.17,4.305,4.17,-0.06,-1.418438,4.23,2026-07-02,,,1.63,59101598,,-1.13,Consumer Cyclical,Footwear & Accessories,"Fossil Group, Inc., together with its subsidiaries, designs, develops, markets, and distributes consumer fashion accessories in the United States, Europe, Asia, and internationally. The company's products include traditional watches, smartwatches, jewelry, handbags, small leather goods, belts, and sunglasses. It also manufactures and distributes private label brands. The company offers its products under its proprietary brands, such as FOSSIL, SKAGEN, MICHELE, RELIC, and ZODIAC; and under the licensed brands, including ARMANI EXCHANGE, DIESEL, EMPORIO ARMANI, KATE SPADE NEW YORK, MICHAEL KORS, SKECHERS, and TORY BURCH. It sells its products through company-owned retail and outlet stores, department and specialty retail stores, mass market stores, e-commerce sites, licensed and franchised FOSSIL retail stores, retail concessions, and airlines, as well as operate stores under the WATCH STATION and WSI brands. The company was formerly known as Fossil, Inc. and changed its name to Fossil Group, Inc. in May 2013. Fossil Group, Inc. was founded in 1984 and is headquartered in Richardson, Texas.",NMS,Mr. Franco  Fogliato,United States,,false,false,true,https://www.fossilgroup.com,,USD,4500,Richardson,TX,972 234 2525,901 South Central Expressway,,2026-07-02T15:11:39+00:00,2026-07-02T12:24:24+00:00,Equity,-0.5845,0.02615,0.55716,0.06293,-0.06179,-0.037,,995873984,39450000,61014624,-61533000,2317000,2.385787,12.341,0.489,334147008,102835000,689254000,81384000,,1.72,0.782,401.778,0,1.23,0.04249,0.61045,0.0537
FOUR,"Shift4 Payments, Inc.",50.880001,4877193728,294122,1725795,50.029999,49.959999,51.275002,50.880001,1.68,3.414635,49.200001,2026-07-02,,,1.422,79328924,56.551723,0.87,Technology,Software - Infrastructure,"Shift4 Payments, Inc. engages in the provision of software and payment processing solutions in the United States and internationally. The company offers a payments platform, which provides omnichannel card acceptance; and processing solutions across multiple payment types, including credit, debit, contactless card, Europay, MasterCard and Visa, QR Pay, and mobile wallets, as well as alternative payment methods, such as Apple Pay, Google Pay, Alipay, and WeChat Pay. It also provides technology solutions, such as SkyTab POS, which provides purpose-built POS workstations; SkyTab Mobile, which provides pay-at-the-table, order-at-the-table, delivery, customer feedback, and email marketing solutions; SkyTab Venue, which provides mobile ordering, countertop POS, self-service kiosk, and digital wallet solutions; Lighthouse, a cloud-based suite of business intelligence tools that includes customer engagement, social media management, online reputation management, scheduling and product pricing, extensive reporting, and analytics; The Giving Block, a cryptocurrency donation marketplace; Shift4Shop, an e-commerce platform that creates a web store and tools to manage product catalog, order fulfillment and inventory management, search engine optimization, and secure hosting; and Marketplace, which enables integrations into third-party applications, as well as loyalty and inventory management. In addition, the company offers merchant operations and support services, including underwriting, onboarding, and activation; training; risk management; and support services. Further, it provides software partner operations and support services, including software integrations and compliance management; partner support; and partner services. The company distributes its products through independent software vendors, internal sales and support networks, enterprises, and value-added resellers. Shift4 Payments, Inc. was founded in 1999 and is headquartered in Center Valley, Pennsylvania.",NYQ,Mr. David Taylor Lauber,United States,2020-06-05,false,false,true,https://www.shift4.com,,USD,6300,Center Valley,PA,888 276 2108,3501 Corporate Parkway,,2026-07-02T15:11:40+00:00,2026-07-02T12:24:25+00:00,Equity,0.09943,0.0367,0.351,0.04996,0.02627,0.322,,4453000192,851000000,488449984,62000000,82000000,6.022769,10.745,2.053,4582000128,1442000000,8713000000,473000000,,1.222,0.692,257.416,0,0.3527,0.30355,0.94973,0.2139
FRO,Frontline plc,36.759998,7725014528,913514,3195145,35.939999,35.939999,37.02,36.759998,2.059998,5.936592,34.700001,2026-07-02,,,0.022,222622889,8.546799,4.06,Energy,Oil & Gas Midstream,"Frontline plc, a shipping company, engages in the ownership and operation of oil and product tankers worldwide. The company owns and operates oil and product tankers, such as very large crude carriers (VLCCs), Suezmax tankers, and LR2/Aframax tankers. As of December 31, 2025, it operated a fleet of 80 vessels, including 41 VLCCs, 21 Suezmax tankers, and 18 LR2/Aframax tankers. The company is also involved in the charter, purchase, and sale of vessels. Frontline plc was founded in 1985 and is based in Limassol, Cyprus.",NYQ,Mr. Lars H. Barstad,Cyprus,,false,false,true,https://www.frontlineplc.cy,,USD,85,Limassol,,357 2 5588767,Iris House,9.02,2026-07-02T15:11:41+00:00,2026-07-02T12:24:27+00:00,Equity,0.35009,0.09212,0.55826,0.51809,0.40192,0.669,15.797,2251480064,1169954048,373963616,904913984,5560000,2.718797,8.448,4.39,2631087104,2511350000,5753627000,471672000,,2.034,1,92.619,0.4335,5.58,0.35787,0.35733,0.0501
FTDR,"Frontdoor, Inc.",77.394997,5509227520,98455,615129,78.82,77.300003,80.089996,77.394997,-1.045006,-1.332236,78.440002,2026-07-02,,,1.509,70234922,22.411428,3.5,Consumer Cyclical,Personal Services,"Frontdoor, Inc. provides home warranties and new home builder warranties in the United States. The company offers customizable home warranties that help customers to protect and maintain their homes from costly and unplanned breakdowns of essential home systems and appliances. Its home warranty customers subscribe to an annual service plan agreement that covers the repair or replacement of principal components of home systems and appliances, including electrical, plumbing, water heaters, refrigerators, dishwashers, and ranges/ovens/cooktops, as well as pools, spas, and pumps; and heating, ventilation, and air conditioning systems. It also offers non-warranty home services through website and application; a one-stop app experience for home repair and maintenance using video chat, augmented reality, and computer vision and machining learning. The company operates under the American Home Shield, HSA, OneGuard, Landmark, and 2-10 HBW brand names. Frontdoor, Inc. was founded in 1971 and is headquartered in Memphis, Tennessee.",NMS,Mr. William C. Cobb,United States,,false,false,true,https://www.frontdoorhome.com,,USD,2034,Memphis,TN,901 701 5000,3400 Players Club Parkway,,2026-07-02T15:11:41+00:00,2026-07-02T12:24:28+00:00,Equity,1.21028,0.12019,0.55241,0.14634,0.12229,0.059,0.163,2118000000,498000000,328124992,259000000,34000000,24.053972,12.259,2.883,1199000064,242000000,2142000000,603000000,,1.466,1.359,521.304,0,2.38,0.00748,1.07008,0.058
FXI,iShares China Large-Cap ETF,31.870001,,13019054,28007293,31.950001,31.820101,32.134998,31.870001,-0.099998,-0.312788,31.969999,2026-07-02,,,,129450000,9.252642,,,,The fund generally will invest at least 80% of its assets in the component securities of its underlying index and in investments that have economic characteristics that are substantially identical to the component securities of its underlying index. The index designed to measure the performance of the largest companies in the Chinese equity market that trade on the Stock Exchange of Hong Kong and are available to international investors. The fund is non-diversified.,PCX,,,,true,false,true,,,USD,,,,415-670-2000,,2.63,2026-07-02T15:11:42+00:00,2026-07-02T12:24:29+00:00,Equity,,,,,,,,,,,,,0.792199,,,,,5520180736,,0.73,,,,,,,,
GNK,Genco Shipping & Trading Limited,24.875,1074610048,36053,344459,24.99,24.75,25.110001,24.875,0.215,0.871858,24.66,2026-07-02,,,0.908,43577051,63.23077,0.39,Industrials,Marine Shipping,"Genco Shipping & Trading Limited, together with its subsidiaries, engages in the ocean transportation of drybulk cargoes worldwide. It operates through two segments: major bulk and minor bulk fleet. The company owns and operates dry bulk vessels to transports iron ore, grains, coal, steel products, and other drybulk cargoes. It charters its vessels primarily to trading houses, including commodities traders; producers; and government-owned entities. Genco Shipping & Trading Limited was incorporated in 2004 and is headquartered in New York, New York.",NYQ,Mr. John C. Wobensmith C.F.A.,United States,,false,false,true,https://www.gencoshipping.com,,USD,1056,New York,NY,646 443 8550,299 Park Avenue,4.66,2026-07-02T15:11:43+00:00,2026-07-02T12:24:30+00:00,Equity,0.019,0.01827,0.39203,0.13624,0.04378,0.606,,385214016,89625000,-139764992,16866000,7046000,1.213762,15.017,3.494,324495008,896484000,1138108000,54770000,,2.979,1.852,36.584,2.4359,,0.25917,0.54543,0.0268
GOGO,Gogo Inc.,3.525,469277696,402748,1877336,3.525,3.52,3.715,3.525,0.055,1.585016,3.47,2026-07-02,,,1.105,135238523,34.7,0.1,Communication Services,Telecom Services,"Gogo Inc., together with its subsidiaries, provides broadband connectivity services to the aviation industry in the United States and internationally. The company's product platform includes networks, antennas, and airborne equipment and software. The company offers in-flight systems; in-flight services; aviation partner support; and engineering, design, and development services, as well as production operations functions. It offers voice and data, in-flight entertainment, and other services. In addition, the company's infrastructure includes networks, towers, cyber security software and data centers to support in-flight connectivity services, as well as in the provision of telecommunications services. The company sells its products primarily to aircraft operators and original equipment manufacturers of business aviation aircraft through a distribution network of independent dealers. Gogo Inc. was founded in 1991 and is headquartered in Broomfield, Colorado.",NMS,Mr. Christopher J. Moore,United States,,false,false,true,https://www.gogoair.com,,USD,680,Broomfield,CO,303 301 3271,105 Edgeview Drive,,2026-07-02T15:11:43+00:00,2026-07-02T12:24:32+00:00,Equity,0.13899,0.05972,0.42931,0.14803,0.01541,-0.017,0.072,906502976,181655008,24533876,13966000,24072000,3.970252,6.968,1.396,903228992,101129000,1303772000,106732000,,1.66,1.056,765.319,0,,0.2492,0.72249,0.1869
GOLD,"Gold.com, Inc.",44.145,1233555968,143919,521934,43.330002,43.23,45.240002,44.145,1.615002,3.797324,42.529999,2026-07-02,,,0.605,29004374,13.85342,3.07,Financial Services,Capital Markets,"Gold.com, Inc., together with its subsidiaries, operates as a precious metals company. It operates through three segments: Wholesale Sales & Ancillary Services, Direct-to-Consumer, and Secured Lending. The Wholesale Sales & Ancillary Services segment sells gold, silver, platinum, and palladium in the form of bars, plates, powders, wafers, grains, ingots, and coins. This segment also offers complementary services, such as receiving, handling, inventorying, processing, packing, and shipping of precious metals and custom coins on a secure basis; and designs and produces minted silver products. The Direct-to-Consumer segment provides access to gold, silver, copper, platinum, and palladium products primarily through its websites; rarities and numismatic collections; and numismatic and bullion products. It operates various websites targeting specific niches within the precious metals retail market. This segment also operates as a direct retailer of precious metals to the investor community and markets its precious metal products on television, radio, and the internet, as well as through customer service outreach. The Secured Lending segment originates and acquires commercial loans secured by bullion, numismatic coins, and graded sports cards. The company serves customers, including financial institutions, bullion retailers, industrial manufacturers and fabricators, sovereign mints, refiners, coin and metal dealers, investors, collectors, and e-commerce and other retail customers. It operates in the United States, Europe, Canada, Asia Pacific, Africa, Australia, and South America. The company was formerly known as A-Mark Precious Metals, Inc. and changed its name to Gold.com, Inc. in December 2025. The company was founded in 1965 and is headquartered in Costa Mesa, California.",NYQ,Mr. Gregory N. Roberts,United States,,false,false,true,https://www.gold.com,,USD,956,Costa Mesa,CA,844 455-4653,1550 Scenic Ave,1.88,2026-07-02T15:11:44+00:00,2026-07-02T12:24:34+00:00,Equity,0.10819,0.02759,0.01844,0.00865,0.0035,2.44,,23020443648,173514000,-743910528,80508000,1594000,1.429243,16.028,0.121,1654208000,649516000,2215431000,143607008,,1.176,0.126,182.406,0.2606,,0.33126,0.60652,0.162
GOOS,Canada Goose Holdings Inc.,9.545,927710336,110335,560980,9.62,9.54,9.7199,9.545,-0.005,-0.052357,9.55,2026-07-02,,,1.779,46138366,59.687504,0.16,Consumer Cyclical,Apparel Manufacturing,"Canada Goose Holdings Inc., together with its subsidiaries, designs, manufactures, and sells performance luxury outerwear, apparel, footwear, and accessories for men, women, youth, children, and babies. It operates through three segments: Direct-to-Consumer, Wholesale, and Other. The company offers leisure wear, including knitwear, sweats, and t-shirts; outerwear products, including rain and everyday collections, jackets for everyday occasions, fleece, and vests; footwear and accessories products, such as sneakers, boots, hats, scarves, gloves, hood trims, socks, bags and eyewear; and lightweight and heavyweight down jackets for the fall, winter, and spring seasons. It sells its products through e-commerce channels and directly operated retail stores. The company offers its products under Canada Goose, Snow Goose, and Baffin brands in Canada, the United States, North America, Greater China, rest of the Asia Pacific, Europe, the Middle East, and Africa. Canada Goose Holdings Inc. was founded in 1957 and is headquartered in Toronto, Canada.",NYQ,Mr. Daniel  Reiss C.M.,Canada,,false,false,true,https://www.canadagoose.com,,USD,,Toronto,ON,416 780 9850,100 Queens Quay East,,2026-07-02T15:11:45+00:00,2026-07-02T12:24:35+00:00,Equity,0.04694,0.05495,0.69723,0.27553,0.01472,0.179,0.03,1528199936,191700000,192675008,22500000,23500000,2.166627,6.907,0.866,785200000,608400000,1753200000,408200000,,2.628,1.456,125.072,0,,0.16216,0.63015,0.0868
GRNY,Fundstrat Granny Shots US Large Cap ETF,27.629999,,618751,1767608,27.83,27.58,27.959999,27.629999,-0.050001,-0.18064,27.68,2026-07-02,,,,,29.885147,,,,"The fund, an actively-managed exchange-traded fund (“ETF”), seeks to achieve its investment objective by investing in U.S. large capitalization equity securities. Under normal market circumstances, the fund will invest at least 80% of its net assets (including any borrowings for investment purposes) in large-cap U.S. companies. The fund's managers consider large-cap U.S. companies to be those companies with a market capitalization of greater than $10 billion or more.",PCX,,,,true,false,true,,,USD,,,,(469) 442-8424,,0,2026-07-02T15:11:46+00:00,2026-07-02T12:24:37+00:00,Equity,,,,,,,,,,,,,,,,,,4463949312,,0.75,,,,,,,,
GRPN,"Groupon, Inc.",24.700001,975428608,347009,2060165,25.799999,24.629999,25.799999,24.700001,-0.98,-3.816198,25.68,2026-07-02,,,0.251,37983980,,-2.57,Communication Services,Internet Content & Information,"Groupon, Inc. operates a marketplace that connects consumers to merchants by offering goods and services at a discount in North America and international. It provides deals in various categories, including beauty and wellness, food and drink, home and automotive services, and online services, as well as various types of experiences and services; and discounted and market rates for hotels, airfare, and package deals, as well as deals on various product lines, such as electronics, sporting goods, jewelry, toys, household items, and apparel. The company offers its deal offerings to customers through websites; search engines; applications and mobile websites, which enable consumers to browse, purchase, manage, and redeem deals on their mobile devices; emails and push notifications; affiliate channels; social and display advertising; and offline marketing. Groupon, Inc. was incorporated in 2008 and is headquartered in Chicago, Illinois.",NMS,Mr. Dusan  Senkypl,United States,,false,false,true,https://www.groupon.com,,USD,1734,Chicago,IL,773 945 6801,35 West Wacker Drive,,2026-07-02T15:11:47+00:00,2026-07-02T12:24:37+00:00,Equity,,0.00791,0.90742,-0.02826,-0.20776,0,,498435008,8405000,80421128,-103379000,37774000,-15.940411,126.618,2.135,314188000,-42562000,670406000,225514000,,0.807,0.676,,0,14.66,0.20277,1.48057,0.5577
GSL,"Global Ship Lease, Inc.",38.575001,1361418624,72668,315591,38.34,38.240002,38.93,38.575001,0.795002,2.104293,37.779999,2026-07-02,,,0.883,36035434,3.611855,10.46,Industrials,Marine Shipping,"Global Ship Lease, Inc., together with its subsidiaries, engages in owning and chartering out containerships under fixed-rate charters to container liner companies worldwide. As of March 12, 2026, it owned 71 mid-sized and smaller containerships, ranging from 2,207 to 11,040 (TEU), with an aggregate capacity of 423,003 TEU. Global Ship Lease, Inc. was founded in 2007 and is based in Athens, Greece.",NYQ,Mr. Georgios Giouroukos Youroukos,Greece,,false,false,true,https://www.globalshiplease.com,,USD,7,Athens,,30 210 62 33 670,9 Irodou Attikou Street,6.62,2026-07-02T15:11:47+00:00,2026-07-02T12:24:39+00:00,Equity,0.22471,0.08817,0.6891,0.50783,0.51106,0.022,-0.26,757036032,465294016,252274624,377353984,13964000,0.723602,3.17,1.949,652881984,1801084000,2861203000,534736000,,2.26,1.956,34.814,0.2199,0.87,0.11231,0.48745,0.0203
