ticker,name,price,marketcap,volume,volumeavg,priceopen,low,high,close,change,changepct,closeyest,date,high52,low52,beta,shares,pe,eps,sector,industry,description,exchange,ceo,country,ipodate,isetf,isfund,isactive,web_url,image,currency,employees,city,state,phone,address,dividend_yield,fetched_at,profile_fetched_at,asset_class,returnOnEquity,returnOnAssets,grossMargin,operatingMargin,profitMargin,revenueGrowth,earningsGrowth,revenue,ebitda,freeCashFlow,netIncome,stockBasedComp,priceToBook,evToEbitda,evToRevenue,totalDebt,totalEquity,totalAssets,cash
OPK,"OPKO Health, Inc.",1.42,1072230912,5231800,2613926,1.43,1.41,1.46,1.42,0.01,0.709219,1.41,2026-06-19,,,1.49,755092256,,-0.27,Healthcare,Diagnostics & Research,"OPKO Health, Inc. operates as a healthcare company, in the United States, Ireland, Chile, Spain, Israel, Mexico, and internationally. The company operates in two segments, Pharmaceutical and Diagnostics. The Pharmaceutical segment develops MDX2001, a tetra-specific antibody targeting several types of solid tumors in Phase 1 clinical trials; MDX2003, a tetra-specific antibody targeting two antigens for hematological tumors in Phase 1 clinical trials; and MDX2004, a trispecific immune modulator to rebuild and sustain the patient's own immune system. This segment also engages in the development of Epstein Barr Virus vaccine; Rayaldee, a patented extended-release product for oral administration containing 30 mcg of a prohormone; OPK-88006 oral and injectable product to regulate blood glucose and reduce body weight; NGENLA, recombinant human growth hormone product developed for the long-term treatment of pediatric patients with growth hormone deficiency. The Diagnostics segment offers laboratory testing services, such as detection, diagnosis, evaluation, monitoring, and treatment of diseases, as well as esoteric testing, molecular diagnostics, anatomical pathology, genetics, women's health, and correctional healthcare under the BioReference brand; and 4Kscore test. OPKO Health, Inc. was founded in 2006 and is headquartered in Miami, Florida.",NMS,"Dr. Phillip  Frost M.D., Ph.D.",United States,,false,false,true,https://www.opko.com,,USD,2275,Miami,FL,305 575 4100,4400 Biscayne Boulevard,,2026-06-19T21:41:02+00:00,2026-06-19T14:30:00+00:00,Equity,-0.16923,-0.06362,0.14917,-0.41078,-0.36639,-0.172,,581123008,-112493000,-36094624,-212915008,10714000,0.890282,-9.909,1.918,396927008,1267959000,1931944000,331862016
OSCR,"Oscar Health, Inc.",28.4,8562400768,6781300,7505061,28.57,27.57,28.85,28.4,0.129999,0.459848,28.27,2026-06-19,,,2.391,265902000,,-0.54,Healthcare,Healthcare Plans,"Oscar Health, Inc. operates as a healthcare technology company in the United States. The company offers health plans to individuals, families, employees, and small group markets. It also provides +Oscar platform that power others throughout the healthcare system; Campaign Builder platform, an engagement and recommendation platform for providers and payors; and reinsurance products. In addition, the company offers brokerage services and enrollment platform for brokers and consumers to shop, buy, and enroll in medical and supplemental health products. The company was formerly known as Mulberry Health Inc. and changed its name to Oscar Health, Inc. in January 2021. Oscar Health, Inc. was incorporated in 2012 and is headquartered in New York, New York.",NYQ,Mr. Mark Thomas Bertolini,United States,2021-03-03,false,false,true,https://www.hioscar.com,,USD,2305,New York,NY,646 403 3677,75 Varick Street,,2026-06-19T21:41:03+00:00,2026-06-19T14:30:01+00:00,Equity,-0.02623,0.00088,0.17389,0.15151,-0.00296,0.526,1.256,13302358016,39785000,1627705344,-39426000,87654000,5.100575,57.489,0.172,482244000,977648000,6325411000,6799782912
OSIS,"OSI Systems, Inc.",nan,3672058112,286128,311720,220.205002,216.279999,227.289902,nan,nan,nan,217.509995,2026-06-19,,,1.204,16482890,25.489702,8.74,Technology,Electronic Components,"OSI Systems, Inc. designs and manufactures electronic systems and components in the United States and internationally. It operates in three segments: Security, Healthcare, and Optoelectronics and Manufacturing. The company offers baggage and parcel inspection, cargo and vehicle inspection, hold baggage and people screening, radiation monitoring, explosive and narcotics trace detection systems, and optical inspection systems, and radio frequency (RF) equipment under the Rapiscan name. It also provides site design, installation, training, and technical support services; and turnkey security screening solutions under the S2 name. In addition, the company offers patient monitoring, cardiology and remote monitoring, and connected care systems and accessories under the Spacelabs name for use in critical care, emergency, and perioperative areas within hospitals, physicians' offices, medical clinics, and ambulatory surgery centers. Further, it provides optoelectronic devices and flex circuits under the OSI Optoelectronics, OSI LaserDiode, and Advanced Photonix names for the aerospace and defense, avionics, medical imaging and diagnostics, biochemistry analysis, pharmaceutical, nanotechnology, telecommunications, construction, and homeland security markets. Additionally, the company offers electronics manufacturing services to original equipment manufacturers and end users for medical, automotive, defense, aerospace, industrial, and consumer applications under the OSI Electronics, APlus Products, Altaflex, and PFC Flexible Circuits names; and LCD displays for medical, industrial, and consumer electronics applications. The company was incorporated in 1987 and is headquartered in Hawthorne, California.",NMS,Mr. Ajay  Mehra,United States,,false,false,true,https://www.osi-systems.com,,USD,7337,Hawthorne,CA,310 978 0516,12525 Chadron Avenue,,2026-06-19T21:41:04+00:00,2026-06-19T14:30:02+00:00,Equity,0.17165,0.06069,0.32839,0.13101,0.08424,0.02,-0.029,1806910976,265360000,36977752,152219008,31959000,4.105938,16.347,2.401,1045211008,951084000,2241257000,345236000
OVV,Ovintiv Inc.,nan,14728184832,7119860,3860471,52.849998,52.02,53.18,nan,nan,nan,53.610001,2026-06-19,,,0.527,281018601,17.240131,3.04,Energy,Oil & Gas E&P,"Ovintiv Inc., together with its subsidiaries, operates as an oil and natural gas exploration and production company in North America. The company operates through USA Operations and Canadian Operations segments. It is involved in the exploration, development, production, and marketing of oil, NGLs, natural gas and other related activities in the Permian in West Texas and Anadarko in West-central Oklahoma in the United States, as well as in northwest Alberta and northeast British Columbia. The company was formerly known as Encana Corporation and changed its name to Ovintiv Inc. in January 2020. Ovintiv Inc. was incorporated in 2020 and is based in Denver, Colorado.",NYQ,Mr. Brendan Michael McCracken,United States,,false,false,true,https://www.ovintiv.com,,USD,1465,Denver,CO,303 623 2300,370 17th Street,2.24,2026-06-19T21:41:05+00:00,2026-06-19T14:30:04+00:00,Equity,0.07126,0.06467,0.5269,0.2922,0.08697,0.085,,8865000448,4392000000,875625024,771000000,,1.28192,5.195,2.574,7809999872,11195000000,20390000000,26000000
PALI,"Palisade Bio, Inc.",nan,324967968,3859940,3681587,1.79,1.79,1.93,nan,nan,nan,1.76,2026-06-19,,,,173579670,15.583334,0.12,Healthcare,Biotechnology,"Palisade Bio, Inc., a clinical-stage biopharmaceutical company, engages in developing oral phosphodiesterase-4 inhibitor prodrugs designed for targeted delivery to the terminal ileum and colon in the United States. Its lead clinical product candidate includes PALI-2108, which is in phase 1b clinical trial to treat patients with inflammatory bowel disease, including ulcerative colitis and Fibrostenotic Crohn's disease. The company has a research collaboration and license agreement with Giiant Pharma, Inc. for the development, manufacture, and commercialization of its compounds; license agreement with the Regents of the University of California for sole purpose of maintaining the Newsoara Co-Development; and a co-development and distribution agreement with Newsoara Biopharma Co., Ltd. The company was founded in 2001 and is headquartered in Denver, Colorado.",NCM,Mr. J. D. Finley,United States,,false,false,true,https://www.palisadebio.com,,USD,14,Denver,CO,858 704 4900,4600 South Syracuse Street,,2026-06-19T21:41:06+00:00,2026-06-19T14:30:05+00:00,Equity,-0.36401,-0.23404,0,0,0,,,,-26491250,-9602000,-24151000,3955000,2.457293,-6.657,,0,129380000,134344000,132628000
PCT,"PureCycle Technologies, Inc.",8.7,1746242688,5796400,5292474,8.89,8.62,8.92,8.7,0.08,0.928073,8.62,2026-06-19,,,2.455,200717550,,-1.47,Industrials,Pollution & Treatment Controls,"PureCycle Technologies, Inc. engages in the production of recycled polypropylene (PP) in Thailand. The company holds a license for restoring waste PP into ultra-pure recycled PP resin, PureFive, which has various applications, including packaging and labeling for consumer products, textiles, and plastic parts for various industries. Its recycling process separates color, odor, other plastics, and additives through a physical separation process. The company was founded in 2015 and is headquartered in Orlando, Florida.",NCM,Mr. Dustin  Olson,United States,2021-03-18,false,false,true,https://www.purecycle.com,,USD,174,Orlando,FL,877 648 3565,20 North Orange Avenue,,2026-06-19T21:41:07+00:00,2026-06-19T14:30:06+00:00,Equity,-0.80929,-0.12732,0,-10.12721,0,1.612,,10902000,-141291008,-97127504,-230151008,14935000,212.19511,-15.122,195.986,466455008,45887000,922666000,121095000
PEMX,Putnam Emerging Markets Ex-China ETF,nan,,1476,2938,93.650002,93.574997,93.965698,nan,nan,nan,90.170998,2026-06-19,,,,,21.644884,,,,"Under normal circumstances, the fund invests at least 80% of the fund’s net assets in securities of emerging market companies excluding companies domiciled, or whose stock is listed for trading on an exchange, in China, as well as companies domiciled in Hong Kong. Putnam Management invests significantly in small and mid-size companies. In evaluating potential investments, Putnam Management seeks high-quality companies with mispriced earnings growth that can potentially deliver excess return over the fund’s benchmark. The fund is non-diversified.",PCX,,,,true,false,true,,,USD,,,,6177601060,,1.09,2026-06-19T21:41:08+00:00,2026-06-19T14:30:07+00:00,Equity,,,,,,,,,,,,,,,,,,22117598,
PENN,"PENN Entertainment, Inc.",nan,2850863616,4113036,3807960,21.43,20.915001,21.559999,nan,nan,nan,21.23,2026-06-19,,,1.454,133744451,,-6.58,Consumer Cyclical,Resorts & Casinos,"PENN Entertainment, Inc., together with its subsidiaries, provides integrated entertainment, sports content, and casino gaming experiences in the United States and internationally. The company operates through five segments: Northeast, South, West, Midwest, and Interactive. It operates a portfolio of casinos, racetracks, and online sports betting; online gaming portfolio, such as theScore Bet, an online sportsbook; theScore Casino, a stand-alone iCasino website and app; Hollywood Casino, an iCasino and theScore Bet website and app; PENN Game Studios, its in-house iCasino and social gaming content studio; and PENN Play, a customer loyalty program. The company also engages in gaming operations, including slot machines and table games; food and beverage offerings; and hotel visitation. It offers its products under the Ameristar, Argosy, Boomtown, Hollywood Casino, Hollywood Gaming, L'Auberge, M Resort, PENN Entertainment, and PENN Play, as well as theScore, theScore Bet, and theScore esports brands. The company was formerly known as Penn National Gaming, Inc. and changed its name to PENN Entertainment, Inc. in August 2022. PENN Entertainment, Inc. was founded in 1972 and is based in Wyomissing, Pennsylvania.",NMS,Mr. Jay A. Snowden,United States,,false,false,true,https://www.pennentertainment.com,,USD,23441,Wyomissing,PA,610 373 2400,825 Berkshire Blvd.,,2026-06-19T21:41:09+00:00,2026-06-19T14:30:08+00:00,Equity,-0.40059,0.01411,0.34529,0.05458,-0.13543,0.064,,7067599872,785500032,-223500000,-957200000,60900000,1.4804,16.878,1.876,11192999936,1834000000,14268500000,708000000
PHAT,"Phathom Pharmaceuticals, Inc.",10.88,867744768,1102000,1214912,11.24,10.59,11.4,10.88,-0.12,-1.090908,11,2026-06-19,,,0.51,79755953,,-2.09,Healthcare,Biotechnology,"Phathom Pharmaceuticals, Inc., a biopharmaceutical company, focuses on developing and commercializing treatments for gastrointestinal diseases in the United States. It develops VOQUEZNA, which has completed Phase III clinical trials for the treatment of erosive gastroesophageal reflux disease (GERD) and related heartburn in adults; and VOQUEZNA Triple Pak and VOQUEZNA Dual Pak that have completed Phase III clinical trials for treating Helicobacter pylori, as well as VOQUEZNA and vonoprazan for the treatment of heartburn associated with non-erosive GERD and eosinophilic esophagitis in adults and adolescents. The company was incorporated in 2018 and is headquartered in Florham Park, New Jersey.",NMS,Mr. Steven L. Basta M.B.A.,United States,,false,false,true,https://www.phathompharma.com,,USD,371,Florham Park,NJ,877 742 8466,100 Campus Drive,,2026-06-19T21:41:10+00:00,2026-06-19T14:30:09+00:00,Equity,,-0.20148,0.84933,-0.26547,-0.76772,1.044,,204892000,-96034000,-77528624,-157300000,28719000,-2.564828,-12.476,5.848,547217024,-438169000,259149000,180904000
PHYS,Sprott Physical Gold Trust,31.82,15168036864,2782700,3896844,32.130001,31.68,32.259998,31.82,-0.120001,-0.375707,31.940001,2026-06-19,,,,476682504,2.6875,,,,,ASE,,,,false,false,true,,,USD,,,,,,,2026-06-19T21:41:11+00:00,2026-06-19T14:30:10+00:00,Equity,,,,,,,,,,,,,,,,,15976483000,15979788000,
PLCE,"The Children's Place, Inc.",3.44,76495512,210500,528242,3.53,3.44,3.6,3.44,-0.04,-1.149424,3.48,2026-06-19,,,,22237067,,-4.84,Consumer Cyclical,Apparel Manufacturing,"The Children's Place, Inc., together with its subsidiaries, operates as an omni-channel children's specialty portfolio of brands in North America and internationally. It operates through two segments, The Children's Place U.S. and The Children's Place International. The company designs, contracts to manufacture, and sells apparel, accessories, and footwear primarily under The Children's Place, Gymboree, Sugar & Jade, PJ Place, Crazy 8, Place, Baby Place, and other brands. It offers its products through its digital storefronts, www.childrensplace.com and www.gymboree.com; physical stores in North America; wholesale marketplaces; and international franchise partners, as well as through social media channels. The company was formerly known as The Children's Place Retail Stores, Inc. and changed its name to The Children's Place, Inc. in June 2014. The Children's Place, Inc. was founded in 1969 and is headquartered in Secaucus, New Jersey.",NMS,Mr. Turki Saleh-A. Alrajhi,United States,,false,false,true,https://www.childrensplace.com,,USD,2500,Secaucus,NJ,201 558 2400,500 Plaza Drive,,2026-06-19T21:41:12+00:00,2026-06-19T14:30:11+00:00,Equity,,-0.05888,0.29116,-0.19598,-0.09089,-0.111,,1181929984,-41761000,14279625,-107431000,2988000,-0.713249,-16.895,0.597,633851008,-54183000,670299000,4781000
PLUG,Plug Power Inc.,2.85,3975946752,66373900,74788901,2.73,2.64,2.86,2.85,0.2,7.547162,2.65,2026-06-19,,,2.122,1395069082,,-1.39,Industrials,Electrical Equipment & Parts,"Plug Power Inc. designs, develops, and sells hydrogen products and solutions in Europe, Australia, North America, and internationally. The company offers GenDrive, a hydrogen fueled PEM fuel cell system, which powers material handling EVs, including Class 1, 2, 3 and 6 electric forklifts, automated guided vehicles, and ground support equipment; GenFuel, a liquid hydrogen fueling, delivery, generation, storage, and dispensing system; and GenCare, an Internet of Things based maintenance and on-site service program. It also provides GenKey, a turn-key solution; GenEco electrolyzers for clean hydrogen production; liquefaction systems; cryogenic equipment, such as trailers and mobile storage equipment for the distribution of liquified hydrogen, oxygen, argon, nitrogen, and other cryogenic gases; GenSure, a stationary fuel cell solution; and liquid hydrogen. The company serves customers in material handling operations, fuel cell electric vehicle fleets, and stationary power applications through its direct sales force, original equipment manufacturers, and dealer networks. Plug Power Inc. was incorporated in 1997 and is based in Slingerlands, New York.",NCM,Mr. Andrew J. Marsh,United States,,false,false,true,https://www.plugpower.com,,USD,2344,Slingerlands,NY,518 782 7700,125 Vista Boulevard,,2026-06-19T21:41:13+00:00,2026-06-19T14:30:12+00:00,Equity,-1.28791,-0.13572,-0.31239,-0.63559,-2.27134,0.223,,739758016,-613990016,-407408128,-1680242048,50545000,5.297398,-7.457,6.19,1010172992,978069000,2594568000,233388992
PRME,"Prime Medicine, Inc.",3.23,583394368,3501600,2488820,3.24,3.1,3.37,3.23,0.07,2.215188,3.16,2026-06-19,,,2.314,180617451,,-1.23,Healthcare,Biotechnology,"Prime Medicine, Inc., a biotechnology company, engages in delivering genetic medicines to address the spectrum of diseases by deploying gene editing technology in the United States. Its lead therapeutic product candidate is PM359 for Chronic Granulomatous Disease, which is in Phase 1/2 clinical trial; PM577 for Wilson Disease, that is in preclinical studies; and PM647 to treat genetic disorder caused by mutations in the SERPINA1 gene, resulting in production of misfolded Z-AAT protein that accumulates in the liver and leads to hepatocellular injury, cirrhosis, and increased risk of hepatocellular carcinoma. The company also provides vivo programs targeting diseases of the liver, and Cystic Fibrosis programs. In addition, it offers Prime Editing technology comprising a programmable DNA binding domains, such as Cas domains, are typically modified such that they do not cause a double-stranded break in the DNA, as well as a RT domain that copies the edited DNA sequence directly into the target genomic site where the edit is made; and pegRNA which contains a search sequence, also known as a spacer, which provides a target genomic address for the Prime Editor. The company has a research collaboration and license agreement with BMS; Cystic Fibrosis Foundation; Broad Institute; and Beam. Prime Medicine, Inc. was incorporated in 2019 and is headquartered in Cambridge, Massachusetts.",NGM,"Mr. Jeffrey D. Marrazzo M.B.A., M.P.A.",United States,2022-10-20,false,false,true,https://primemedicine.com,,USD,146,Cambridge,MA,617 465 0013,60 First Street,,2026-06-19T21:41:14+00:00,2026-06-19T14:30:13+00:00,Equity,-2.16065,-0.41462,0,-59.17523,0,-0.411,,4034000,-199135008,-78317504,-198374000,29268000,7.6,-2.498,123.299,114512000,120868000,342733000,135496992
QQQM,Invesco NASDAQ 100 ETF,304.519989,,3132400,4204496,303.5,301.619995,305.415009,304.519989,6.949982,2.335579,297.570007,2026-06-19,,,,,33.008545,,,,"The fund generally will invest at least 90% of its total assets in the securities that comprise the underlying index. The underlying index weights its component securities using a “modified market capitalization-weighted” methodology, which takes into account the market value of the component securities subject to certain weight restrictions pursuant to the index provider’s methodology. It is non-diversified.",NGM,,,,true,false,true,,,USD,,,,,,0.42,2026-06-19T21:41:15+00:00,2026-06-19T14:30:14+00:00,Equity,,,,,,,,,,,,,,,,,,96909074432,
QQQU,Direxion Daily Magnificent 7 Bull 2X Shares,nan,,52821,89073,52.93,51.470001,53.615002,nan,nan,nan,51.919998,2026-06-19,,,,,27.38809,,,,"The index is designed to track the performance of the seven largest NASDAQ listed companies, as identified by Indxx. The fund, under normal circumstances, invests at least 80% of its net assets in financial instruments, such as swap agreements, securities of the index, and ETFs that track the index, that, in combination, provide 2X daily leveraged exposure to the index, consistent with the fund's investment objective. The fund is non-diversified.",PCX,,,,true,false,true,,,USD,,,,866-476-7523,,8.65,2026-06-19T21:41:16+00:00,2026-06-19T14:30:15+00:00,Equity,,,,,,,,,,,,,,,,,,98320400,
RACE,Ferrari N.V.,nan,63752998912,406460,649373,357.079987,356.869995,363.089996,nan,nan,nan,354.279999,2026-06-19,,,0.595,176050032,34.72004,10.43,Consumer Cyclical,Auto Manufacturers,"Ferrari N.V., through its subsidiaries, engages in design, engineering, production, and sale of luxury performance sports cars worldwide. It offers sports, track, one-off, and road cars, as well as supercars. The company also provides spare parts and engines, as well as after sales, repair, maintenance, and restoration services for cars; and licenses its Ferrari brand to various producers and retailers of luxury and lifestyle goods. In addition, it operates Ferrari museums in Modena and Maranello; Il Cavallino restaurant in Maranello; and theme parks in Abu Dhabi and Spain. Further, the company provides direct or indirect finance and leasing services; range of financial and ancillary services; special financing arrangements; and operates franchised and owned Ferrari stores. The company was founded in 1947 and is headquartered in Maranello, Italy.",NYQ,Mr. John Jacob Philip Elkann,Italy,,false,false,true,https://www.ferrari.com,,USD,5740,Maranello,MO,39 05 36 94 91 11,Via Abetone Inferiore n. 4,1.15,2026-06-19T21:41:17+00:00,2026-06-19T14:30:16+00:00,Equity,0.41968,0.13083,0.51609,0.29479,0.22187,0.032,0.013,7203091968,2417952000,985850240,1598139008,,13.688139,27.191,9.127,2928934912,3906893000,9628352000,1816348032
REAL,"The RealReal, Inc.",12.45,1500072192,6351100,3435150,11.86,11.84,12.71,12.45,1.059999,9.306404,11.39,2026-06-19,,,2.711,120487728,,-0.63,Consumer Cyclical,Luxury Goods,"The RealReal, Inc. operates an online marketplace for resale luxury goods worldwide. It provides a range of product categories, including women's fashion, men's fashion, jewelry, and watches. The company sells products through its website, online marketplace, mobile app, and retail stores. The RealReal, Inc. was incorporated in 2011 and is headquartered in San Francisco, California.",NMS,Ms. Rati Sahi Levesque,United States,,false,false,true,https://www.therealreal.com,,USD,3140,San Francisco,CA,855 435 5893,55 Francisco Street,,2026-06-19T21:41:18+00:00,2026-06-19T14:30:17+00:00,Equity,,-0.02152,0.74479,-0.01199,-0.09033,0.185,,722526976,19186000,19607124,-65263000,28943000,-4.173651,88.778,2.357,464528992,-415518000,409033000,123952000
RH,RH,nan,2799044352,988982,1216622,138.289993,138.199997,148.470001,nan,nan,nan,135.669998,2026-06-19,,,1.903,18900969,28.533718,5.19,Consumer Cyclical,Specialty Retail,"RH, together with its subsidiaries, operates as a retailer and lifestyle brand in the home furnishings market in the United States, Canada, the United Kingdom, Germany, Belgium, and Spain. The company operates in three segments: RH Segment, Waterworks, and Real Estate. It offers merchandise in various categories, including furniture, lighting, textiles, bath ware, décor, and outdoor and garden furnishings, as well as baby, child, and teen furnishings. The company also operates galleries, interior design studios, outlets, guesthouses, and showrooms. It sells its products through hospitality, websites, sourcebooks, and trade and contract channels, as well as retail locations and outlets. The company was formerly known as Restoration Hardware Holdings, Inc. and changed its name to RH in January 2017. RH was founded in 1980 and is headquartered in Corte Madera, California.",NYQ,Mr. Gary G. Friedman,United States,,false,false,true,https://www.rh.com,,USD,6510,Corte Madera,CA,415 924 1005,15 Koch Road,,2026-06-19T21:41:19+00:00,2026-06-19T14:30:18+00:00,Equity,,0.04408,0.43541,0.00322,0.03008,-0.017,,3425912064,490476000,285438016,103051000,43882000,45.99068,13.746,1.968,4019091968,60600000,4835710000,53803000
