ticker,name,price,marketcap,volume,volumeavg,priceopen,low,high,close,change,changepct,closeyest,date,high52,low52,beta,shares,pe,eps,sector,industry,description,exchange,ceo,country,ipodate,isetf,isfund,isactive,web_url,image,currency,employees,city,state,phone,address,dividend_yield,fetched_at,profile_fetched_at,asset_class,returnOnEquity,returnOnAssets,grossMargin,operatingMargin,profitMargin,revenueGrowth,earningsGrowth,revenue,ebitda,freeCashFlow,netIncome,stockBasedComp,priceToBook,evToEbitda,evToRevenue,totalDebt,totalEquity,totalAssets,cash
AGO,Assured Guaranty Ltd.,nan,3388494080,338646,410222,77.010002,76.129997,77.309998,nan,nan,nan,77.25,2026-06-19,,,0.758,44282464,8.765178,8.73,Financial Services,Insurance - Specialty,"Assured Guaranty Ltd., together with its subsidiaries, provides credit protection products to public finance and structured finance markets in the United States and internationally. It operates through Insurance and Asset Management segments. The company offers financial guaranty insurance that protects holders of debt instruments and other monetary obligations from defaults in scheduled payments. It also provides specialty insurance and reinsurance on transactions with risk profiles similar to those of its structured finance exposures written in financial guaranty form, as well as offers credit protection through reinsurance. In addition, the company insures and reinsures various the U.S. public finance obligations, such as general obligation, tax-backed bonds, municipal utility, transportation, healthcare, higher education, infrastructure, housing revenue, investor-owned utility, renewable energy, and other public finance bonds. Further, it involved in insuring and reinsuring of non-U.S. public finance obligations comprising regulated utilities, infrastructure finance, sovereign and sub-sovereign, renewable energy bonds, and pooled infrastructure obligations; and the U.S. and non-U.S. structured finance obligations, including residential mortgage-backed securities, life insurance transactions, pooled corporate obligations, and financial products. Additionally, the company offers specialty business, such as diversified real estate, insurance reserve financing and securitizations, pooled corporate obligations, and aircraft residual value insurance (RVI) transactions; and asset management services comprising investment advisory services. It markets its financial guaranty insurance directly to issuers and underwriters of public finance and structured finance securities, as well as to investors. Assured Guaranty Ltd. was incorporated in 2003 and is headquartered in Hamilton, Bermuda.",NYQ,Mr. Dominic John Frederico CPA,Bermuda,,false,false,true,https://assuredguaranty.com,,USD,367,Hamilton,,441 279 5700,30 Woodbourne Avenue,1.96,2026-06-19T21:39:11+00:00,2026-06-19T14:28:12+00:00,Equity,0.07896,0.01501,0.93243,0.24354,0.50983,-0.062,-0.445,814000000,,184750000,411000000,,0.61538,,4.841,1704999936,5663000000,12176000000,1211000064
ALLY,Ally Financial Inc.,nan,13943735296,2349857,3395039,46.009998,45.43,46.459999,nan,nan,nan,45.5,2026-06-19,,,1.094,306523062,11.041263,4.12,Financial Services,Credit Services,"Ally Financial Inc., a digital financial-services company, provides various digital financial products and services in the United States and Canada. The company operates through Automotive Finance operations, Insurance operations, and Corporate Finance operations. It offers automotive financing services, including providing retail installment sales contracts, loans and operating leases, term loans to dealers, financing dealer floorplans and other lines of credit to dealers, warehouse lines to automotive retailers, and fleet financing; and financing services to companies and municipalities for the purchase or lease of vehicles, and vehicle-remarketing services. The company also provides consumer finance protection and insurance products through the automotive dealer channel, and commercial insurance products directly to dealers; VSCs, VMCs, and GAP products; and underwrite select commercial insurance coverages, which primarily insure dealers' vehicle inventory. In addition, it provides senior secured asset-based and leveraged cash flow loans to middle-market companies; leveraged loans; commercial real estate product to serve companies in the nursing facilities, senior housing, and medical office buildings; and treasury activities, such as management of the cash and corporate investment securities and loan portfolios, short- and long-term debt, retail and brokered deposit liabilities, derivative instruments, original issue discount, and equity investments. Further, the company offers deposits and securities brokerage and investment advisory services. The company was formerly known as GMAC Inc. and changed its name to Ally Financial Inc. in May 2010. Ally Financial Inc. was founded in 1919 and is based in Detroit, Michigan.",NYQ,Mr. Michael G. Rhodes,United States,,false,false,true,https://www.ally.com,,USD,10300,Detroit,MI,866 710 4623,Ally Detroit Center,,2026-06-19T21:39:12+00:00,2026-06-19T14:28:13+00:00,Equity,0.09356,0.00715,0,0.21019,0.18161,0.197,,7687000064,,,1286000000,,1.05262,,3.694,21596000256,15498000000,196002000000,9518000128
ALT,"Altimmune, Inc.",2.7,525080256,11688200,3953426,2.68,2.68,2.77,2.7,0.06,2.272725,2.64,2026-06-19,,,0.234,194474154,,-0.92,Healthcare,Biotechnology,"Altimmune, Inc., a late clinical stage biopharmaceutical company, focuses on developing novel therapies for serious liver diseases. Its lead product candidate is pemvidutide, a GLP-1/glucagon dual receptor agonist, which is in Phase 3 clinical trial for the treatment of metabolic dysfunction-associated steatohepatitis, alcohol use disorder, and alcohol-associated liver disease. The company was founded in 1997 and is headquartered in Gaithersburg, Maryland.",NGM,Mr. Jerome Benedict Durso,United States,,false,false,true,https://altimmune.com,,USD,57,Gaithersburg,MD,240 654 1450,910 Clopper Road,,2026-06-19T21:39:13+00:00,2026-06-19T14:28:14+00:00,Equity,-0.42746,-0.24399,0,-2672.4722,0,,,36000,-96103000,-42502000,-91081000,16076000,1.237964,-2.225,5939.702,35847000,224892000,279929000,331540000
ALXO,ALX Oncology Holdings Inc.,nan,205881248,3681927,1139504,1.43,1.405,1.54,nan,nan,nan,1.45,2026-06-19,,,0.451,134562917,,-1.49,Healthcare,Biotechnology,"ALX Oncology Holdings Inc., a clinical-stage immuno-oncology company, focuses on developing therapies for cancer patients in the United States. The company's lead product candidate is Evorpacept, a CD47 blocking therapeutic biologic development as a combination therapy with other anti-cancer agents, including ASPEN-06, under phase 2 clinical study for treating Gastric/GEJ cancer. It has collaboration agreement for Evorpacept combination programs comprising Jazz Pharmaceuticals plc for zanidatamab, under phase 1b/2 trial for the treatment of breast cancer and other solid tumors; HER2 with an ADC, fam-trastuzumab deruxtecan-nxki, under phase 1 trial for the treatment of patients with breast cancer; ALX2004, under phase 1 clinical trial for treating solid tumors; MD Anderson Cancer Center with rituximab and lenalidomide for the treatment of patients with indolent and aggressive NHL; and Sanofi with isatuximab and dexamethasone, under phase 1/2 trial for the treatment of patients with relapsed or refractory multiple myeloma. It has license agreements with Board of Trustees of Leland Stanford Junior University. The company was incorporated in 2015 and is headquartered in South San Francisco, California.",NMS,Mr. Jason W. Lettmann,United States,,false,false,true,https://www.alxoncology.com,,USD,43,South San Francisco,CA,650 466 7125,323 Allerton Avenue,,2026-06-19T21:39:14+00:00,2026-06-19T14:28:15+00:00,Equity,-0.74167,-0.36758,0,0,0,,,,-87347000,-47769376,-88868000,12579000,1.36,-0.669,,13048000,25981000,59046000,140324000
ANF,Abercrombie & Fitch Co.,87.239998,3876222464,1574700,1337030,85.599998,85.599998,89.389999,87.239998,2.529999,2.986659,84.709999,2026-06-19,,,0.912,44431710,8.437137,10.34,Consumer Cyclical,Apparel Retail,"Abercrombie & Fitch Co., through its subsidiaries, operates as an omnichannel retailer in the Americas, Europe, the Middle East, Africa, and the Asia-Pacific. It offers an assortment of apparel, personal care products, and accessories for men, women, and kids under the Abercrombie & Fitch, abercrombie kids, Your Personal Best, Hollister, and Gilly Hicks brands. The company sells products through its stores, various wholesale, franchise, and licensing arrangements, as well as e-commerce platforms. Abercrombie & Fitch Co. was founded in 1892 and is headquartered in New Albany, Ohio.",NYQ,Ms. Fran  Horowitz,United States,,false,false,true,https://corporate.abercrombie.com,,USD,6600,New Albany,OH,614 283 6500,6301 Fitch Path,,2026-06-19T21:39:15+00:00,2026-06-19T14:28:15+00:00,Equity,0.39224,0.12733,0.61657,0.07982,0.09344,0.015,-0.075,5282802176,825868032,283367872,493641984,39048000,2.892477,5.623,0.879,1292477056,1403895000,3541874000,619224000
AON,Aon plc,nan,67861934080,1168302,1450880,327.859985,317.480011,327.859985,nan,nan,nan,326.690002,2026-06-19,,,0.714,213576949,17.429512,18.23,Financial Services,Insurance Brokers,"Aon plc operates as a professional services firm in the United States, rest of the Americas, the United Kingdom, Ireland, rest of Europe, the Middle East, Africa, and the Asia Pacific. It operates through Risk Capital and Human Capital segments. The company offers commercial risk solutions comprising retail and insurance brokerage, specialty solutions, global risk consulting, captives management, and affinity programs; health solutions, such as consulting and brokerage, consumer benefits, and talent advisory services; and wealth solutions, including retirement consulting and investments. It also provides treaty and facultative reinsurance; strategy and technology group solutions; insurance-linked securities, capital raising, strategic advice, restructuring, and merger and acquisition services; and risk management products and solutions, capital market solutions, and corporate finance advisory services. In addition, the company offers strategic design advice and actuarial services; pension risk transfer and integrated pension administration; and investment advisory services on developing and maintaining investment programs across various plan types, including defined benefit plans, defined contribution plans, master trusts, and pooled employer plans for corporations, public pensions, endowments, and foundations. Aon plc was incorporated in 1979 and is headquartered in Dublin, Ireland.",NYQ,Mr. Gregory Clarence Case,Ireland,,false,false,true,https://www.aon.com,,USD,60000,Dublin,,353 1 266 6000,15 George's Quay,0.99,2026-06-19T21:39:16+00:00,2026-06-19T14:28:17+00:00,Equity,0.46447,0.06051,0.47341,0.35836,0.22544,0.065,0.271,17486000128,5843999744,3341625088,3942000128,432000000,6.90154,14.573,4.871,15473999872,9352000000,50784000000,1243000064
ASTS,"AST SpaceMobile, Inc.",80.660004,31306129408,31679200,21358206,85.300003,77.120003,85.699997,80.660004,-4.769997,-5.583515,85.43,2026-06-19,,,2.634,298746383,,-1.8,Technology,Communication Equipment,"AST SpaceMobile, Inc., together with its subsidiaries, designs and develops the constellation of BlueBird satellites in the United States. The company provides a cellular broadband network in space to be accessible directly by smartphones for commercial use and other applications, as well as for government use. Its SpaceMobile service provides cellular broadband services to end-users who are out of terrestrial cellular coverage. The company was founded in 2017 and is headquartered in Midland, Texas.",NMS,Mr. Abel  Avellan,United States,,false,false,true,https://ast-science.com,,USD,1126,Midland,TX,432 276 3966,Midland International Air & Space Port,,2026-06-19T21:39:17+00:00,2026-06-19T14:28:18+00:00,Equity,-0.37751,-0.06303,0.44823,-10.13994,0,19.522,,84935000,-316393984,-1412748416,-487246016,47490000,11.577437,-79.379,295.699,2991408128,1841475000,5014387000,3029591040
B,Barrick Mining Corporation,40.34,67752579072,16397500,13181714,41.34,39.720001,42.220001,40.34,-0.950001,-2.300801,41.290001,2026-06-19,,,1.065,1675508360,11.143647,3.62,Basic Materials,Gold,"Barrick Mining Corporation engages in the exploration, development, production, and sale of mineral properties. It explores for gold, copper, silver, and energy materials. The company was formerly known as Barrick Gold Corporation and changed its name to Barrick Mining Corporation in May 2025. Barrick Mining Corporation was founded in 1983 and is based in Toronto, Canada.",NYQ,Mr. Mark F. Hill B.Eng,Canada,,false,false,true,https://www.barrick.com,,USD,,Toronto,ON,416 861 9911,"Brookfield Place, TD Canada Trust Tower",1.64,2026-06-19T21:39:18+00:00,2026-06-19T14:28:19+00:00,Equity,0.25176,0.11991,0.55109,0.56248,0.32141,0.667,2.542,19043999744,11736000512,5272124928,6120999936,270000000,2.472268,6.705,4.132,4726000128,26557000000,51577000000,7130999808
BABO,YieldMax BABA Option Income Strategy ETF,nan,,29006,42969,8.15,8.0499,8.14,nan,nan,nan,8.26,2026-06-19,,,,,,,,,"The fund is an actively managed ETF that seeks current income while maintaining the opportunity for exposure to the share price of the common stock of Alibaba Group Holding Limited (“BABA”), subject to a limit on potential investment gains. The fund is non-diversified.",PCX,,,,true,false,true,,,USD,,,,,,79.53,2026-06-19T21:39:19+00:00,2026-06-19T14:28:20+00:00,Equity,,,,,,,,,,,,,,,,,,16930962,
BATRK,"Atlanta Braves Holdings, Inc.",nan,3231565824,1492859,398336,51.369999,49.990002,51.369999,nan,nan,nan,51.099998,2026-06-19,,,0.812,52847883,,-0.34,Communication Services,Entertainment,"Atlanta Braves Holdings, Inc., through its subsidiary, Braves Holdings, LLC, owns and operates the Atlanta Braves Major League Baseball Club in the United States. It operates through Baseball and Mixed-Use Development segments. The company also operates the Braves' ballpark located in Cobb County, a suburb of Atlanta. In addition, it is involved in the mixed-use development business, such as retail, office, hotel, and entertainment operations primarily within The Battery Atlanta. The company was incorporated in 2022 and is headquartered in Atlanta, Georgia.",NMS,Mr. Terence Foster McGuirk,United States,2023-07-19,false,false,true,https://www.bravesholdings.com,,USD,1610,Atlanta,GA,404 614 2300,Truist Park,,2026-06-19T21:39:20+00:00,2026-06-19T14:28:21+00:00,Equity,-0.04336,0.00803,0.31195,-0.57287,-0.02966,0.525,,757288000,97855000,-6108750,-22459000,15575000,6.226672,40.877,5.282,817054976,526050000,1614957000,135196992
BB,BlackBerry Limited,8.38,4911194624,32461100,27815276,9,8.21,9.05,8.38,-0.45,-5.096261,8.83,2026-06-19,,,1.551,586061407,93.11111,0.09,Technology,Software - Infrastructure,"BlackBerry Limited provides intelligent software and services to enterprises and governments worldwide. The company operates through three segments: Secure Communications, QNX, and Licensing. The company offers BlackBerry Dynamics, a development platform and secure container for mobile applications; BlackBerry Workspaces a secure Enterprise File Sync and Share (EFSS) solution; BlackBerry Messenger (BBM) Enterprise, an enterprise-grade secure instant messaging solution for messaging, voice, and video; BlackBerry SecuSUITE, a multi-OS voice and text messaging solution; BlackBerry AtHoc, a secure networked critical event management solution; and BlackBerry unified endpoint management (UEM) solutions. It also provides BlackBerry Certicom, a patented elliptic curve cryptography, which provides device security, anti-counterfeiting, and product authentication solutions; BlackBerry Radar offers asset monitoring and telematics solutions for transportation and logistics; and BlackBerry Development Platform, an enterprise-grade toolset. In addition, the company offers enterprise consulting and engineering consulting services. Further, it is involved in patent licensing. The company was formerly known as Research In Motion Limited and changed its name to BlackBerry Limited in July 2013. BlackBerry Limited was incorporated in 1984 and is headquartered in Waterloo, Canada.",NYQ,Mr. John Joseph Giamatteo,Canada,,false,false,true,https://www.blackberry.com,,USD,1749,Waterloo,ON,519-888-7465,2200 University Avenue East,,2026-06-19T21:39:21+00:00,2026-06-19T14:28:22+00:00,Equity,0.07258,0.03252,0.76161,0.17372,0.09689,0.101,,549100032,83900000,43762500,53200000,23200000,6.598425,62.643,9.572,224800000,746000000,1245200000,359900000
BCAB,"BioAtla, Inc.",nan,6065670,26163,46491,3.49,3.46,3.7,nan,nan,nan,3.55,2026-06-19,,,,1659554,,-41.56,Healthcare,Biotechnology,"BioAtla, Inc., a clinical-stage biopharmaceutical company, develops specific and selective antibody-based therapeutics for the treatment of solid tumor cancer. Its lead clinical stage product candidates include mecbotamab vedotin (BA3011), a conditionally active biologic (CAB) antibody-drug conjugate (ADC) for treating undifferentiated pleomorphic sarcoma and non-small cell lung cancer (NSCLC); and ozuriftabmab vedotin (BA3021), a CAB ADC to treat melanoma and oropharyngeal squamous cell carcinoma. The company is also developing Evalstotug (BA3071), a CAB anti-cytotoxic T-lymphocyte-associated antigen 4 antibody for treating melanoma, renal cell carcinoma, colorectal cancer, and NSCLC; BA3182, a bispecific candidate to treat adenocarcinomas; BA3361, a CAB-Nectin-4-ADC for treating tumors; BA3142, a dual-CAB T-cell engager targeting B7-H3, a protein expressed on various solid tumors; and preclinical candidate for CAB-Nectin 4 x CAB-CD3. The company was founded in 2007 and is headquartered in San Diego, California.",NCM,Dr. Jay M. Short Ph.D.,United States,2020-12-16,false,false,true,https://www.bioatla.com,,USD,41,San Diego,CA,858 558 0708,11085 Torreyana Road,,2026-06-19T21:39:22+00:00,2026-06-19T14:28:23+00:00,Equity,,-1.34452,0,-25.1995,0,,,2000000,-50089000,-18032376,-50617000,5434000,-0.162582,-0.197,4.925,6094000,-36189000,13828000,1961000
BIDU,"Baidu, Inc.",111.760002,38026637312,2135200,2330622,112.650002,110.93,113.610001,111.760002,0.150002,0.134398,111.610001,2026-06-19,,,0.534,274750119,,-0.16,Communication Services,Internet Content & Information,"Baidu, Inc. provides internet content, value-added telecommunication-based, internet map, and online audio and video services in the People's Republic of China. It operates in two segments, Baidu General Business and iQIYI. The Baidu General Business segment offers products and services for mobile ecosystem, AI cloud, and intelligent driving. This segment operates Baidu App that enables users to access search, feed, content, and other services through mobile devices; and Haokan, which offers a range of various user generated and professionally produced short videos. It also provides a portfolio of knowledge and information products, including Baidu Wiki, which features columns and videos, such as encyclopedia of intangible cultural heritage, digital museum and recorder of history; Baidu Knows, an online community where users can pose questions to other users, such as individuals, professionals, and enterprises; Baidu Experience, an online platform where users share daily knowledge and experience; ERNIE Bot, new AI-native product that serves as a multi-round conversational AI assistant on both PC and mobile; and Baidu Post, a social media that allows users to post text, image, audio and video content, and reply to original curation forming valuable discussion groups, as well as livestreaming services, including live streaming and AI-powered digital human livestreaming. In addition, the company offers DuerOS smart assistant for the Chinese language; Apollo Go autonomous ride-hailing service; online marketing services; Baidu Maps, a voice-enabled mobile app providing users with travel-related services; and AI chips. The iQIYI segment produces and distributes professionally produced content. This segment offers online entertainment video services, including online videos, experience services, online games, comics, and others. The company was incorporated in 2000 and is headquartered in Beijing, the People's Republic of China.",NMS,Mr. Yanhong  Li,China,,false,false,true,https://ir.baidu.com,,USD,33500,Beijing,,86 10 5992 8888,Baidu Campus,,2026-06-19T21:39:23+00:00,2026-06-19T14:28:24+00:00,Equity,0.00319,0.01252,0.42085,0.09955,0.01023,-0.012,-0.593,128701997056,23586000896,7958624768,391000000,3605000000,0.956241,1.656,0.303,94136000512,266330000000,449157000000,116890001408
BIRK,Birkenstock Holding plc,nan,8479907840,3067794,2556695,46.75,46.110001,48.84,nan,nan,nan,46.950001,2026-06-19,,,1.246,183906056,20.67713,2.23,Consumer Cyclical,Footwear & Accessories,"Birkenstock Holding plc engages in the manufacture and sale of footwear products in the Americas, Europe, the Middle East, Africa, and the Asia Pacific. It offers footbed-based products, including sandals and closed-toe shoes; and skincare products and accessories. The company sells its products through e-commerce sites and a network of owned retail stores, as well as business-to-business channels. The company was formerly known as Birkenstock Group Limited. Birkenstock Holding plc was founded in 1774 and is based in London, the United Kingdom. Birkenstock Holding plc operates as a subsidiary of BK LC Lux MidCo S.à r.l.",NYQ,Mr. Oliver Christian Joachim Reichert,United Kingdom,,false,false,true,https://www.birkenstock-holding.com,,USD,6800,London,,44 1534 835 600,1-2 Berkeley Square,,2026-06-19T21:39:24+00:00,2026-06-19T14:28:25+00:00,Equity,0.12504,0.06714,0.57755,0.26931,0.16296,0.077,-0.204,2181614080,621820032,190117376,355508992,,2.540913,16.379,4.668,1380283008,2722726000,4942120000,201467008
BMEA,"Biomea Fusion, Inc.",nan,85313336,743296,1502620,1.23,1.16,1.26,nan,nan,nan,1.2,2026-06-19,,,,72299440,,-0.55,Healthcare,Biotechnology,"Biomea Fusion, Inc., a clinical-stage diabetes and obesity medicines company, focuses on the discovery and development of oral drugs to treat patients with diabetes and obesity. It's lead clinical program's drug candidates are COVALENT-111 and COVALENT-112, which has completed Phase II clinical trials of icovamenib for the treatment of Type 1 and Type 2 diabetes; COVALENT-211, which is in Phase II clinical trial of icovamenib for treating insulin-deficient type 2 diabetes; and COVALENT-212, which is in Phase II clinical trial of icovamenib for the treatment of type 2 diabetes. The company is also developing BMF-650, which is in Phase I glucagon-like peptide-131 clinical trial for the treatment of obesity. The company was incorporated in 2017 and is headquartered in San Carlos, California.",NMS,Dr. Michael J. M. Hitchcock Ph.D.,United States,2021-04-16,false,false,true,https://biomeafusion.com,,USD,41,San Carlos,CA,650 980 9099,1599 Industrial Road,,2026-06-19T21:39:25+00:00,2026-06-19T14:28:26+00:00,Equity,-1.89439,-0.79319,0,0,0,,,,-63382000,-32863624,-44950000,9520000,4.555985,-0.638,,1239000,29552000,58572000,44693000
BOOM,DMC Global Inc.,nan,143895728,186841,290060,7.21,6.7874,7.22,nan,nan,nan,7.13,2026-06-19,,,1.724,20468807,,-1.28,Industrials,Conglomerates,"DMC Global Inc. provides various products and engineered solutions for the construction, energy, and industrial processing markets worldwide. It operates through three segments: Arcadia Products, DynaEnergetics, and NobelClad. The Arcadia Products segment offers designed, engineered, fabricated, and finished aluminum framing systems, windows, curtain walls, storefronts, entrance systems, and other architectural components for use in commercial exteriors; and interior framing and partitions comprising framing systems, aluminum doors, sliding systems, and glazing systems. This segment also provides custom, fully fabricated aluminum, steel, and wood windows and doors for the home market. This segment sells its products through a national in-house sales force for buildings, such as office towers, airports, hotels, education and athletic facilities, health care facilities, government buildings, retail centers, mixed use and multi-family residential buildings, and industrial and manufacturing centers. The DynaEnergetics segment designs, manufactures, and sells perforating systems, such as initiation systems, shaped charges, detonating cords, gun hardware, and a control panel; and perforating systems and associated hardware for the oil and gas industry. This segment sells its products through direct selling, distributors, and independent sales representatives. The NobelClad segment produces and sells explosion-welded clad metal plates for use in the construction of heavy, corrosion resistant pressure vessels, and heat exchangers for oil and gas, chemical and petrochemical, petroleum refining, alternative energy, hydrometallurgy, aluminum production, shipbuilding, power generation, and industrial refrigeration industries. The company was formerly known as Dynamic Materials Corporation and changed its name to DMC Global Inc. in November 2016. DMC Global Inc. was founded in 1965 and is headquartered in Broomfield, Colorado.",NMS,Mr. James  O'Leary,United States,,false,false,true,https://www.dmcglobal.com,,USD,1500,Broomfield,CO,303 665 5700,11800 Ridge Parkway,,2026-06-19T21:39:26+00:00,2026-06-19T14:28:27+00:00,Equity,-0.0473,-0.00521,0.20387,-0.02594,-0.03445,-0.149,,586145024,28110000,42188248,-25425000,5542000,0.611996,14.16,0.679,101240000,242050000,635831000,31511000
