ticker,name,price,marketcap,volume,volumeavg,priceopen,low,high,close,change,changepct,closeyest,date,high52,low52,beta,shares,pe,eps,sector,industry,description,exchange,ceo,country,ipodate,isetf,isfund,isactive,web_url,image,currency,employees,city,state,phone,address,dividend_yield,fetched_at,profile_fetched_at,asset_class,returnOnEquity,returnOnAssets,grossMargin,operatingMargin,profitMargin,revenueGrowth,earningsGrowth,revenue,ebitda,freeCashFlow,netIncome,stockBasedComp,priceToBook,evToEbitda,evToRevenue,totalDebt,totalEquity,totalAssets,cash,expenseRatio,currentRatio,quickRatio,debtToEquity,payoutRatio,pegRatio,heldPctInsiders,heldPctInstitutions,shortPctFloat
FNMA,Federal National Mortgage Association,6.43,7446502912,2126700,4314542,6.29,6.03,6.43,6.43,0.2,3.21027,6.23,2026-07-23,,,1.621,1158087567,643,0.01,Financial Services,Mortgage Finance,"Federal National Mortgage Association provides financing solutions for residential mortgages in the United States. The company operates in two segments, Single-Family and Multifamily. It offers mortgage acquisitions and securitizations; and credit risk and loss management services. The company also engages in mortgage securitization transactions, including lender swap, portfolio securitization, and structured securitization transactions; and credit risk and loss management services. Federal National Mortgage Association was incorporated in 1938 and is based in Washington, District Of Columbia.",OQB,Mr. Peter Andrew Akwaboah,United States,,false,false,true,https://www.fanniemae.com,,USD,7000,Washington,DC,800 232 6643,Midtown Center,,2026-07-23T13:12:51+00:00,2026-07-23T13:12:51+00:00,Equity,0.13672,0.00333,1,0.73385,0.53004,-0.044,9.835,27210999808,,,68000000,,-0.272781,,154.957,4172801900544,109012000000,4317538000000,103680000000,,130.345,129.033,3703.659,0,,0,0.21029,
FNV,Franco-Nevada Corporation,214.110001,,1076400,840729,212,211.740005,216.619995,214.110001,6.710007,3.235297,207.399994,2026-07-23,,,0.897,,30.113924,7.11,Basic Materials,Gold,"Franco-Nevada Corporation operates as a royalty and stream company focused on precious metals in South America, Central America, Mexico, the United States, Canada, Australia, Europe, and Africa. The company operates through Precious Metals, Other Mining and Energy segments. It also manages its portfolio with a focus on precious metals, such as gold, silver, and platinum group metals; and engages in the sale of crude oil, natural gas, and natural gas liquids through a third-party marketing agent. Franco-Nevada Corporation was founded in 1986 and is headquartered in Toronto, Canada.",NYQ,Mr. Paul  Brink,Canada,,false,false,true,https://www.franco-nevada.com,,USD,,Toronto,ON,416 306 6300,199 Bay Street,0.82,2026-07-23T13:12:52+00:00,2026-07-23T13:12:52+00:00,Equity,0.19041,0.13019,0.91824,0.7926,0.65666,0.777,1.231,2087699968,1920600064,-827950016,1370899968,6300000,5.093613,21.198,19.501,0,7635300000,8241400000,714700032,,6.155,5.431,,0.2225,,0.00618,0.85399,
FOSL,"Fossil Group, Inc.",4.16,245862640,435900,855275,4.15,4.1,4.21,4.16,0.01,0.240958,4.15,2026-07-23,,,1.634,59101598,,-1.13,Consumer Cyclical,Footwear & Accessories,"Fossil Group, Inc., together with its subsidiaries, designs, develops, markets, and distributes consumer fashion accessories in the United States, Europe, Asia, and internationally. The company's products include traditional watches, smartwatches, jewelry, handbags, small leather goods, belts, and sunglasses. It also manufactures and distributes private label brands. The company offers its products under its proprietary brands, such as FOSSIL, SKAGEN, MICHELE, RELIC, and ZODIAC; and under the licensed brands, including ARMANI EXCHANGE, DIESEL, EMPORIO ARMANI, KATE SPADE NEW YORK, MICHAEL KORS, SKECHERS, and TORY BURCH. It sells its products through company-owned retail and outlet stores, department and specialty retail stores, mass market stores, e-commerce sites, licensed and franchised FOSSIL retail stores, retail concessions, and airlines, as well as operate stores under the WATCH STATION and WSI brands. The company was formerly known as Fossil, Inc. and changed its name to Fossil Group, Inc. in May 2013. Fossil Group, Inc. was founded in 1984 and is headquartered in Richardson, Texas.",NMS,Mr. Franco  Fogliato,United States,,false,false,true,https://www.fossilgroup.com,,USD,4500,Richardson,TX,972 234 2525,901 South Central Expressway,,2026-07-23T13:12:53+00:00,2026-07-23T13:12:53+00:00,Equity,-0.5845,0.02615,0.55716,0.06293,-0.06179,-0.037,,995873984,39450000,61014624,-61533000,2317000,2.346306,12.236,0.485,334147008,102835000,689254000,81384000,,1.72,0.782,401.778,0,1.23,0.04249,0.6285,0.0756
FOUR,"Shift4 Payments, Inc.",48.220001,4780046336,718300,1615700,49.689999,48.049999,49.689999,48.220001,-0.889999,-1.812257,49.110001,2026-07-23,,,1.4,79328924,55.42529,0.87,Technology,Software - Infrastructure,"Shift4 Payments, Inc. engages in the provision of software and payment processing solutions in the United States and internationally. The company offers a payments platform, which provides omnichannel card acceptance; and processing solutions across multiple payment types, including credit, debit, contactless card, Europay, MasterCard and Visa, QR Pay, and mobile wallets, as well as alternative payment methods, such as Apple Pay, Google Pay, Alipay, and WeChat Pay. It also provides technology solutions, such as SkyTab POS, which provides purpose-built POS workstations; SkyTab Mobile, which provides pay-at-the-table, order-at-the-table, delivery, customer feedback, and email marketing solutions; SkyTab Venue, which provides mobile ordering, countertop POS, self-service kiosk, and digital wallet solutions; Lighthouse, a cloud-based suite of business intelligence tools that includes customer engagement, social media management, online reputation management, scheduling and product pricing, extensive reporting, and analytics; The Giving Block, a cryptocurrency donation marketplace; Shift4Shop, an e-commerce platform that creates a web store and tools to manage product catalog, order fulfillment and inventory management, search engine optimization, and secure hosting; and Marketplace, which enables integrations into third-party applications, as well as loyalty and inventory management. In addition, the company offers merchant operations and support services, including underwriting, onboarding, and activation; training; risk management; and support services. Further, it provides software partner operations and support services, including software integrations and compliance management; partner support; and partner services. The company distributes its products through independent software vendors, internal sales and support networks, enterprises, and value-added resellers. Shift4 Payments, Inc. was founded in 1999 and is headquartered in Center Valley, Pennsylvania.",NYQ,Mr. David Taylor Lauber,United States,2020-06-05,false,false,true,https://www.shift4.com,,USD,6300,Center Valley,PA,888 276 2108,3501 Corporate Parkway,,2026-07-23T13:12:54+00:00,2026-07-23T13:12:54+00:00,Equity,0.09943,0.0367,0.351,0.04996,0.02627,0.322,,4453000192,851000000,488449984,62000000,82000000,5.902804,10.654,2.036,4582000128,1442000000,8713000000,473000000,,1.222,0.692,257.416,0,0.352,0.30355,0.92677,0.2016
FRO,Frontline plc,37.959999,8450764800,1483200,2866126,38.889999,37.91,38.939999,37.959999,-0.490002,-1.274387,38.450001,2026-07-23,,,0.027,222622889,9.466333,4.01,Energy,Oil & Gas Midstream,"Frontline plc, a shipping company, engages in the ownership and operation of oil and product tankers worldwide. The company owns and operates oil and product tankers, such as very large crude carriers (VLCCs), Suezmax tankers, and LR2/Aframax tankers. As of December 31, 2025, it operated a fleet of 80 vessels, including 41 VLCCs, 21 Suezmax tankers, and 18 LR2/Aframax tankers. The company is also involved in the charter, purchase, and sale of vessels. Frontline plc was founded in 1985 and is based in Limassol, Cyprus.",NYQ,Mr. Lars H. Barstad,Cyprus,,false,false,true,https://www.frontlineplc.cy,,USD,85,Limassol,,357 2 5588767,Iris House,8.25,2026-07-23T13:12:55+00:00,2026-07-23T13:12:55+00:00,Equity,0.35009,0.09212,0.55826,0.51809,0.40192,0.669,15.797,2251480064,1169954048,373963616,904913984,5560000,2.974222,9.068,4.712,2631087104,2511350000,5753627000,471672000,,2.034,1,92.619,0.4335,5.58,0.35787,0.35678,0.0385
FTDR,"Frontdoor, Inc.",72.040001,5059723776,428000,614888,73.220001,71.239998,73.220001,72.040001,-1.18,-1.611582,73.220001,2026-07-23,,,1.462,70234922,20.582857,3.5,Consumer Cyclical,Personal Services,"Frontdoor, Inc. provides home warranties and new home builder warranties in the United States. The company offers customizable home warranties that help customers to protect and maintain their homes from costly and unplanned breakdowns of essential home systems and appliances. Its home warranty customers subscribe to an annual service plan agreement that covers the repair or replacement of principal components of home systems and appliances, including electrical, plumbing, water heaters, refrigerators, dishwashers, and ranges/ovens/cooktops, as well as pools, spas, and pumps; and heating, ventilation, and air conditioning systems. It also offers non-warranty home services through website and application; a one-stop app experience for home repair and maintenance using video chat, augmented reality, and computer vision and machining learning. The company operates under the American Home Shield, HSA, OneGuard, Landmark, and 2-10 HBW brand names. Frontdoor, Inc. was founded in 1971 and is headquartered in Memphis, Tennessee.",NMS,Mr. William C. Cobb,United States,,false,false,true,https://www.frontdoorhome.com,,USD,2034,Memphis,TN,901 701 5000,3400 Players Club Parkway,,2026-07-23T13:12:56+00:00,2026-07-23T13:12:56+00:00,Equity,1.21028,0.12019,0.55241,0.14634,0.12229,0.059,0.163,2118000000,498000000,328124992,259000000,34000000,22.091383,11.357,2.67,1199000064,242000000,2142000000,603000000,,1.466,1.359,521.304,0,2.38,0.00755,1.07248,0.0563
FXI,iShares China Large-Cap ETF,34.43,,15704200,28087332,34.549999,34.389999,34.57,34.43,-0.200001,-0.577536,34.630001,2026-07-23,,,,129450000,9.497125,,,,The fund generally will invest at least 80% of its assets in the component securities of its underlying index and in investments that have economic characteristics that are substantially identical to the component securities of its underlying index. The index designed to measure the performance of the largest companies in the Chinese equity market that trade on the Stock Exchange of Hong Kong and are available to international investors. The fund is non-diversified.,PCX,,,,true,false,true,,,USD,,,,415-670-2000,,2.14,2026-07-23T13:12:57+00:00,2026-07-23T13:12:57+00:00,Equity,,,,,,,,,,,,,0.853157,,,,,4523697152,,0.73,,,,,,,,
GNK,Genco Shipping & Trading Limited,25.43,1108164480,187400,332037,25.469999,25.120001,25.469999,25.43,0.07,0.276024,25.360001,2026-07-23,,,0.901,43577051,65.20513,0.39,Industrials,Marine Shipping,"Genco Shipping & Trading Limited, together with its subsidiaries, engages in the ocean transportation of drybulk cargoes worldwide. It operates through two segments: major bulk and minor bulk fleet. The company owns and operates dry bulk vessels to transports iron ore, grains, coal, steel products, and other drybulk cargoes. It charters its vessels primarily to trading houses, including commodities traders; producers; and government-owned entities. Genco Shipping & Trading Limited was incorporated in 2004 and is headquartered in New York, New York.",NYQ,Mr. John C. Wobensmith C.F.A.,United States,,false,false,true,https://www.gencoshipping.com,,USD,1056,New York,NY,646 443 8550,299 Park Avenue,4.52,2026-07-23T13:12:58+00:00,2026-07-23T13:12:58+00:00,Equity,0.019,0.01827,0.39203,0.13624,0.04378,0.606,,385214016,89625000,-139764992,16866000,7046000,1.251661,15.392,3.581,324495008,896484000,1138108000,54770000,,2.979,1.852,36.584,2.4359,,0.25917,0.54541,0.0328
GOGO,Gogo Inc.,3.71,501734944,1228000,1873690,3.6,3.575,3.77,3.71,0.11,3.055559,3.6,2026-07-23,,,1.156,135238523,37.1,0.1,Communication Services,Telecom Services,"Gogo Inc., together with its subsidiaries, provides broadband connectivity services to the aviation industry in the United States and internationally. The company's product platform includes networks, antennas, and airborne equipment and software. The company offers in-flight systems; in-flight services; aviation partner support; and engineering, design, and development services, as well as production operations functions. It offers voice and data, in-flight entertainment, and other services. In addition, the company's infrastructure includes networks, towers, cyber security software and data centers to support in-flight connectivity services, as well as in the provision of telecommunications services. The company sells its products primarily to aircraft operators and original equipment manufacturers of business aviation aircraft through a distribution network of independent dealers. Gogo Inc. was founded in 1991 and is headquartered in Broomfield, Colorado.",NMS,Mr. Christopher J. Moore,United States,,false,false,true,https://www.gogoair.com,,USD,680,Broomfield,CO,303 301 3271,105 Edgeview Drive,,2026-07-23T13:13:00+00:00,2026-07-23T13:13:00+00:00,Equity,0.13899,0.05972,0.42931,0.14803,0.01541,-0.017,0.072,906502976,181655008,24533876,13966000,24072000,4.244851,7.147,1.432,903228992,101129000,1303772000,106732000,,1.66,1.056,765.319,0,,0.2492,0.72161,0.1629
GOLD,"Gold.com, Inc.",40.209999,1166265856,525500,487311,40.59,39.470001,41.189999,40.209999,0.27,0.676015,39.939999,2026-07-23,,,0.609,29004374,13.09772,3.07,Financial Services,Capital Markets,"Gold.com, Inc., together with its subsidiaries, operates as a precious metals company. It operates through three segments: Wholesale Sales & Ancillary Services, Direct-to-Consumer, and Secured Lending. The Wholesale Sales & Ancillary Services segment sells gold, silver, platinum, and palladium in the form of bars, plates, powders, wafers, grains, ingots, and coins. This segment also offers complementary services, such as receiving, handling, inventorying, processing, packing, and shipping of precious metals and custom coins on a secure basis; and designs and produces minted silver products. The Direct-to-Consumer segment provides access to gold, silver, copper, platinum, and palladium products primarily through its websites; rarities and numismatic collections; and numismatic and bullion products. It operates various websites targeting specific niches within the precious metals retail market. This segment also operates as a direct retailer of precious metals to the investor community and markets its precious metal products on television, radio, and the internet, as well as through customer service outreach. The Secured Lending segment originates and acquires commercial loans secured by bullion, numismatic coins, and graded sports cards. The company serves customers, including financial institutions, bullion retailers, industrial manufacturers and fabricators, sovereign mints, refiners, coin and metal dealers, investors, collectors, and e-commerce and other retail customers. It operates in the United States, Europe, Canada, Asia Pacific, Africa, Australia, and South America. The company was formerly known as A-Mark Precious Metals, Inc. and changed its name to Gold.com, Inc. in December 2025. The company was founded in 1965 and is headquartered in Costa Mesa, California.",NYQ,Mr. Gregory N. Roberts,United States,,false,false,true,https://www.gold.com,,USD,956,Costa Mesa,CA,844 455-4653,1550 Scenic Ave,1.99,2026-07-23T13:13:01+00:00,2026-07-23T13:13:01+00:00,Equity,0.10819,0.02759,0.01844,0.00865,0.0035,2.44,,23020443648,173514000,-743910528,80508000,1594000,1.351279,15.648,0.118,1654208000,649516000,2215431000,143607008,,1.176,0.126,182.406,0.2606,,0.33103,0.59617,0.1475
GOOS,Canada Goose Holdings Inc.,9.75,952201536,467400,594129,9.81,9.675,9.973,9.75,0.01,0.102672,9.74,2026-07-23,,,1.763,46657624,60.9375,0.16,Consumer Cyclical,Apparel Manufacturing,"Canada Goose Holdings Inc., together with its subsidiaries, designs, manufactures, and sells performance luxury outerwear, apparel, footwear, and accessories for men, women, youth, children, and babies. It operates through three segments: Direct-to-Consumer, Wholesale, and Other. The company offers leisure wear, including knitwear, sweats, and t-shirts; outerwear products, including rain and everyday collections, jackets for everyday occasions, fleece, and vests; footwear and accessories products, such as sneakers, boots, hats, scarves, gloves, hood trims, socks, bags and eyewear; and lightweight and heavyweight down jackets for the fall, winter, and spring seasons. It sells its products through e-commerce channels and directly operated retail stores. The company offers its products under Canada Goose, Snow Goose, and Baffin brands in Canada, the United States, North America, Greater China, rest of the Asia Pacific, Europe, the Middle East, and Africa. Canada Goose Holdings Inc. was founded in 1957 and is headquartered in Toronto, Canada.",NYQ,Mr. Daniel  Reiss C.M.,Canada,,false,false,true,https://www.canadagoose.com,,USD,,Toronto,ON,416 780 9850,100 Queens Quay East,,2026-07-23T13:13:02+00:00,2026-07-23T13:13:02+00:00,Equity,0.04694,0.05495,0.69723,0.27553,0.01472,0.179,0.03,1528199936,191700000,192675008,22500000,23500000,2.203017,7.009,0.879,785200000,608400000,1753200000,408200000,,2.628,1.456,125.072,0,,0.16216,0.63163,0.0867
GRNY,Fundstrat Granny Shots US Large Cap ETF,27.49,,934700,1641740,27.42,27.41,27.6,27.49,-0.030001,-0.109014,27.52,2026-07-23,,,,,29.458172,,,,"The fund, an actively-managed exchange-traded fund (“ETF”), seeks to achieve its investment objective by investing in U.S. large capitalization equity securities. Under normal market circumstances, the fund will invest at least 80% of its net assets (including any borrowings for investment purposes) in large-cap U.S. companies. The fund's managers consider large-cap U.S. companies to be those companies with a market capitalization of greater than $10 billion or more.",PCX,,,,true,false,true,,,USD,,,,(469) 442-8424,,0.07,2026-07-23T13:13:04+00:00,2026-07-23T13:13:04+00:00,Equity,,,,,,,,,,,,,,,,,,4392313856,,0.75,,,,,,,,
GRPN,"Groupon, Inc.",27.92,1060512704,1422600,1848372,25.950001,25.26,28.16,27.92,1.870001,7.178506,26.049999,2026-07-23,,,0.22,37983980,,-2.57,Communication Services,Internet Content & Information,"Groupon, Inc. operates a marketplace that connects consumers to merchants by offering goods and services at a discount in North America and international. It provides deals in various categories, including beauty and wellness, food and drink, home and automotive services, and online services, as well as various types of experiences and services; and discounted and market rates for hotels, airfare, and package deals, as well as deals on various product lines, such as electronics, sporting goods, jewelry, toys, household items, and apparel. The company offers its deal offerings to customers through websites; search engines; applications and mobile websites, which enable consumers to browse, purchase, manage, and redeem deals on their mobile devices; emails and push notifications; affiliate channels; social and display advertising; and offline marketing. Groupon, Inc. was incorporated in 2008 and is headquartered in Chicago, Illinois.",NMS,Mr. Dusan  Senkypl,United States,,false,false,true,https://www.groupon.com,,USD,1734,Chicago,IL,773 945 6801,35 West Wacker Drive,,2026-07-23T13:13:04+00:00,2026-07-23T13:13:04+00:00,Equity,,0.00791,0.90742,-0.02826,-0.20776,0,,498435008,8405000,80421128,-103379000,37774000,-17.33085,136.741,2.306,314188000,-42562000,670406000,225514000,,0.807,0.676,,0,14.66,0.20277,1.47138,0.5356
GSL,Global Ship Lease Inc New,42.060001,,266900,325188,42.299999,41.939999,42.5,42.060001,0.010002,0.023786,42.049999,2026-07-23,,,0.876,,4.021033,10.46,Industrials,Marine Shipping,"Global Ship Lease, Inc., together with its subsidiaries, engages in owning and chartering out containerships under fixed-rate charters to container liner companies worldwide. As of March 12, 2026, it owned 71 mid-sized and smaller containerships, ranging from 2,207 to 11,040 (TEU), with an aggregate capacity of 423,003 TEU. Global Ship Lease, Inc. was founded in 2007 and is based in Athens, Greece.",NYQ,Mr. Georgios Giouroukos Youroukos,Greece,,false,false,true,https://www.globalshiplease.com,,USD,7,Athens,,30 210 62 33 670,9 Irodou Attikou Street,5.94,2026-07-23T13:13:06+00:00,2026-07-23T13:13:06+00:00,Equity,0.22471,0.08817,0.6891,0.50783,0.51106,0.022,-0.26,757036032,465294016,252274624,377353984,13964000,,3.501,2.152,652881984,1801084000,2861203000,534736000,,2.26,1.956,34.814,0.2199,0.87,0.11231,0.491,0.0199
HAIN,"The Hain Celestial Group, Inc.",0.57,51381304,770800,1188693,0.59,0.55,0.6,0.57,-0.02,-3.389827,0.59,2026-07-23,,,0.729,90253483,,-5.7,Consumer Defensive,Packaged Foods,"The Hain Celestial Group, Inc. manufactures, markets, and sells organic and natural products in the United States, United Kingdom, Europe, and internationally. The company offers infant formula; infant and toddler formula, infant cereals, baby food pouches, snacks and frozen toddler and kids' foods; plant-based beverages such as soy, rice, oat, cashew and spelt; and condiments, as well as meat-free dishes and meals. It also provides cooking and culinary oils, vinegars, and condiments; nutritional oils and supplements; broth and soups; yogurts; desserts and creamers; and nut butters. In addition, the company offers hot-eating desserts, refrigerated and frozen meat alternative snacks and meals, vegetables and lentils, jams, fruit spreads, jellies, honey, natural sweeteners, syrups, dessert sauces, and marmalade products, as well as other food products. Further, it provides snack products comprising potato, root vegetable and other exotic vegetable chip, straw, tortilla chip; and personal care products that include hand, skin, hair, and sun care, oral care products, as well as deodorant, baby food, sunscreen, and other products under the Alba Botanica, Avalon Organics, Earth's Best, JASON, Live Clean, and Queen Helene brand name. Additionally, the company offers herbal, green, black, wellness, rooibos, and chai tea under the Celestial Seasonings brand. It sells pantry products under the Spectrum, Spectrum Essentials, MaraNatha, Imagine broth, Hain Pure Foods, and Health Valley brands. It sells its products through specialty and natural food distributors, supermarkets, natural food stores, mass-market and e-commerce retailers, food service channels and clubs, and drug and convenience stores. The company was incorporated in 1993 and is headquartered in Hoboken, New Jersey.",NMS,Ms. Alison E. Lewis,United States,,false,false,true,https://www.hain.com,,USD,2600,Hoboken,NJ,516-587-5000,221 River Street,,2026-07-23T13:13:07+00:00,2026-07-23T13:13:07+00:00,Equity,-1.13037,0.01385,0.20173,0.02579,-0.35467,-0.133,,1453708032,83717000,122927000,-515588992,8149000,0.240312,7.179,0.413,595798976,475005000,1603278000,46152000,,0.522,0.222,276.414,0,1.22,0.02938,0.81114,0.0811
HIMS,"Hims & Hers Health, Inc.",31.68,7332579840,8269400,19187273,33.450001,31.450001,34,31.68,-1.049999,-3.208064,32.73,2026-07-23,,,2.342,223080072,,-0.09,Healthcare,Drug Manufacturers - Specialty & Generic,"Hims & Hers Health, Inc. operates as a consumer-first health and wellness platform that connects consumers to licensed healthcare professionals in the United States, the United Kingdom, Canada, Germany, the Republic of Ireland, France, Spain, and internationally. The company offers a range of curated prescription and non-prescription health and wellness products and services available to purchase on its websites and mobile application directly by customers. It also provides personalized health and wellness products; over-the-counter drug and device products, cosmetics, and supplement products primarily focusing on general wellness, skincare, sexual health and wellness, and hair care under the Hims & Hers brand name; and laboratory testing services to measure a set of biomarkers. Additionally, it offers medical consultation, post-consultation support services, and delivery of laboratory testing results services. Further, the company provides treatments and products for various chronic conditions related to hormone health, weight loss, dermatology, and mental health. The company offers its products through retail partnerships, in stores, and online. Hims & Hers Health, Inc. is based in San Francisco, California.",NYQ,Mr. Andrew  Dudum,United States,,false,false,true,https://www.hims.com,,USD,2442,San Francisco,CA,415 851 0195,2269 Chestnut Street,,2026-07-23T13:13:09+00:00,2026-07-23T13:13:09+00:00,Equity,-0.02659,0.00603,0.72919,-0.07897,-0.00559,0.038,,2369731072,83416000,174305120,-13235000,135244000,16.380558,92.473,3.255,1132036992,540928000,2154705000,750875008,,1.689,1.455,253.725,0,2.1549,0.05508,0.70353,0.3182
